2022-12-24 10:00:02.607781 ens3  In  IP 192.168.10.4.80 > 192.168.10.3.53546: Flags [S.], seq 960507600, ack 2915381897, win 65160, options [mss 1460,sackOK,TS val 2240058396 ecr 1718172253,nop,wscale 7], length 0
2022-12-24 10:00:02.608092 ens3  In  IP 192.168.10.4.80 > 192.168.10.3.53546: Flags [.], ack 65, win 509, options [nop,nop,TS val 2240058396 ecr 1718172253], length 0
2022-12-24 10:00:02.608093 ens3  In  IP 192.168.10.4.80 > 192.168.10.3.53548: Flags [S.], seq 886861265, ack 3946763746, win 65160, options [mss 1460,sackOK,TS val 2240058396 ecr 1718172253,nop,wscale 7], length 0
2022-12-24 10:00:02.608348 ens3  In  IP 192.168.10.4.80 > 192.168.10.3.53546: Flags [.], seq 1:2897, ack 65, win 509, options [nop,nop,TS val 2240058397 ecr 1718172253], length 2896: HTTP: HTTP/1.1 206 Partial Content
2022-12-24 10:00:02.608465 ens3  In  IP 192.168.10.4.80 > 192.168.10.3.53546: Flags [P.], seq 2897:7241, ack 65, win 509, options [nop,nop,TS val 2240058397 ecr 1718172253], length 4344: HTTP
2022-12-24 10:00:02.608467 ens3  In  IP 192.168.10.4.80 > 192.168.10.3.53546: Flags [P.], seq 7241:14481, ack 65, win 509, options [nop,nop,TS val 2240058397 ecr 1718172253], length 7240: HTTP
2022-12-24 10:00:02.608515 ens3  In  IP 192.168.10.4.80 > 192.168.10.3.53548: Flags [.], ack 69, win 509, options [nop,nop,TS val 2240058397 ecr 1718172253], length 0
2022-12-24 10:00:02.608516 ens3  In  IP 192.168.10.4.80 > 192.168.10.3.53564: Flags [S.], seq 1539045817, ack 2170434338, win 65160, options [mss 1460,sackOK,TS val 2240058397 ecr 1718172253,nop,wscale 7], length 0
2022-12-24 10:00:02.608518 ens3  In  IP 192.168.10.4.80 > 192.168.10.3.53548: Flags [P.], seq 1:7241, ack 69, win 509, options [nop,nop,TS val 2240058397 ecr 1718172253], length 7240: HTTP: HTTP/1.1 206 Partial Content
2022-12-24 10:00:02.608618 ens3  In  IP 192.168.10.4.80 > 192.168.10.3.53548: Flags [P.], seq 7241:14481, ack 69, win 509, options [nop,nop,TS val 2240058397 ecr 1718172253], length 7240: HTTP
2022-12-24 10:00:02.608619 ens3  In  IP 192.168.10.4.80 > 192.168.10.3.53546: Flags [.], seq 14481:15929, ack 65, win 509, options [nop,nop,TS val 2240058397 ecr 1718172254], length 1448: HTTP
2022-12-24 10:00:02.608888 ens3  In  IP 192.168.10.4.80 > 192.168.10.3.53546: Flags [P.], seq 15929:20219, ack 65, win 509, options [nop,nop,TS val 2240058397 ecr 1718172254], length 4290: HTTP
2022-12-24 10:00:02.609290 ens3  In  IP 192.168.10.4.80 > 192.168.10.3.53548: Flags [P.], seq 14481:20223, ack 69, win 509, options [nop,nop,TS val 2240058397 ecr 1718172254], length 5742: HTTP
2022-12-24 10:00:02.609291 ens3  In  IP 192.168.10.4.80 > 192.168.10.3.53564: Flags [.], ack 69, win 509, options [nop,nop,TS val 2240058397 ecr 1718172254], length 0
2022-12-24 10:00:02.609292 ens3  In  IP 192.168.10.4.80 > 192.168.10.3.53570: Flags [S.], seq 3630263513, ack 2420536925, win 65160, options [mss 1460,sackOK,TS val 2240058397 ecr 1718172254,nop,wscale 7], length 0
2022-12-24 10:00:02.609294 ens3  In  IP 192.168.10.4.80 > 192.168.10.3.53564: Flags [P.], seq 1:7241, ack 69, win 509, options [nop,nop,TS val 2240058397 ecr 1718172254], length 7240: HTTP: HTTP/1.1 206 Partial Content
2022-12-24 10:00:02.609379 ens3  In  IP 192.168.10.4.80 > 192.168.10.3.53564: Flags [P.], seq 7241:14481, ack 69, win 509, options [nop,nop,TS val 2240058397 ecr 1718172254], length 7240: HTTP
2022-12-24 10:00:02.609379 ens3  In  IP 192.168.10.4.80 > 192.168.10.3.53546: Flags [.], ack 133, win 509, options [nop,nop,TS val 2240058398 ecr 1718172254], length 0
2022-12-24 10:00:02.609380 ens3  In  IP 192.168.10.4.80 > 192.168.10.3.53546: Flags [.], seq 20219:24563, ack 133, win 509, options [nop,nop,TS val 2240058398 ecr 1718172254], length 4344: HTTP: HTTP/1.1 206 Partial Content
2022-12-24 10:00:02.609532 ens3  In  IP 192.168.10.4.80 > 192.168.10.3.53546: Flags [P.], seq 24563:37595, ack 133, win 509, options [nop,nop,TS val 2240058398 ecr 1718172254], length 13032: HTTP
2022-12-24 10:00:02.609701 ens4  In  IP 192.168.20.4.80 > 192.168.20.3.47414: Flags [S.], seq 4050597008, ack 3645881082, win 65160, options [mss 1460,sackOK,TS val 3328185202 ecr 1715863332,nop,wscale 7], length 0
2022-12-24 10:00:02.609830 ens3  In  IP 192.168.10.4.80 > 192.168.10.3.53546: Flags [P.], seq 37595:40441, ack 133, win 509, options [nop,nop,TS val 2240058398 ecr 1718172254], length 2846: HTTP
2022-12-24 10:00:02.609831 ens3  In  IP 192.168.10.4.80 > 192.168.10.3.53564: Flags [P.], seq 14481:20223, ack 69, win 509, options [nop,nop,TS val 2240058398 ecr 1718172255], length 5742: HTTP
2022-12-24 10:00:02.609832 ens3  In  IP 192.168.10.4.80 > 192.168.10.3.53570: Flags [.], ack 69, win 509, options [nop,nop,TS val 2240058398 ecr 1718172255], length 0
2022-12-24 10:00:02.609834 ens3  In  IP 192.168.10.4.80 > 192.168.10.3.53570: Flags [P.], seq 1:7241, ack 69, win 509, options [nop,nop,TS val 2240058398 ecr 1718172255], length 7240: HTTP: HTTP/1.1 206 Partial Content
2022-12-24 10:00:02.609878 ens3  In  IP 192.168.10.4.80 > 192.168.10.3.53570: Flags [P.], seq 7241:14481, ack 69, win 509, options [nop,nop,TS val 2240058398 ecr 1718172255], length 7240: HTTP
2022-12-24 10:00:02.609879 ens3  In  IP 192.168.10.4.80 > 192.168.10.3.53548: Flags [.], ack 139, win 509, options [nop,nop,TS val 2240058398 ecr 1718172255], length 0
2022-12-24 10:00:02.609951 ens4  In  IP 192.168.20.4.80 > 192.168.20.3.47414: Flags [.], ack 71, win 509, options [nop,nop,TS val 3328185202 ecr 1715863332], length 0
2022-12-24 10:00:02.609951 ens4  In  IP 192.168.20.4.80 > 192.168.20.3.47426: Flags [S.], seq 446919551, ack 1526482187, win 65160, options [mss 1460,sackOK,TS val 3328185202 ecr 1715863332,nop,wscale 7], length 0
2022-12-24 10:00:02.610095 ens4  In  IP 192.168.20.4.80 > 192.168.20.3.47414: Flags [.], seq 1:2897, ack 71, win 509, options [nop,nop,TS val 3328185202 ecr 1715863332], length 2896: HTTP: HTTP/1.1 206 Partial Content
2022-12-24 10:00:02.610101 ens3  In  IP 192.168.10.4.80 > 192.168.10.3.53548: Flags [.], seq 20223:33255, ack 139, win 509, options [nop,nop,TS val 2240058398 ecr 1718172255], length 13032: HTTP: HTTP/1.1 206 Partial Content
2022-12-24 10:00:02.610149 ens4  In  IP 192.168.20.4.80 > 192.168.20.3.47414: Flags [P.], seq 2897:7241, ack 71, win 509, options [nop,nop,TS val 3328185202 ecr 1715863332], length 4344: HTTP
2022-12-24 10:00:02.610150 ens4  In  IP 192.168.20.4.80 > 192.168.20.3.47414: Flags [.], seq 7241:8689, ack 71, win 509, options [nop,nop,TS val 3328185202 ecr 1715863332], length 1448: HTTP
2022-12-24 10:00:02.610189 ens4  In  IP 192.168.20.4.80 > 192.168.20.3.47414: Flags [P.], seq 8689:14481, ack 71, win 509, options [nop,nop,TS val 3328185202 ecr 1715863332], length 5792: HTTP
2022-12-24 10:00:02.610190 ens4  In  IP 192.168.20.4.80 > 192.168.20.3.47426: Flags [.], ack 71, win 509, options [nop,nop,TS val 3328185202 ecr 1715863332], length 0
2022-12-24 10:00:02.610190 ens4  In  IP 192.168.20.4.80 > 192.168.20.3.47434: Flags [S.], seq 1141556871, ack 3255611222, win 65160, options [mss 1460,sackOK,TS val 3328185202 ecr 1715863332,nop,wscale 7], length 0
2022-12-24 10:00:02.610333 ens3  In  IP 192.168.10.4.80 > 192.168.10.3.53548: Flags [P.], seq 33255:34703, ack 139, win 509, options [nop,nop,TS val 2240058398 ecr 1718172255], length 1448: HTTP
2022-12-24 10:00:02.610335 ens3  In  IP 192.168.10.4.80 > 192.168.10.3.53548: Flags [P.], seq 34703:39047, ack 139, win 509, options [nop,nop,TS val 2240058398 ecr 1718172255], length 4344: HTTP
2022-12-24 10:00:02.610335 ens4  In  IP 192.168.20.4.80 > 192.168.20.3.47414: Flags [.], seq 14481:17377, ack 71, win 509, options [nop,nop,TS val 3328185203 ecr 1715863332], length 2896: HTTP
2022-12-24 10:00:02.610336 ens3  In  IP 192.168.10.4.80 > 192.168.10.3.53548: Flags [P.], seq 39047:40447, ack 139, win 509, options [nop,nop,TS val 2240058398 ecr 1718172255], length 1400: HTTP
2022-12-24 10:00:02.610337 ens3  In  IP 192.168.10.4.80 > 192.168.10.3.53570: Flags [P.], seq 14481:20223, ack 69, win 509, options [nop,nop,TS val 2240058398 ecr 1718172255], length 5742: HTTP
2022-12-24 10:00:02.610385 ens4  In  IP 192.168.20.4.80 > 192.168.20.3.47414: Flags [P.], seq 17377:20225, ack 71, win 509, options [nop,nop,TS val 3328185203 ecr 1715863332], length 2848: HTTP
2022-12-24 10:00:02.610386 ens4  In  IP 192.168.20.4.80 > 192.168.20.3.47426: Flags [.], seq 1:2897, ack 71, win 509, options [nop,nop,TS val 3328185203 ecr 1715863332], length 2896: HTTP: HTTP/1.1 206 Partial Content
2022-12-24 10:00:02.610435 ens4  In  IP 192.168.20.4.80 > 192.168.20.3.47426: Flags [P.], seq 2897:7241, ack 71, win 509, options [nop,nop,TS val 3328185203 ecr 1715863332], length 4344: HTTP
2022-12-24 10:00:02.610435 ens4  In  IP 192.168.20.4.80 > 192.168.20.3.47426: Flags [.], seq 7241:8689, ack 71, win 509, options [nop,nop,TS val 3328185203 ecr 1715863332], length 1448: HTTP
2022-12-24 10:00:02.610485 ens4  In  IP 192.168.20.4.80 > 192.168.20.3.47426: Flags [P.], seq 8689:14481, ack 71, win 509, options [nop,nop,TS val 3328185203 ecr 1715863332], length 5792: HTTP
2022-12-24 10:00:02.610533 ens4  In  IP 192.168.20.4.80 > 192.168.20.3.47434: Flags [.], ack 71, win 509, options [nop,nop,TS val 3328185203 ecr 1715863332], length 0
2022-12-24 10:00:02.610533 ens4  In  IP 192.168.20.4.80 > 192.168.20.3.47438: Flags [S.], seq 3792051245, ack 1443842000, win 65160, options [mss 1460,sackOK,TS val 3328185203 ecr 1715863332,nop,wscale 7], length 0
2022-12-24 10:00:02.610596 ens4  In  IP 192.168.20.4.80 > 192.168.20.3.47426: Flags [.], seq 14481:15929, ack 71, win 509, options [nop,nop,TS val 3328185203 ecr 1715863333], length 1448: HTTP
2022-12-24 10:00:02.610635 ens3  In  IP 192.168.10.4.80 > 192.168.10.3.53564: Flags [.], ack 139, win 509, options [nop,nop,TS val 2240058399 ecr 1718172255], length 0
2022-12-24 10:00:02.610646 ens3  In  IP 192.168.10.4.80 > 192.168.10.3.53564: Flags [P.], seq 20223:34703, ack 139, win 509, options [nop,nop,TS val 2240058399 ecr 1718172255], length 14480: HTTP: HTTP/1.1 206 Partial Content
2022-12-24 10:00:02.610654 ens4  In  IP 192.168.20.4.80 > 192.168.20.3.47426: Flags [P.], seq 15929:20225, ack 71, win 509, options [nop,nop,TS val 3328185203 ecr 1715863333], length 4296: HTTP
2022-12-24 10:00:02.610675 ens3  In  IP 192.168.10.4.80 > 192.168.10.3.53564: Flags [.], seq 34703:37599, ack 139, win 509, options [nop,nop,TS val 2240058399 ecr 1718172255], length 2896: HTTP
2022-12-24 10:00:02.610699 ens4  In  IP 192.168.20.4.80 > 192.168.20.3.47434: Flags [.], seq 1:2897, ack 71, win 509, options [nop,nop,TS val 3328185203 ecr 1715863332], length 2896: HTTP: HTTP/1.1 206 Partial Content
2022-12-24 10:00:02.610754 ens4  In  IP 192.168.20.4.80 > 192.168.20.3.47434: Flags [P.], seq 2897:7241, ack 71, win 509, options [nop,nop,TS val 3328185203 ecr 1715863332], length 4344: HTTP
2022-12-24 10:00:02.610755 ens4  In  IP 192.168.20.4.80 > 192.168.20.3.47434: Flags [.], seq 7241:8689, ack 71, win 509, options [nop,nop,TS val 3328185203 ecr 1715863332], length 1448: HTTP
2022-12-24 10:00:02.610801 ens4  In  IP 192.168.20.4.80 > 192.168.20.3.47434: Flags [P.], seq 8689:14481, ack 71, win 509, options [nop,nop,TS val 3328185203 ecr 1715863332], length 5792: HTTP
2022-12-24 10:00:02.610848 ens4  In  IP 192.168.20.4.80 > 192.168.20.3.47438: Flags [.], ack 71, win 509, options [nop,nop,TS val 3328185203 ecr 1715863333], length 0
2022-12-24 10:00:02.610874 ens3  In  IP 192.168.10.4.80 > 192.168.10.3.53564: Flags [P.], seq 37599:39047, ack 139, win 509, options [nop,nop,TS val 2240058399 ecr 1718172255], length 1448: HTTP
2022-12-24 10:00:02.610875 ens3  In  IP 192.168.10.4.80 > 192.168.10.3.53564: Flags [P.], seq 39047:40447, ack 139, win 509, options [nop,nop,TS val 2240058399 ecr 1718172255], length 1400: HTTP
2022-12-24 10:00:02.610875 ens3  In  IP 192.168.10.4.80 > 192.168.10.3.53546: Flags [.], ack 203, win 509, options [nop,nop,TS val 2240058399 ecr 1718172255], length 0
2022-12-24 10:00:02.610879 ens3  In  IP 192.168.10.4.80 > 192.168.10.3.53546: Flags [P.], seq 40441:59265, ack 203, win 509, options [nop,nop,TS val 2240058399 ecr 1718172255], length 18824: HTTP: HTTP/1.1 206 Partial Content
2022-12-24 10:00:02.610905 ens4  In  IP 192.168.20.4.80 > 192.168.20.3.47434: Flags [P.], seq 14481:20225, ack 71, win 509, options [nop,nop,TS val 3328185203 ecr 1715863333], length 5744: HTTP
2022-12-24 10:00:02.610911 ens3  In  IP 192.168.10.4.80 > 192.168.10.3.53546: Flags [P.], seq 59265:60665, ack 203, win 509, options [nop,nop,TS val 2240058399 ecr 1718172255], length 1400: HTTP
2022-12-24 10:00:02.610967 ens4  In  IP 192.168.20.4.80 > 192.168.20.3.47438: Flags [.], seq 1:4345, ack 71, win 509, options [nop,nop,TS val 3328185203 ecr 1715863333], length 4344: HTTP: HTTP/1.1 206 Partial Content
2022-12-24 10:00:02.611015 ens4  In  IP 192.168.20.4.80 > 192.168.20.3.47438: Flags [P.], seq 4345:7241, ack 71, win 509, options [nop,nop,TS val 3328185203 ecr 1715863333], length 2896: HTTP
2022-12-24 10:00:02.611016 ens4  In  IP 192.168.20.4.80 > 192.168.20.3.47438: Flags [.], seq 7241:10137, ack 71, win 509, options [nop,nop,TS val 3328185203 ecr 1715863333], length 2896: HTTP
2022-12-24 10:00:02.611063 ens4  In  IP 192.168.20.4.80 > 192.168.20.3.47438: Flags [.], seq 10137:11585, ack 71, win 509, options [nop,nop,TS val 3328185203 ecr 1715863333], length 1448: HTTP
2022-12-24 10:00:02.611116 ens4  In  IP 192.168.20.4.80 > 192.168.20.3.47438: Flags [P.], seq 11585:14481, ack 71, win 509, options [nop,nop,TS val 3328185203 ecr 1715863333], length 2896: HTTP
2022-12-24 10:00:02.611118 ens4  In  IP 192.168.20.4.80 > 192.168.20.3.47438: Flags [P.], seq 14481:20225, ack 71, win 509, options [nop,nop,TS val 3328185203 ecr 1715863333], length 5744: HTTP
2022-12-24 10:00:02.611121 ens3  In  IP 192.168.10.4.80 > 192.168.10.3.53548: Flags [.], ack 209, win 509, options [nop,nop,TS val 2240058399 ecr 1718172256], length 0
2022-12-24 10:00:02.611208 ens4  In  IP 192.168.20.4.80 > 192.168.20.3.47414: Flags [.], ack 141, win 509, options [nop,nop,TS val 3328185204 ecr 1715863333], length 0
2022-12-24 10:00:02.611261 ens4  In  IP 192.168.20.4.80 > 192.168.20.3.47426: Flags [.], ack 141, win 509, options [nop,nop,TS val 3328185204 ecr 1715863333], length 0
2022-12-24 10:00:02.611262 ens4  In  IP 192.168.20.4.80 > 192.168.20.3.47434: Flags [.], ack 141, win 509, options [nop,nop,TS val 3328185204 ecr 1715863333], length 0
2022-12-24 10:00:02.611420 ens3  In  IP 192.168.10.4.80 > 192.168.10.3.53548: Flags [P.], seq 40447:59271, ack 209, win 509, options [nop,nop,TS val 2240058399 ecr 1718172256], length 18824: HTTP: HTTP/1.1 206 Partial Content
2022-12-24 10:00:02.611432 ens4  In  IP 192.168.20.4.80 > 192.168.20.3.47434: Flags [.], seq 20225:23121, ack 141, win 509, options [nop,nop,TS val 3328185204 ecr 1715863333], length 2896: HTTP: HTTP/1.1 206 Partial Content
2022-12-24 10:00:02.611452 ens3  In  IP 192.168.10.4.80 > 192.168.10.3.53548: Flags [P.], seq 59271:60671, ack 209, win 509, options [nop,nop,TS val 2240058399 ecr 1718172256], length 1400: HTTP
2022-12-24 10:00:02.611452 ens3  In  IP 192.168.10.4.80 > 192.168.10.3.53570: Flags [.], ack 139, win 509, options [nop,nop,TS val 2240058400 ecr 1718172256], length 0
2022-12-24 10:00:02.611493 ens4  In  IP 192.168.20.4.80 > 192.168.20.3.47434: Flags [.], seq 23121:28913, ack 141, win 509, options [nop,nop,TS val 3328185204 ecr 1715863333], length 5792: HTTP
2022-12-24 10:00:02.611532 ens4  In  IP 192.168.20.4.80 > 192.168.20.3.47434: Flags [.], seq 28913:34705, ack 141, win 509, options [nop,nop,TS val 3328185204 ecr 1715863333], length 5792: HTTP
2022-12-24 10:00:02.611558 ens3  In  IP 192.168.10.4.80 > 192.168.10.3.53570: Flags [.], seq 20223:21671, ack 139, win 509, options [nop,nop,TS val 2240058400 ecr 1718172256], length 1448: HTTP: HTTP/1.1 206 Partial Content
2022-12-24 10:00:02.611580 ens4  In  IP 192.168.20.4.80 > 192.168.20.3.47434: Flags [P.], seq 34705:37601, ack 141, win 509, options [nop,nop,TS val 3328185204 ecr 1715863333], length 2896: HTTP
2022-12-24 10:00:02.611581 ens4  In  IP 192.168.20.4.80 > 192.168.20.3.47434: Flags [.], seq 37601:39049, ack 141, win 509, options [nop,nop,TS val 3328185204 ecr 1715863333], length 1448: HTTP
2022-12-24 10:00:02.611605 ens3  In  IP 192.168.10.4.80 > 192.168.10.3.53570: Flags [.], seq 21671:26015, ack 139, win 509, options [nop,nop,TS val 2240058400 ecr 1718172256], length 4344: HTTP
2022-12-24 10:00:02.611629 ens4  In  IP 192.168.20.4.80 > 192.168.20.3.47434: Flags [P.], seq 39049:40449, ack 141, win 509, options [nop,nop,TS val 3328185204 ecr 1715863333], length 1400: HTTP
2022-12-24 10:00:02.611687 ens4  In  IP 192.168.20.4.80 > 192.168.20.3.47426: Flags [.], seq 20225:28913, ack 141, win 509, options [nop,nop,TS val 3328185204 ecr 1715863333], length 8688: HTTP: HTTP/1.1 206 Partial Content
2022-12-24 10:00:02.611723 ens3  In  IP 192.168.10.4.80 > 192.168.10.3.53570: Flags [P.], seq 26015:34703, ack 139, win 509, options [nop,nop,TS val 2240058400 ecr 1718172256], length 8688: HTTP
2022-12-24 10:00:02.611724 ens3  In  IP 192.168.10.4.80 > 192.168.10.3.53570: Flags [P.], seq 34703:39047, ack 139, win 509, options [nop,nop,TS val 2240058400 ecr 1718172256], length 4344: HTTP
2022-12-24 10:00:02.611734 ens4  In  IP 192.168.20.4.80 > 192.168.20.3.47426: Flags [.], seq 28913:33257, ack 141, win 509, options [nop,nop,TS val 3328185204 ecr 1715863333], length 4344: HTTP
2022-12-24 10:00:02.611737 ens3  In  IP 192.168.10.4.80 > 192.168.10.3.53570: Flags [P.], seq 39047:40447, ack 139, win 509, options [nop,nop,TS val 2240058400 ecr 1718172256], length 1400: HTTP
2022-12-24 10:00:02.611737 ens3  In  IP 192.168.10.4.80 > 192.168.10.3.53546: Flags [.], ack 273, win 509, options [nop,nop,TS val 2240058400 ecr 1718172256], length 0
2022-12-24 10:00:02.611780 ens4  In  IP 192.168.20.4.80 > 192.168.20.3.47426: Flags [P.], seq 33257:37601, ack 141, win 509, options [nop,nop,TS val 3328185204 ecr 1715863333], length 4344: HTTP
2022-12-24 10:00:02.611803 ens3  In  IP 192.168.10.4.80 > 192.168.10.3.53546: Flags [.], seq 60665:69353, ack 273, win 509, options [nop,nop,TS val 2240058400 ecr 1718172256], length 8688: HTTP: HTTP/1.1 206 Partial Content
2022-12-24 10:00:02.611821 ens3  In  IP 192.168.10.4.80 > 192.168.10.3.53546: Flags [.], seq 69353:72249, ack 273, win 509, options [nop,nop,TS val 2240058400 ecr 1718172256], length 2896: HTTP
2022-12-24 10:00:02.611833 ens4  In  IP 192.168.20.4.80 > 192.168.20.3.47414: Flags [.], seq 20225:28913, ack 141, win 509, options [nop,nop,TS val 3328185204 ecr 1715863333], length 8688: HTTP: HTTP/1.1 206 Partial Content
2022-12-24 10:00:02.611880 ens4  In  IP 192.168.20.4.80 > 192.168.20.3.47414: Flags [.], seq 28913:31809, ack 141, win 509, options [nop,nop,TS val 3328185204 ecr 1715863333], length 2896: HTTP
2022-12-24 10:00:02.611935 ens4  In  IP 192.168.20.4.80 > 192.168.20.3.47414: Flags [P.], seq 31809:37601, ack 141, win 509, options [nop,nop,TS val 3328185204 ecr 1715863333], length 5792: HTTP
2022-12-24 10:00:02.611936 ens4  In  IP 192.168.20.4.80 > 192.168.20.3.47426: Flags [.], seq 37601:39049, ack 141, win 509, options [nop,nop,TS val 3328185204 ecr 1715863333], length 1448: HTTP
2022-12-24 10:00:02.611936 ens4  In  IP 192.168.20.4.80 > 192.168.20.3.47414: Flags [.], seq 37601:39049, ack 141, win 509, options [nop,nop,TS val 3328185204 ecr 1715863333], length 1448: HTTP
2022-12-24 10:00:02.611979 ens4  In  IP 192.168.20.4.80 > 192.168.20.3.47426: Flags [P.], seq 39049:40449, ack 141, win 509, options [nop,nop,TS val 3328185204 ecr 1715863333], length 1400: HTTP
2022-12-24 10:00:02.611980 ens4  In  IP 192.168.20.4.80 > 192.168.20.3.47414: Flags [P.], seq 39049:40449, ack 141, win 509, options [nop,nop,TS val 3328185204 ecr 1715863333], length 1400: HTTP
2022-12-24 10:00:02.611980 ens4  In  IP 192.168.20.4.80 > 192.168.20.3.47438: Flags [.], ack 141, win 509, options [nop,nop,TS val 3328185204 ecr 1715863334], length 0
2022-12-24 10:00:02.612044 ens4  In  IP 192.168.20.4.80 > 192.168.20.3.47438: Flags [.], seq 20225:24569, ack 141, win 509, options [nop,nop,TS val 3328185204 ecr 1715863334], length 4344: HTTP: HTTP/1.1 206 Partial Content
2022-12-24 10:00:02.612085 ens3  In  IP 192.168.10.4.80 > 192.168.10.3.53546: Flags [P.], seq 72249:79489, ack 273, win 509, options [nop,nop,TS val 2240058400 ecr 1718172256], length 7240: HTTP
2022-12-24 10:00:02.612086 ens3  In  IP 192.168.10.4.80 > 192.168.10.3.53546: Flags [P.], seq 79489:80889, ack 273, win 509, options [nop,nop,TS val 2240058400 ecr 1718172256], length 1400: HTTP
2022-12-24 10:00:02.612086 ens3  In  IP 192.168.10.4.80 > 192.168.10.3.53564: Flags [.], ack 209, win 509, options [nop,nop,TS val 2240058400 ecr 1718172257], length 0
2022-12-24 10:00:02.612090 ens3  In  IP 192.168.10.4.80 > 192.168.10.3.53564: Flags [P.], seq 40447:59271, ack 209, win 509, options [nop,nop,TS val 2240058400 ecr 1718172257], length 18824: HTTP: HTTP/1.1 206 Partial Content
2022-12-24 10:00:02.612095 ens4  In  IP 192.168.20.4.80 > 192.168.20.3.47438: Flags [.], seq 24569:30361, ack 141, win 509, options [nop,nop,TS val 3328185204 ecr 1715863334], length 5792: HTTP
2022-12-24 10:00:02.612105 ens3  In  IP 192.168.10.4.80 > 192.168.10.3.53564: Flags [P.], seq 59271:60671, ack 209, win 509, options [nop,nop,TS val 2240058400 ecr 1718172257], length 1400: HTTP
2022-12-24 10:00:02.612106 ens3  In  IP 192.168.10.4.80 > 192.168.10.3.53548: Flags [.], ack 279, win 509, options [nop,nop,TS val 2240058400 ecr 1718172257], length 0
2022-12-24 10:00:02.612145 ens4  In  IP 192.168.20.4.80 > 192.168.20.3.47438: Flags [.], seq 30361:36153, ack 141, win 509, options [nop,nop,TS val 3328185204 ecr 1715863334], length 5792: HTTP
2022-12-24 10:00:02.612158 ens3  In  IP 192.168.10.4.80 > 192.168.10.3.53548: Flags [.], seq 60671:65015, ack 279, win 509, options [nop,nop,TS val 2240058400 ecr 1718172257], length 4344: HTTP: HTTP/1.1 206 Partial Content
2022-12-24 10:00:02.612197 ens4  In  IP 192.168.20.4.80 > 192.168.20.3.47438: Flags [P.], seq 36153:37601, ack 141, win 509, options [nop,nop,TS val 3328185204 ecr 1715863334], length 1448: HTTP
2022-12-24 10:00:02.612198 ens4  In  IP 192.168.20.4.80 > 192.168.20.3.47438: Flags [P.], seq 37601:40449, ack 141, win 509, options [nop,nop,TS val 3328185204 ecr 1715863334], length 2848: HTTP
2022-12-24 10:00:02.612198 ens4  In  IP 192.168.20.4.80 > 192.168.20.3.47434: Flags [.], ack 211, win 509, options [nop,nop,TS val 3328185204 ecr 1715863334], length 0
2022-12-24 10:00:02.612249 ens4  In  IP 192.168.20.4.80 > 192.168.20.3.47434: Flags [.], seq 40449:47689, ack 211, win 509, options [nop,nop,TS val 3328185204 ecr 1715863334], length 7240: HTTP: HTTP/1.1 206 Partial Content
2022-12-24 10:00:02.612295 ens4  In  IP 192.168.20.4.80 > 192.168.20.3.47434: Flags [.], seq 47689:52033, ack 211, win 509, options [nop,nop,TS val 3328185204 ecr 1715863334], length 4344: HTTP
2022-12-24 10:00:02.612345 ens4  In  IP 192.168.20.4.80 > 192.168.20.3.47434: Flags [.], seq 52033:57825, ack 211, win 509, options [nop,nop,TS val 3328185204 ecr 1715863334], length 5792: HTTP
2022-12-24 10:00:02.612395 ens4  In  IP 192.168.20.4.80 > 192.168.20.3.47434: Flags [P.], seq 57825:59273, ack 211, win 509, options [nop,nop,TS val 3328185204 ecr 1715863334], length 1448: HTTP
2022-12-24 10:00:02.612395 ens4  In  IP 192.168.20.4.80 > 192.168.20.3.47434: Flags [P.], seq 59273:60673, ack 211, win 509, options [nop,nop,TS val 3328185204 ecr 1715863334], length 1400: HTTP
2022-12-24 10:00:02.612395 ens4  In  IP 192.168.20.4.80 > 192.168.20.3.47426: Flags [.], ack 211, win 509, options [nop,nop,TS val 3328185205 ecr 1715863334], length 0
2022-12-24 10:00:02.612396 ens4  In  IP 192.168.20.4.80 > 192.168.20.3.47426: Flags [.], seq 40449:43345, ack 211, win 509, options [nop,nop,TS val 3328185205 ecr 1715863334], length 2896: HTTP: HTTP/1.1 206 Partial Content
2022-12-24 10:00:02.612432 ens3  In  IP 192.168.10.4.80 > 192.168.10.3.53548: Flags [P.], seq 65015:79495, ack 279, win 509, options [nop,nop,TS val 2240058400 ecr 1718172257], length 14480: HTTP
2022-12-24 10:00:02.612445 ens3  In  IP 192.168.10.4.80 > 192.168.10.3.53548: Flags [P.], seq 79495:80895, ack 279, win 509, options [nop,nop,TS val 2240058400 ecr 1718172257], length 1400: HTTP
2022-12-24 10:00:02.612445 ens3  In  IP 192.168.10.4.80 > 192.168.10.3.53570: Flags [.], ack 209, win 509, options [nop,nop,TS val 2240058400 ecr 1718172257], length 0
2022-12-24 10:00:02.612450 ens3  In  IP 192.168.10.4.80 > 192.168.10.3.53570: Flags [P.], seq 40447:59271, ack 209, win 509, options [nop,nop,TS val 2240058400 ecr 1718172257], length 18824: HTTP: HTTP/1.1 206 Partial Content
2022-12-24 10:00:02.612448 ens4  In  IP 192.168.20.4.80 > 192.168.20.3.47426: Flags [.], seq 43345:47689, ack 211, win 509, options [nop,nop,TS val 3328185205 ecr 1715863334], length 4344: HTTP
2022-12-24 10:00:02.612496 ens4  In  IP 192.168.20.4.80 > 192.168.20.3.47426: Flags [.], seq 47689:56377, ack 211, win 509, options [nop,nop,TS val 3328185205 ecr 1715863334], length 8688: HTTP
2022-12-24 10:00:02.612544 ens4  In  IP 192.168.20.4.80 > 192.168.20.3.47426: Flags [P.], seq 56377:59273, ack 211, win 509, options [nop,nop,TS val 3328185205 ecr 1715863334], length 2896: HTTP
2022-12-24 10:00:02.612545 ens4  In  IP 192.168.20.4.80 > 192.168.20.3.47426: Flags [P.], seq 59273:60673, ack 211, win 509, options [nop,nop,TS val 3328185205 ecr 1715863334], length 1400: HTTP
2022-12-24 10:00:02.612545 ens4  In  IP 192.168.20.4.80 > 192.168.20.3.47438: Flags [.], ack 211, win 509, options [nop,nop,TS val 3328185205 ecr 1715863335], length 0
2022-12-24 10:00:02.612551 ens3  In  IP 192.168.10.4.80 > 192.168.10.3.53570: Flags [P.], seq 59271:60671, ack 209, win 509, options [nop,nop,TS val 2240058400 ecr 1718172257], length 1400: HTTP
2022-12-24 10:00:02.612650 ens4  In  IP 192.168.20.4.80 > 192.168.20.3.47438: Flags [.], seq 40449:44793, ack 211, win 509, options [nop,nop,TS val 3328185205 ecr 1715863335], length 4344: HTTP: HTTP/1.1 206 Partial Content
2022-12-24 10:00:02.612703 ens4  In  IP 192.168.20.4.80 > 192.168.20.3.47438: Flags [.], seq 44793:50585, ack 211, win 509, options [nop,nop,TS val 3328185205 ecr 1715863335], length 5792: HTTP
2022-12-24 10:00:02.612707 ens3  In  IP 192.168.10.4.80 > 192.168.10.3.53564: Flags [.], ack 279, win 509, options [nop,nop,TS val 2240058401 ecr 1718172258], length 0
2022-12-24 10:00:02.612749 ens4  In  IP 192.168.20.4.80 > 192.168.20.3.47438: Flags [.], seq 50585:54929, ack 211, win 509, options [nop,nop,TS val 3328185205 ecr 1715863335], length 4344: HTTP
2022-12-24 10:00:02.612757 ens3  In  IP 192.168.10.4.80 > 192.168.10.3.53564: Flags [.], seq 60671:63567, ack 279, win 509, options [nop,nop,TS val 2240058401 ecr 1718172258], length 2896: HTTP: HTTP/1.1 206 Partial Content
2022-12-24 10:00:02.612777 ens3  In  IP 192.168.10.4.80 > 192.168.10.3.53564: Flags [.], seq 63567:65015, ack 279, win 509, options [nop,nop,TS val 2240058401 ecr 1718172258], length 1448: HTTP
2022-12-24 10:00:02.612804 ens4  In  IP 192.168.20.4.80 > 192.168.20.3.47438: Flags [P.], seq 54929:59273, ack 211, win 509, options [nop,nop,TS val 3328185205 ecr 1715863335], length 4344: HTTP
2022-12-24 10:00:02.612805 ens4  In  IP 192.168.20.4.80 > 192.168.20.3.47438: Flags [P.], seq 59273:60673, ack 211, win 509, options [nop,nop,TS val 3328185205 ecr 1715863335], length 1400: HTTP
2022-12-24 10:00:02.612808 ens3  In  IP 192.168.10.4.80 > 192.168.10.3.53564: Flags [.], seq 65015:69359, ack 279, win 509, options [nop,nop,TS val 2240058401 ecr 1718172258], length 4344: HTTP
2022-12-24 10:00:02.612830 ens3  In  IP 192.168.10.4.80 > 192.168.10.3.53564: Flags [.], seq 69359:70807, ack 279, win 509, options [nop,nop,TS val 2240058401 ecr 1718172258], length 1448: HTTP
2022-12-24 10:00:02.612861 ens4  In  IP 192.168.20.4.80 > 192.168.20.3.47414: Flags [.], ack 211, win 509, options [nop,nop,TS val 3328185205 ecr 1715863335], length 0
2022-12-24 10:00:02.612885 ens3  In  IP 192.168.10.4.80 > 192.168.10.3.53564: Flags [.], seq 70807:75151, ack 279, win 509, options [nop,nop,TS val 2240058401 ecr 1718172258], length 4344: HTTP
2022-12-24 10:00:02.612933 ens3  In  IP 192.168.10.4.80 > 192.168.10.3.53564: Flags [P.], seq 75151:79495, ack 279, win 509, options [nop,nop,TS val 2240058401 ecr 1718172258], length 4344: HTTP
2022-12-24 10:00:02.612933 ens3  In  IP 192.168.10.4.80 > 192.168.10.3.53564: Flags [P.], seq 79495:80895, ack 279, win 509, options [nop,nop,TS val 2240058401 ecr 1718172258], length 1400: HTTP
2022-12-24 10:00:02.612940 ens4  In  IP 192.168.20.4.80 > 192.168.20.3.47414: Flags [.], seq 40449:43345, ack 211, win 509, options [nop,nop,TS val 3328185205 ecr 1715863335], length 2896: HTTP: HTTP/1.1 206 Partial Content
2022-12-24 10:00:02.612982 ens3  In  IP 192.168.10.4.80 > 192.168.10.3.53546: Flags [.], ack 343, win 509, options [nop,nop,TS val 2240058401 ecr 1718172258], length 0
2022-12-24 10:00:02.612984 ens3  In  IP 192.168.10.4.80 > 192.168.10.3.53546: Flags [.], seq 80889:88129, ack 343, win 509, options [nop,nop,TS val 2240058401 ecr 1718172258], length 7240: HTTP: HTTP/1.1 206 Partial Content
2022-12-24 10:00:02.612993 ens4  In  IP 192.168.20.4.80 > 192.168.20.3.47414: Flags [.], seq 43345:50585, ack 211, win 509, options [nop,nop,TS val 3328185205 ecr 1715863335], length 7240: HTTP
2022-12-24 10:00:02.613036 ens3  In  IP 192.168.10.4.80 > 192.168.10.3.53546: Flags [.], seq 88129:91025, ack 343, win 509, options [nop,nop,TS val 2240058401 ecr 1718172258], length 2896: HTTP
2022-12-24 10:00:02.613044 ens4  In  IP 192.168.20.4.80 > 192.168.20.3.47414: Flags [.], seq 50585:56377, ack 211, win 509, options [nop,nop,TS val 3328185205 ecr 1715863335], length 5792: HTTP
2022-12-24 10:00:02.613084 ens3  In  IP 192.168.10.4.80 > 192.168.10.3.53546: Flags [.], seq 91025:96817, ack 343, win 509, options [nop,nop,TS val 2240058401 ecr 1718172258], length 5792: HTTP
2022-12-24 10:00:02.613091 ens4  In  IP 192.168.20.4.80 > 192.168.20.3.47414: Flags [P.], seq 56377:59273, ack 211, win 509, options [nop,nop,TS val 3328185205 ecr 1715863335], length 2896: HTTP
2022-12-24 10:00:02.613092 ens4  In  IP 192.168.20.4.80 > 192.168.20.3.47414: Flags [P.], seq 59273:60673, ack 211, win 509, options [nop,nop,TS val 3328185205 ecr 1715863335], length 1400: HTTP
2022-12-24 10:00:02.613092 ens4  In  IP 192.168.20.4.80 > 192.168.20.3.47434: Flags [.], ack 281, win 509, options [nop,nop,TS val 3328185205 ecr 1715863335], length 0
2022-12-24 10:00:02.613140 ens3  In  IP 192.168.10.4.80 > 192.168.10.3.53546: Flags [P.], seq 96817:99713, ack 343, win 509, options [nop,nop,TS val 2240058401 ecr 1718172258], length 2896: HTTP
2022-12-24 10:00:02.613141 ens4  In  IP 192.168.20.4.80 > 192.168.20.3.47434: Flags [.], seq 60673:66465, ack 281, win 509, options [nop,nop,TS val 3328185205 ecr 1715863335], length 5792: HTTP: HTTP/1.1 206 Partial Content
2022-12-24 10:00:02.613141 ens3  In  IP 192.168.10.4.80 > 192.168.10.3.53546: Flags [P.], seq 99713:101113, ack 343, win 509, options [nop,nop,TS val 2240058401 ecr 1718172258], length 1400: HTTP
2022-12-24 10:00:02.613141 ens3  In  IP 192.168.10.4.80 > 192.168.10.3.53570: Flags [.], ack 279, win 509, options [nop,nop,TS val 2240058401 ecr 1718172258], length 0
2022-12-24 10:00:02.613142 ens3  In  IP 192.168.10.4.80 > 192.168.10.3.53570: Flags [.], seq 60671:66463, ack 279, win 509, options [nop,nop,TS val 2240058401 ecr 1718172258], length 5792: HTTP: HTTP/1.1 206 Partial Content
2022-12-24 10:00:02.613180 ens3  In  IP 192.168.10.4.80 > 192.168.10.3.53570: Flags [.], seq 66463:67911, ack 279, win 509, options [nop,nop,TS val 2240058401 ecr 1718172258], length 1448: HTTP
2022-12-24 10:00:02.613191 ens4  In  IP 192.168.20.4.80 > 192.168.20.3.47434: Flags [.], seq 66465:72257, ack 281, win 509, options [nop,nop,TS val 3328185205 ecr 1715863335], length 5792: HTTP
2022-12-24 10:00:02.613240 ens4  In  IP 192.168.20.4.80 > 192.168.20.3.47434: Flags [.], seq 72257:78049, ack 281, win 509, options [nop,nop,TS val 3328185205 ecr 1715863335], length 5792: HTTP
2022-12-24 10:00:02.613292 ens4  In  IP 192.168.20.4.80 > 192.168.20.3.47434: Flags [P.], seq 78049:79497, ack 281, win 509, options [nop,nop,TS val 3328185205 ecr 1715863335], length 1448: HTTP
2022-12-24 10:00:02.613293 ens4  In  IP 192.168.20.4.80 > 192.168.20.3.47434: Flags [P.], seq 79497:80897, ack 281, win 509, options [nop,nop,TS val 3328185205 ecr 1715863335], length 1400: HTTP
2022-12-24 10:00:02.613293 ens4  In  IP 192.168.20.4.80 > 192.168.20.3.47438: Flags [.], ack 281, win 509, options [nop,nop,TS val 3328185205 ecr 1715863335], length 0
2022-12-24 10:00:02.613294 ens4  In  IP 192.168.20.4.80 > 192.168.20.3.47438: Flags [.], seq 60673:62121, ack 281, win 509, options [nop,nop,TS val 3328185205 ecr 1715863335], length 1448: HTTP: HTTP/1.1 206 Partial Content
2022-12-24 10:00:02.613341 ens4  In  IP 192.168.20.4.80 > 192.168.20.3.47438: Flags [.], seq 62121:67913, ack 281, win 509, options [nop,nop,TS val 3328185205 ecr 1715863335], length 5792: HTTP
2022-12-24 10:00:02.613395 ens4  In  IP 192.168.20.4.80 > 192.168.20.3.47438: Flags [.], seq 67913:75153, ack 281, win 509, options [nop,nop,TS val 3328185205 ecr 1715863335], length 7240: HTTP
2022-12-24 10:00:02.613439 ens4  In  IP 192.168.20.4.80 > 192.168.20.3.47438: Flags [P.], seq 75153:79497, ack 281, win 509, options [nop,nop,TS val 3328185205 ecr 1715863335], length 4344: HTTP
2022-12-24 10:00:02.613443 ens3  In  IP 192.168.10.4.80 > 192.168.10.3.53570: Flags [P.], seq 67911:79495, ack 279, win 509, options [nop,nop,TS val 2240058401 ecr 1718172258], length 11584: HTTP
2022-12-24 10:00:02.613460 ens3  In  IP 192.168.10.4.80 > 192.168.10.3.53570: Flags [P.], seq 79495:80895, ack 279, win 509, options [nop,nop,TS val 2240058401 ecr 1718172258], length 1400: HTTP
2022-12-24 10:00:02.613460 ens3  In  IP 192.168.10.4.80 > 192.168.10.3.53548: Flags [.], ack 349, win 509, options [nop,nop,TS val 2240058401 ecr 1718172258], length 0
2022-12-24 10:00:02.613464 ens3  In  IP 192.168.10.4.80 > 192.168.10.3.53548: Flags [P.], seq 80895:99719, ack 349, win 509, options [nop,nop,TS val 2240058401 ecr 1718172258], length 18824: HTTP: HTTP/1.1 206 Partial Content
2022-12-24 10:00:02.613473 ens3  In  IP 192.168.10.4.80 > 192.168.10.3.53548: Flags [P.], seq 99719:101119, ack 349, win 509, options [nop,nop,TS val 2240058401 ecr 1718172258], length 1400: HTTP
2022-12-24 10:00:02.613473 ens3  In  IP 192.168.10.4.80 > 192.168.10.3.53564: Flags [.], ack 349, win 509, options [nop,nop,TS val 2240058402 ecr 1718172258], length 0
2022-12-24 10:00:02.613474 ens3  In  IP 192.168.10.4.80 > 192.168.10.3.53564: Flags [.], seq 80895:83791, ack 349, win 509, options [nop,nop,TS val 2240058402 ecr 1718172258], length 2896: HTTP: HTTP/1.1 206 Partial Content
2022-12-24 10:00:02.613492 ens4  In  IP 192.168.20.4.80 > 192.168.20.3.47438: Flags [P.], seq 79497:80897, ack 281, win 509, options [nop,nop,TS val 3328185205 ecr 1715863335], length 1400: HTTP
2022-12-24 10:00:02.613493 ens4  In  IP 192.168.20.4.80 > 192.168.20.3.47426: Flags [.], ack 281, win 509, options [nop,nop,TS val 3328185205 ecr 1715863335], length 0
2022-12-24 10:00:02.613494 ens4  In  IP 192.168.20.4.80 > 192.168.20.3.47426: Flags [.], seq 60673:63569, ack 281, win 509, options [nop,nop,TS val 3328185205 ecr 1715863335], length 2896: HTTP: HTTP/1.1 206 Partial Content
2022-12-24 10:00:02.613540 ens4  In  IP 192.168.20.4.80 > 192.168.20.3.47426: Flags [.], seq 63569:69361, ack 281, win 509, options [nop,nop,TS val 3328185205 ecr 1715863335], length 5792: HTTP
2022-12-24 10:00:02.613559 ens3  In  IP 192.168.10.4.80 > 192.168.10.3.53564: Flags [.], seq 83791:93927, ack 349, win 509, options [nop,nop,TS val 2240058402 ecr 1718172258], length 10136: HTTP
2022-12-24 10:00:02.613592 ens4  In  IP 192.168.20.4.80 > 192.168.20.3.47426: Flags [P.], seq 69361:79497, ack 281, win 509, options [nop,nop,TS val 3328185205 ecr 1715863335], length 10136: HTTP
2022-12-24 10:00:02.613592 ens4  In  IP 192.168.20.4.80 > 192.168.20.3.47414: Flags [.], ack 281, win 509, options [nop,nop,TS val 3328185206 ecr 1715863335], length 0
2022-12-24 10:00:02.613640 ens4  In  IP 192.168.20.4.80 > 192.168.20.3.47414: Flags [.], seq 60673:66465, ack 281, win 509, options [nop,nop,TS val 3328185206 ecr 1715863335], length 5792: HTTP: HTTP/1.1 206 Partial Content
2022-12-24 10:00:02.613655 ens4  In  IP 192.168.20.4.80 > 192.168.20.3.47414: Flags [.], seq 66465:67913, ack 281, win 509, options [nop,nop,TS val 3328185206 ecr 1715863335], length 1448: HTTP
2022-12-24 10:00:02.613822 ens3  In  IP 192.168.10.4.80 > 192.168.10.3.53564: Flags [P.], seq 93927:99719, ack 349, win 509, options [nop,nop,TS val 2240058402 ecr 1718172258], length 5792: HTTP
2022-12-24 10:00:02.613823 ens3  In  IP 192.168.10.4.80 > 192.168.10.3.53564: Flags [P.], seq 99719:101119, ack 349, win 509, options [nop,nop,TS val 2240058402 ecr 1718172258], length 1400: HTTP
2022-12-24 10:00:02.613823 ens3  In  IP 192.168.10.4.80 > 192.168.10.3.53546: Flags [.], ack 413, win 509, options [nop,nop,TS val 2240058402 ecr 1718172259], length 0
2022-12-24 10:00:02.613827 ens3  In  IP 192.168.10.4.80 > 192.168.10.3.53546: Flags [P.], seq 101113:119937, ack 413, win 509, options [nop,nop,TS val 2240058402 ecr 1718172259], length 18824: HTTP: HTTP/1.1 206 Partial Content
2022-12-24 10:00:02.613843 ens3  In  IP 192.168.10.4.80 > 192.168.10.3.53546: Flags [P.], seq 119937:121337, ack 413, win 509, options [nop,nop,TS val 2240058402 ecr 1718172259], length 1400: HTTP
2022-12-24 10:00:02.613843 ens3  In  IP 192.168.10.4.80 > 192.168.10.3.53570: Flags [.], ack 349, win 509, options [nop,nop,TS val 2240058402 ecr 1718172259], length 0
2022-12-24 10:00:02.613844 ens3  In  IP 192.168.10.4.80 > 192.168.10.3.53570: Flags [.], seq 80895:85239, ack 349, win 509, options [nop,nop,TS val 2240058402 ecr 1718172259], length 4344: HTTP: HTTP/1.1 206 Partial Content
2022-12-24 10:00:02.613908 ens4  In  IP 192.168.20.4.80 > 192.168.20.3.47414: Flags [P.], seq 67913:79497, ack 281, win 509, options [nop,nop,TS val 3328185206 ecr 1715863335], length 11584: HTTP
2022-12-24 10:00:02.613918 ens4  In  IP 192.168.20.4.80 > 192.168.20.3.47426: Flags [P.], seq 79497:80897, ack 281, win 509, options [nop,nop,TS val 3328185205 ecr 1715863335], length 1400: HTTP
2022-12-24 10:00:02.613919 ens4  In  IP 192.168.20.4.80 > 192.168.20.3.47414: Flags [P.], seq 79497:80897, ack 281, win 509, options [nop,nop,TS val 3328185206 ecr 1715863335], length 1400: HTTP
2022-12-24 10:00:02.614022 ens4  In  IP 192.168.20.4.80 > 192.168.20.3.47438: Flags [.], ack 351, win 509, options [nop,nop,TS val 3328185206 ecr 1715863336], length 0
2022-12-24 10:00:02.614062 ens3  In  IP 192.168.10.4.80 > 192.168.10.3.53570: Flags [P.], seq 85239:99719, ack 349, win 509, options [nop,nop,TS val 2240058402 ecr 1718172259], length 14480: HTTP
2022-12-24 10:00:02.614075 ens3  In  IP 192.168.10.4.80 > 192.168.10.3.53570: Flags [P.], seq 99719:101119, ack 349, win 509, options [nop,nop,TS val 2240058402 ecr 1718172259], length 1400: HTTP
2022-12-24 10:00:02.614111 ens4  In  IP 192.168.20.4.80 > 192.168.20.3.47438: Flags [.], seq 80897:85241, ack 351, win 509, options [nop,nop,TS val 3328185206 ecr 1715863336], length 4344: HTTP: HTTP/1.1 206 Partial Content
2022-12-24 10:00:02.614233 ens4  In  IP 192.168.20.4.80 > 192.168.20.3.47438: Flags [P.], seq 85241:99721, ack 351, win 509, options [nop,nop,TS val 3328185206 ecr 1715863336], length 14480: HTTP
2022-12-24 10:00:02.614306 ens4  In  IP 192.168.20.4.80 > 192.168.20.3.47438: Flags [P.], seq 99721:101121, ack 351, win 509, options [nop,nop,TS val 3328185206 ecr 1715863336], length 1400: HTTP
2022-12-24 10:00:02.614306 ens4  In  IP 192.168.20.4.80 > 192.168.20.3.47434: Flags [.], ack 351, win 509, options [nop,nop,TS val 3328185206 ecr 1715863336], length 0
