21:55:14.014121 IP 192.168.10.4.80 > 192.168.10.3.48104: Flags [S.], seq 2791424912, ack 2581533126, win 65160, options [mss 1460,sackOK,TS val 290858679 ecr 983483651,nop,wscale 7], length 0
21:55:14.022930 IP 192.168.10.4.80 > 192.168.10.3.48104: Flags [.], ack 65, win 509, options [nop,nop,TS val 290858688 ecr 983483659], length 0
21:55:14.022931 IP 192.168.10.4.80 > 192.168.10.3.48116: Flags [S.], seq 3624436263, ack 2062337101, win 65160, options [mss 1460,sackOK,TS val 290858688 ecr 983483659,nop,wscale 7], length 0
21:55:14.025133 IP 192.168.10.4.80 > 192.168.10.3.48104: Flags [P.], seq 1:2897, ack 65, win 509, options [nop,nop,TS val 290858688 ecr 983483659], length 2896: HTTP: HTTP/1.1 206 Partial Content
21:55:14.027148 IP 192.168.10.4.80 > 192.168.10.3.48104: Flags [.], seq 2897:4345, ack 65, win 509, options [nop,nop,TS val 290858688 ecr 983483659], length 1448: HTTP
21:55:14.027193 IP 192.168.10.4.80 > 192.168.10.3.48104: Flags [P.], seq 4345:5793, ack 65, win 509, options [nop,nop,TS val 290858688 ecr 983483659], length 1448: HTTP
21:55:14.029167 IP 192.168.10.4.80 > 192.168.10.3.48104: Flags [.], seq 5793:7241, ack 65, win 509, options [nop,nop,TS val 290858688 ecr 983483659], length 1448: HTTP
21:55:14.029217 IP 192.168.10.4.80 > 192.168.10.3.48104: Flags [P.], seq 7241:8689, ack 65, win 509, options [nop,nop,TS val 290858688 ecr 983483659], length 1448: HTTP
21:55:14.031231 IP 192.168.10.4.80 > 192.168.10.3.48104: Flags [P.], seq 8689:11585, ack 65, win 509, options [nop,nop,TS val 290858688 ecr 983483659], length 2896: HTTP
21:55:14.033211 IP 192.168.10.4.80 > 192.168.10.3.48104: Flags [P.], seq 11585:14481, ack 65, win 509, options [nop,nop,TS val 290858688 ecr 983483659], length 2896: HTTP
21:55:14.033212 IP 192.168.10.4.80 > 192.168.10.3.48116: Flags [.], ack 69, win 509, options [nop,nop,TS val 290858697 ecr 983483668], length 0
21:55:14.035310 IP 192.168.10.4.80 > 192.168.10.3.48116: Flags [P.], seq 1:2897, ack 69, win 509, options [nop,nop,TS val 290858697 ecr 983483668], length 2896: HTTP: HTTP/1.1 206 Partial Content
21:55:14.037300 IP 192.168.10.4.80 > 192.168.10.3.48116: Flags [P.], seq 2897:5793, ack 69, win 509, options [nop,nop,TS val 290858697 ecr 983483668], length 2896: HTTP
21:55:14.039355 IP 192.168.10.4.80 > 192.168.10.3.48116: Flags [P.], seq 5793:8689, ack 69, win 509, options [nop,nop,TS val 290858697 ecr 983483668], length 2896: HTTP
21:55:14.041351 IP 192.168.10.4.80 > 192.168.10.3.48116: Flags [P.], seq 8689:11585, ack 69, win 509, options [nop,nop,TS val 290858697 ecr 983483668], length 2896: HTTP
21:55:14.043346 IP 192.168.10.4.80 > 192.168.10.3.48116: Flags [P.], seq 11585:14481, ack 69, win 509, options [nop,nop,TS val 290858697 ecr 983483668], length 2896: HTTP
21:55:14.045445 IP 192.168.10.4.80 > 192.168.10.3.48104: Flags [P.], seq 14481:17377, ack 65, win 509, options [nop,nop,TS val 290858699 ecr 983483670], length 2896: HTTP
21:55:14.047349 IP 192.168.10.4.80 > 192.168.10.3.48104: Flags [P.], seq 17377:20219, ack 65, win 509, options [nop,nop,TS val 290858699 ecr 983483670], length 2842: HTTP
21:55:14.049430 IP 192.168.10.4.80 > 192.168.10.3.48116: Flags [P.], seq 14481:17377, ack 69, win 509, options [nop,nop,TS val 290858709 ecr 983483681], length 2896: HTTP
21:55:14.051342 IP 192.168.10.4.80 > 192.168.10.3.48116: Flags [P.], seq 17377:20223, ack 69, win 509, options [nop,nop,TS val 290858709 ecr 983483681], length 2846: HTTP
21:55:14.056068 IP 192.168.10.4.80 > 192.168.10.3.48104: Flags [.], ack 133, win 509, options [nop,nop,TS val 290858721 ecr 983483693], length 0
21:55:14.059425 IP 192.168.10.4.80 > 192.168.10.3.48104: Flags [P.], seq 20219:24563, ack 133, win 509, options [nop,nop,TS val 290858722 ecr 983483693], length 4344: HTTP: HTTP/1.1 206 Partial Content
21:55:14.062427 IP 192.168.10.4.80 > 192.168.10.3.48104: Flags [.], seq 24563:27459, ack 133, win 509, options [nop,nop,TS val 290858722 ecr 983483693], length 2896: HTTP
21:55:14.062464 IP 192.168.10.4.80 > 192.168.10.3.48104: Flags [P.], seq 27459:28907, ack 133, win 509, options [nop,nop,TS val 290858722 ecr 983483693], length 1448: HTTP
21:55:14.065417 IP 192.168.10.4.80 > 192.168.10.3.48104: Flags [.], seq 28907:30355, ack 133, win 509, options [nop,nop,TS val 290858722 ecr 983483693], length 1448: HTTP
21:55:14.065457 IP 192.168.10.4.80 > 192.168.10.3.48104: Flags [P.], seq 30355:33251, ack 133, win 509, options [nop,nop,TS val 290858722 ecr 983483693], length 2896: HTTP
21:55:14.068463 IP 192.168.10.4.80 > 192.168.10.3.48104: Flags [.], seq 33251:36147, ack 133, win 509, options [nop,nop,TS val 290858722 ecr 983483693], length 2896: HTTP
21:55:14.068493 IP 192.168.10.4.80 > 192.168.10.3.48104: Flags [P.], seq 36147:37595, ack 133, win 509, options [nop,nop,TS val 290858722 ecr 983483693], length 1448: HTTP
21:55:14.069351 IP 192.168.10.4.80 > 192.168.10.3.48104: Flags [.], seq 37595:39043, ack 133, win 509, options [nop,nop,TS val 290858722 ecr 983483693], length 1448: HTTP
21:55:14.070312 IP 192.168.10.4.80 > 192.168.10.3.48104: Flags [P.], seq 39043:40441, ack 133, win 509, options [nop,nop,TS val 290858722 ecr 983483693], length 1398: HTTP
21:55:14.070313 IP 192.168.10.4.80 > 192.168.10.3.48116: Flags [.], ack 137, win 509, options [nop,nop,TS val 290858725 ecr 983483697], length 0
21:55:14.073431 IP 192.168.10.4.80 > 192.168.10.3.48116: Flags [P.], seq 20223:24567, ack 137, win 509, options [nop,nop,TS val 290858725 ecr 983483697], length 4344: HTTP: HTTP/1.1 206 Partial Content
21:55:14.076564 IP 192.168.10.4.80 > 192.168.10.3.48116: Flags [P.], seq 24567:28911, ack 137, win 509, options [nop,nop,TS val 290858725 ecr 983483697], length 4344: HTTP
21:55:14.079588 IP 192.168.10.4.80 > 192.168.10.3.48116: Flags [P.], seq 28911:33255, ack 137, win 509, options [nop,nop,TS val 290858725 ecr 983483697], length 4344: HTTP
21:55:14.082609 IP 192.168.10.4.80 > 192.168.10.3.48116: Flags [P.], seq 33255:37599, ack 137, win 509, options [nop,nop,TS val 290858725 ecr 983483697], length 4344: HTTP
21:55:14.083501 IP 192.168.10.4.80 > 192.168.10.3.48116: Flags [.], seq 37599:39047, ack 137, win 509, options [nop,nop,TS val 290858725 ecr 983483697], length 1448: HTTP
21:55:14.084466 IP 192.168.10.4.80 > 192.168.10.3.48116: Flags [P.], seq 39047:40445, ack 137, win 509, options [nop,nop,TS val 290858725 ecr 983483697], length 1398: HTTP
21:55:14.084467 IP 192.168.10.4.80 > 192.168.10.3.48104: Flags [.], ack 203, win 509, options [nop,nop,TS val 290858744 ecr 983483716], length 0
21:55:14.087535 IP 192.168.10.4.80 > 192.168.10.3.48104: Flags [P.], seq 40441:44785, ack 203, win 509, options [nop,nop,TS val 290858744 ecr 983483716], length 4344: HTTP: HTTP/1.1 206 Partial Content
21:55:14.090689 IP 192.168.10.4.80 > 192.168.10.3.48104: Flags [.], seq 44785:47681, ack 203, win 509, options [nop,nop,TS val 290858744 ecr 983483716], length 2896: HTTP
21:55:14.090718 IP 192.168.10.4.80 > 192.168.10.3.48104: Flags [P.], seq 47681:49129, ack 203, win 509, options [nop,nop,TS val 290858744 ecr 983483716], length 1448: HTTP
21:55:14.093761 IP 192.168.10.4.80 > 192.168.10.3.48104: Flags [P.], seq 49129:53473, ack 203, win 509, options [nop,nop,TS val 290858744 ecr 983483716], length 4344: HTTP
21:55:14.096752 IP 192.168.10.4.80 > 192.168.10.3.48104: Flags [.], seq 53473:56369, ack 203, win 509, options [nop,nop,TS val 290858744 ecr 983483716], length 2896: HTTP
21:55:14.096783 IP 192.168.10.4.80 > 192.168.10.3.48104: Flags [P.], seq 56369:57817, ack 203, win 509, options [nop,nop,TS val 290858744 ecr 983483716], length 1448: HTTP
21:55:14.097613 IP 192.168.10.4.80 > 192.168.10.3.48104: Flags [.], seq 57817:59265, ack 203, win 509, options [nop,nop,TS val 290858744 ecr 983483716], length 1448: HTTP
21:55:14.098616 IP 192.168.10.4.80 > 192.168.10.3.48104: Flags [P.], seq 59265:60665, ack 203, win 509, options [nop,nop,TS val 290858744 ecr 983483716], length 1400: HTTP
21:55:14.098617 IP 192.168.10.4.80 > 192.168.10.3.48116: Flags [.], ack 207, win 509, options [nop,nop,TS val 290858758 ecr 983483730], length 0
21:55:14.100802 IP 192.168.10.4.80 > 192.168.10.3.48116: Flags [P.], seq 40445:43341, ack 207, win 509, options [nop,nop,TS val 290858759 ecr 983483730], length 2896: HTTP: HTTP/1.1 206 Partial Content
21:55:14.102788 IP 192.168.10.4.80 > 192.168.10.3.48116: Flags [P.], seq 43341:46237, ack 207, win 509, options [nop,nop,TS val 290858759 ecr 983483730], length 2896: HTTP
21:55:14.104830 IP 192.168.10.4.80 > 192.168.10.3.48116: Flags [P.], seq 46237:49133, ack 207, win 509, options [nop,nop,TS val 290858759 ecr 983483730], length 2896: HTTP
21:55:14.106856 IP 192.168.10.4.80 > 192.168.10.3.48116: Flags [P.], seq 49133:52029, ack 207, win 509, options [nop,nop,TS val 290858759 ecr 983483730], length 2896: HTTP
21:55:14.108886 IP 192.168.10.4.80 > 192.168.10.3.48116: Flags [P.], seq 52029:54925, ack 207, win 509, options [nop,nop,TS val 290858759 ecr 983483730], length 2896: HTTP
21:55:14.110887 IP 192.168.10.4.80 > 192.168.10.3.48116: Flags [P.], seq 54925:57821, ack 207, win 509, options [nop,nop,TS val 290858759 ecr 983483730], length 2896: HTTP
21:55:14.111797 IP 192.168.10.4.80 > 192.168.10.3.48116: Flags [.], seq 57821:59269, ack 207, win 509, options [nop,nop,TS val 290858759 ecr 983483730], length 1448: HTTP
21:55:14.112838 IP 192.168.10.4.80 > 192.168.10.3.48116: Flags [P.], seq 59269:60669, ack 207, win 509, options [nop,nop,TS val 290858759 ecr 983483730], length 1400: HTTP
21:55:14.112839 IP 192.168.10.4.80 > 192.168.10.3.48104: Flags [.], ack 273, win 509, options [nop,nop,TS val 290858773 ecr 983483744], length 0
21:55:14.114922 IP 192.168.10.4.80 > 192.168.10.3.48104: Flags [P.], seq 60665:63561, ack 273, win 509, options [nop,nop,TS val 290858773 ecr 983483744], length 2896: HTTP: HTTP/1.1 206 Partial Content
21:55:14.116931 IP 192.168.10.4.80 > 192.168.10.3.48104: Flags [P.], seq 63561:66457, ack 273, win 509, options [nop,nop,TS val 290858773 ecr 983483744], length 2896: HTTP
21:55:14.118979 IP 192.168.10.4.80 > 192.168.10.3.48104: Flags [P.], seq 66457:69353, ack 273, win 509, options [nop,nop,TS val 290858773 ecr 983483744], length 2896: HTTP
21:55:14.120876 IP 192.168.10.4.80 > 192.168.10.3.48104: Flags [P.], seq 69353:72249, ack 273, win 509, options [nop,nop,TS val 290858773 ecr 983483744], length 2896: HTTP
21:55:14.122966 IP 192.168.10.4.80 > 192.168.10.3.48104: Flags [P.], seq 72249:75145, ack 273, win 509, options [nop,nop,TS val 290858773 ecr 983483744], length 2896: HTTP
21:55:14.124996 IP 192.168.10.4.80 > 192.168.10.3.48104: Flags [P.], seq 75145:78041, ack 273, win 509, options [nop,nop,TS val 290858773 ecr 983483744], length 2896: HTTP
21:55:14.125947 IP 192.168.10.4.80 > 192.168.10.3.48104: Flags [.], seq 78041:79489, ack 273, win 509, options [nop,nop,TS val 290858773 ecr 983483744], length 1448: HTTP
21:55:14.126982 IP 192.168.10.4.80 > 192.168.10.3.48104: Flags [P.], seq 79489:80889, ack 273, win 509, options [nop,nop,TS val 290858773 ecr 983483744], length 1400: HTTP
21:55:14.126983 IP 192.168.10.4.80 > 192.168.10.3.48116: Flags [.], ack 277, win 509, options [nop,nop,TS val 290858787 ecr 983483758], length 0
21:55:14.129092 IP 192.168.10.4.80 > 192.168.10.3.48116: Flags [P.], seq 60669:63565, ack 277, win 509, options [nop,nop,TS val 290858787 ecr 983483758], length 2896: HTTP: HTTP/1.1 206 Partial Content
21:55:14.130981 IP 192.168.10.4.80 > 192.168.10.3.48116: Flags [P.], seq 63565:66461, ack 277, win 509, options [nop,nop,TS val 290858787 ecr 983483758], length 2896: HTTP
21:55:14.133104 IP 192.168.10.4.80 > 192.168.10.3.48116: Flags [P.], seq 66461:69357, ack 277, win 509, options [nop,nop,TS val 290858787 ecr 983483758], length 2896: HTTP
21:55:14.135101 IP 192.168.10.4.80 > 192.168.10.3.48116: Flags [P.], seq 69357:72253, ack 277, win 509, options [nop,nop,TS val 290858787 ecr 983483758], length 2896: HTTP
21:55:14.137135 IP 192.168.10.4.80 > 192.168.10.3.48116: Flags [P.], seq 72253:75149, ack 277, win 509, options [nop,nop,TS val 290858787 ecr 983483758], length 2896: HTTP
21:55:14.139165 IP 192.168.10.4.80 > 192.168.10.3.48116: Flags [P.], seq 75149:78045, ack 277, win 509, options [nop,nop,TS val 290858787 ecr 983483758], length 2896: HTTP
21:55:14.140057 IP 192.168.10.4.80 > 192.168.10.3.48116: Flags [.], seq 78045:79493, ack 277, win 509, options [nop,nop,TS val 290858787 ecr 983483758], length 1448: HTTP
21:55:14.141150 IP 192.168.10.4.80 > 192.168.10.3.48116: Flags [P.], seq 79493:80893, ack 277, win 509, options [nop,nop,TS val 290858787 ecr 983483758], length 1400: HTTP
21:55:14.143176 IP 192.168.10.4.80 > 192.168.10.3.48104: Flags [P.], seq 80889:83785, ack 343, win 509, options [nop,nop,TS val 290858801 ecr 983483772], length 2896: HTTP: HTTP/1.1 206 Partial Content
21:55:14.145168 IP 192.168.10.4.80 > 192.168.10.3.48104: Flags [P.], seq 83785:86681, ack 343, win 509, options [nop,nop,TS val 290858801 ecr 983483772], length 2896: HTTP
21:55:14.147210 IP 192.168.10.4.80 > 192.168.10.3.48104: Flags [P.], seq 86681:89577, ack 343, win 509, options [nop,nop,TS val 290858801 ecr 983483772], length 2896: HTTP
21:55:14.149246 IP 192.168.10.4.80 > 192.168.10.3.48104: Flags [P.], seq 89577:92473, ack 343, win 509, options [nop,nop,TS val 290858801 ecr 983483772], length 2896: HTTP
21:55:14.151238 IP 192.168.10.4.80 > 192.168.10.3.48104: Flags [P.], seq 92473:95369, ack 343, win 509, options [nop,nop,TS val 290858801 ecr 983483772], length 2896: HTTP
21:55:14.153306 IP 192.168.10.4.80 > 192.168.10.3.48104: Flags [P.], seq 95369:98265, ack 343, win 509, options [nop,nop,TS val 290858801 ecr 983483772], length 2896: HTTP
21:55:14.154151 IP 192.168.10.4.80 > 192.168.10.3.48104: Flags [.], seq 98265:99713, ack 343, win 509, options [nop,nop,TS val 290858801 ecr 983483772], length 1448: HTTP
21:55:14.155217 IP 192.168.10.4.80 > 192.168.10.3.48104: Flags [P.], seq 99713:101113, ack 343, win 509, options [nop,nop,TS val 290858801 ecr 983483772], length 1400: HTTP
21:55:14.157314 IP 192.168.10.4.80 > 192.168.10.3.48116: Flags [P.], seq 80893:83789, ack 347, win 509, options [nop,nop,TS val 290858815 ecr 983483786], length 2896: HTTP: HTTP/1.1 206 Partial Content
21:55:14.159293 IP 192.168.10.4.80 > 192.168.10.3.48116: Flags [P.], seq 83789:86685, ack 347, win 509, options [nop,nop,TS val 290858815 ecr 983483786], length 2896: HTTP
21:55:14.161338 IP 192.168.10.4.80 > 192.168.10.3.48116: Flags [P.], seq 86685:89581, ack 347, win 509, options [nop,nop,TS val 290858815 ecr 983483786], length 2896: HTTP
21:55:14.163350 IP 192.168.10.4.80 > 192.168.10.3.48116: Flags [P.], seq 89581:92477, ack 347, win 509, options [nop,nop,TS val 290858815 ecr 983483786], length 2896: HTTP
21:55:14.165362 IP 192.168.10.4.80 > 192.168.10.3.48116: Flags [P.], seq 92477:95373, ack 347, win 509, options [nop,nop,TS val 290858815 ecr 983483786], length 2896: HTTP
21:55:14.167343 IP 192.168.10.4.80 > 192.168.10.3.48116: Flags [P.], seq 95373:98269, ack 347, win 509, options [nop,nop,TS val 290858815 ecr 983483786], length 2896: HTTP
21:55:14.168254 IP 192.168.10.4.80 > 192.168.10.3.48116: Flags [.], seq 98269:99717, ack 347, win 509, options [nop,nop,TS val 290858815 ecr 983483786], length 1448: HTTP
21:55:14.169334 IP 192.168.10.4.80 > 192.168.10.3.48116: Flags [P.], seq 99717:101117, ack 347, win 509, options [nop,nop,TS val 290858815 ecr 983483786], length 1400: HTTP
21:55:14.171350 IP 192.168.10.4.80 > 192.168.10.3.48104: Flags [P.], seq 101113:104009, ack 413, win 509, options [nop,nop,TS val 290858829 ecr 983483801], length 2896: HTTP: HTTP/1.1 206 Partial Content
21:55:14.173418 IP 192.168.10.4.80 > 192.168.10.3.48104: Flags [P.], seq 104009:106905, ack 413, win 509, options [nop,nop,TS val 290858829 ecr 983483801], length 2896: HTTP
21:55:14.175363 IP 192.168.10.4.80 > 192.168.10.3.48104: Flags [P.], seq 106905:109801, ack 413, win 509, options [nop,nop,TS val 290858829 ecr 983483801], length 2896: HTTP
21:55:14.177465 IP 192.168.10.4.80 > 192.168.10.3.48104: Flags [P.], seq 109801:112697, ack 413, win 509, options [nop,nop,TS val 290858829 ecr 983483801], length 2896: HTTP
21:55:14.179413 IP 192.168.10.4.80 > 192.168.10.3.48104: Flags [P.], seq 112697:115593, ack 413, win 509, options [nop,nop,TS val 290858829 ecr 983483801], length 2896: HTTP
21:55:14.181472 IP 192.168.10.4.80 > 192.168.10.3.48104: Flags [P.], seq 115593:118489, ack 413, win 509, options [nop,nop,TS val 290858829 ecr 983483801], length 2896: HTTP
21:55:14.182354 IP 192.168.10.4.80 > 192.168.10.3.48104: Flags [.], seq 118489:119937, ack 413, win 509, options [nop,nop,TS val 290858829 ecr 983483801], length 1448: HTTP
21:55:14.183387 IP 192.168.10.4.80 > 192.168.10.3.48104: Flags [P.], seq 119937:121337, ack 413, win 509, options [nop,nop,TS val 290858829 ecr 983483801], length 1400: HTTP
21:55:14.185488 IP 192.168.10.4.80 > 192.168.10.3.48116: Flags [P.], seq 101117:104013, ack 417, win 509, options [nop,nop,TS val 290858843 ecr 983483815], length 2896: HTTP: HTTP/1.1 206 Partial Content
21:55:14.187452 IP 192.168.10.4.80 > 192.168.10.3.48116: Flags [P.], seq 104013:106909, ack 417, win 509, options [nop,nop,TS val 290858843 ecr 983483815], length 2896: HTTP
21:55:14.189535 IP 192.168.10.4.80 > 192.168.10.3.48116: Flags [P.], seq 106909:109805, ack 417, win 509, options [nop,nop,TS val 290858843 ecr 983483815], length 2896: HTTP
21:55:14.191487 IP 192.168.10.4.80 > 192.168.10.3.48116: Flags [P.], seq 109805:112701, ack 417, win 509, options [nop,nop,TS val 290858843 ecr 983483815], length 2896: HTTP
21:55:14.193586 IP 192.168.10.4.80 > 192.168.10.3.48116: Flags [P.], seq 112701:115597, ack 417, win 509, options [nop,nop,TS val 290858843 ecr 983483815], length 2896: HTTP
21:55:14.195533 IP 192.168.10.4.80 > 192.168.10.3.48116: Flags [P.], seq 115597:118493, ack 417, win 509, options [nop,nop,TS val 290858843 ecr 983483815], length 2896: HTTP
21:55:14.196451 IP 192.168.10.4.80 > 192.168.10.3.48116: Flags [.], seq 118493:119941, ack 417, win 509, options [nop,nop,TS val 290858843 ecr 983483815], length 1448: HTTP
21:55:14.197551 IP 192.168.10.4.80 > 192.168.10.3.48116: Flags [P.], seq 119941:121341, ack 417, win 509, options [nop,nop,TS val 290858843 ecr 983483815], length 1400: HTTP
21:55:14.199528 IP 192.168.10.4.80 > 192.168.10.3.48104: Flags [P.], seq 121337:124233, ack 483, win 509, options [nop,nop,TS val 290858857 ecr 983483829], length 2896: HTTP: HTTP/1.1 206 Partial Content
21:55:14.201639 IP 192.168.10.4.80 > 192.168.10.3.48104: Flags [P.], seq 124233:127129, ack 483, win 509, options [nop,nop,TS val 290858857 ecr 983483829], length 2896: HTTP
21:55:14.203557 IP 192.168.10.4.80 > 192.168.10.3.48104: Flags [P.], seq 127129:130025, ack 483, win 509, options [nop,nop,TS val 290858857 ecr 983483829], length 2896: HTTP
21:55:14.205638 IP 192.168.10.4.80 > 192.168.10.3.48104: Flags [P.], seq 130025:132921, ack 483, win 509, options [nop,nop,TS val 290858857 ecr 983483829], length 2896: HTTP
21:55:14.207603 IP 192.168.10.4.80 > 192.168.10.3.48104: Flags [P.], seq 132921:135817, ack 483, win 509, options [nop,nop,TS val 290858857 ecr 983483829], length 2896: HTTP
21:55:14.209671 IP 192.168.10.4.80 > 192.168.10.3.48104: Flags [P.], seq 135817:138713, ack 483, win 509, options [nop,nop,TS val 290858857 ecr 983483829], length 2896: HTTP
21:55:14.210549 IP 192.168.10.4.80 > 192.168.10.3.48104: Flags [.], seq 138713:140161, ack 483, win 509, options [nop,nop,TS val 290858857 ecr 983483829], length 1448: HTTP
21:55:14.211602 IP 192.168.10.4.80 > 192.168.10.3.48104: Flags [P.], seq 140161:141561, ack 483, win 509, options [nop,nop,TS val 290858857 ecr 983483829], length 1400: HTTP
21:55:14.213671 IP 192.168.10.4.80 > 192.168.10.3.48116: Flags [P.], seq 121341:124237, ack 487, win 509, options [nop,nop,TS val 290858872 ecr 983483843], length 2896: HTTP: HTTP/1.1 206 Partial Content
21:55:14.215646 IP 192.168.10.4.80 > 192.168.10.3.48116: Flags [P.], seq 124237:127133, ack 487, win 509, options [nop,nop,TS val 290858872 ecr 983483843], length 2896: HTTP
21:55:14.217737 IP 192.168.10.4.80 > 192.168.10.3.48116: Flags [P.], seq 127133:130029, ack 487, win 509, options [nop,nop,TS val 290858872 ecr 983483843], length 2896: HTTP
21:55:14.219704 IP 192.168.10.4.80 > 192.168.10.3.48116: Flags [P.], seq 130029:132925, ack 487, win 509, options [nop,nop,TS val 290858872 ecr 983483843], length 2896: HTTP
21:55:14.221749 IP 192.168.10.4.80 > 192.168.10.3.48116: Flags [P.], seq 132925:135821, ack 487, win 509, options [nop,nop,TS val 290858872 ecr 983483843], length 2896: HTTP
21:55:14.223743 IP 192.168.10.4.80 > 192.168.10.3.48116: Flags [P.], seq 135821:138717, ack 487, win 509, options [nop,nop,TS val 290858872 ecr 983483843], length 2896: HTTP
21:55:14.224675 IP 192.168.10.4.80 > 192.168.10.3.48116: Flags [.], seq 138717:140165, ack 487, win 509, options [nop,nop,TS val 290858872 ecr 983483843], length 1448: HTTP
21:55:14.225694 IP 192.168.10.4.80 > 192.168.10.3.48116: Flags [P.], seq 140165:141565, ack 487, win 509, options [nop,nop,TS val 290858872 ecr 983483843], length 1400: HTTP
21:55:14.227754 IP 192.168.10.4.80 > 192.168.10.3.48104: Flags [P.], seq 141561:144457, ack 553, win 509, options [nop,nop,TS val 290858886 ecr 983483857], length 2896: HTTP: HTTP/1.1 206 Partial Content
21:55:14.229782 IP 192.168.10.4.80 > 192.168.10.3.48104: Flags [P.], seq 144457:147353, ack 553, win 509, options [nop,nop,TS val 290858886 ecr 983483857], length 2896: HTTP
21:55:14.231791 IP 192.168.10.4.80 > 192.168.10.3.48104: Flags [P.], seq 147353:150249, ack 553, win 509, options [nop,nop,TS val 290858886 ecr 983483857], length 2896: HTTP
21:55:14.233809 IP 192.168.10.4.80 > 192.168.10.3.48104: Flags [P.], seq 150249:153145, ack 553, win 509, options [nop,nop,TS val 290858886 ecr 983483857], length 2896: HTTP
21:55:14.235838 IP 192.168.10.4.80 > 192.168.10.3.48104: Flags [P.], seq 153145:156041, ack 553, win 509, options [nop,nop,TS val 290858886 ecr 983483857], length 2896: HTTP
21:55:14.237866 IP 192.168.10.4.80 > 192.168.10.3.48104: Flags [P.], seq 156041:158937, ack 553, win 509, options [nop,nop,TS val 290858886 ecr 983483857], length 2896: HTTP
21:55:14.238751 IP 192.168.10.4.80 > 192.168.10.3.48104: Flags [.], seq 158937:160385, ack 553, win 509, options [nop,nop,TS val 290858886 ecr 983483857], length 1448: HTTP
21:55:14.239803 IP 192.168.10.4.80 > 192.168.10.3.48104: Flags [P.], seq 160385:161785, ack 553, win 509, options [nop,nop,TS val 290858886 ecr 983483857], length 1400: HTTP
21:55:14.241869 IP 192.168.10.4.80 > 192.168.10.3.48116: Flags [P.], seq 141565:144461, ack 557, win 509, options [nop,nop,TS val 290858900 ecr 983483871], length 2896: HTTP: HTTP/1.1 206 Partial Content
21:55:14.243874 IP 192.168.10.4.80 > 192.168.10.3.48116: Flags [P.], seq 144461:147357, ack 557, win 509, options [nop,nop,TS val 290858900 ecr 983483871], length 2896: HTTP
21:55:14.245786 IP 192.168.10.4.80 > 192.168.10.3.48116: Flags [P.], seq 147357:150253, ack 557, win 509, options [nop,nop,TS val 290858900 ecr 983483871], length 2896: HTTP
21:55:14.247791 IP 192.168.10.4.80 > 192.168.10.3.48116: Flags [P.], seq 150253:153149, ack 557, win 509, options [nop,nop,TS val 290858900 ecr 983483871], length 2896: HTTP
21:55:14.249819 IP 192.168.10.4.80 > 192.168.10.3.48116: Flags [P.], seq 153149:156045, ack 557, win 509, options [nop,nop,TS val 290858900 ecr 983483871], length 2896: HTTP
21:55:14.251837 IP 192.168.10.4.80 > 192.168.10.3.48116: Flags [P.], seq 156045:158941, ack 557, win 509, options [nop,nop,TS val 290858900 ecr 983483871], length 2896: HTTP
21:55:14.252849 IP 192.168.10.4.80 > 192.168.10.3.48116: Flags [.], seq 158941:160389, ack 557, win 509, options [nop,nop,TS val 290858900 ecr 983483871], length 1448: HTTP
21:55:14.253835 IP 192.168.10.4.80 > 192.168.10.3.48116: Flags [P.], seq 160389:161789, ack 557, win 509, options [nop,nop,TS val 290858900 ecr 983483871], length 1400: HTTP
21:55:14.255837 IP 192.168.10.4.80 > 192.168.10.3.48104: Flags [P.], seq 161785:164681, ack 623, win 509, options [nop,nop,TS val 290858914 ecr 983483885], length 2896: HTTP: HTTP/1.1 206 Partial Content
21:55:14.257863 IP 192.168.10.4.80 > 192.168.10.3.48104: Flags [P.], seq 164681:167577, ack 623, win 509, options [nop,nop,TS val 290858914 ecr 983483885], length 2896: HTTP
21:55:14.259879 IP 192.168.10.4.80 > 192.168.10.3.48104: Flags [P.], seq 167577:170473, ack 623, win 509, options [nop,nop,TS val 290858914 ecr 983483885], length 2896: HTTP
21:55:14.261894 IP 192.168.10.4.80 > 192.168.10.3.48104: Flags [P.], seq 170473:173369, ack 623, win 509, options [nop,nop,TS val 290858914 ecr 983483885], length 2896: HTTP
21:55:14.263916 IP 192.168.10.4.80 > 192.168.10.3.48104: Flags [P.], seq 173369:176265, ack 623, win 509, options [nop,nop,TS val 290858914 ecr 983483885], length 2896: HTTP
21:55:14.265934 IP 192.168.10.4.80 > 192.168.10.3.48104: Flags [P.], seq 176265:179161, ack 623, win 509, options [nop,nop,TS val 290858914 ecr 983483885], length 2896: HTTP
21:55:14.266959 IP 192.168.10.4.80 > 192.168.10.3.48104: Flags [.], seq 179161:180609, ack 623, win 509, options [nop,nop,TS val 290858914 ecr 983483885], length 1448: HTTP
21:55:14.267904 IP 192.168.10.4.80 > 192.168.10.3.48104: Flags [P.], seq 180609:182009, ack 623, win 509, options [nop,nop,TS val 290858914 ecr 983483885], length 1400: HTTP
21:55:14.269938 IP 192.168.10.4.80 > 192.168.10.3.48116: Flags [P.], seq 161789:164685, ack 627, win 509, options [nop,nop,TS val 290858928 ecr 983483899], length 2896: HTTP: HTTP/1.1 206 Partial Content
21:55:14.271913 IP 192.168.10.4.80 > 192.168.10.3.48116: Flags [P.], seq 164685:167581, ack 627, win 509, options [nop,nop,TS val 290858928 ecr 983483899], length 2896: HTTP
21:55:14.273976 IP 192.168.10.4.80 > 192.168.10.3.48116: Flags [P.], seq 167581:170477, ack 627, win 509, options [nop,nop,TS val 290858928 ecr 983483899], length 2896: HTTP
21:55:14.275950 IP 192.168.10.4.80 > 192.168.10.3.48116: Flags [P.], seq 170477:173373, ack 627, win 509, options [nop,nop,TS val 290858928 ecr 983483899], length 2896: HTTP
21:55:14.278018 IP 192.168.10.4.80 > 192.168.10.3.48116: Flags [P.], seq 173373:176269, ack 627, win 509, options [nop,nop,TS val 290858928 ecr 983483899], length 2896: HTTP
21:55:14.279989 IP 192.168.10.4.80 > 192.168.10.3.48116: Flags [P.], seq 176269:179165, ack 627, win 509, options [nop,nop,TS val 290858928 ecr 983483899], length 2896: HTTP
21:55:14.281066 IP 192.168.10.4.80 > 192.168.10.3.48116: Flags [.], seq 179165:180613, ack 627, win 509, options [nop,nop,TS val 290858928 ecr 983483899], length 1448: HTTP
21:55:14.282013 IP 192.168.10.4.80 > 192.168.10.3.48116: Flags [P.], seq 180613:182013, ack 627, win 509, options [nop,nop,TS val 290858928 ecr 983483899], length 1400: HTTP
21:55:14.283988 IP 192.168.10.4.80 > 192.168.10.3.48104: Flags [P.], seq 182009:184905, ack 693, win 509, options [nop,nop,TS val 290858942 ecr 983483913], length 2896: HTTP: HTTP/1.1 206 Partial Content
21:55:14.286058 IP 192.168.10.4.80 > 192.168.10.3.48104: Flags [P.], seq 184905:187801, ack 693, win 509, options [nop,nop,TS val 290858942 ecr 983483913], length 2896: HTTP
21:55:14.288024 IP 192.168.10.4.80 > 192.168.10.3.48104: Flags [P.], seq 187801:190697, ack 693, win 509, options [nop,nop,TS val 290858942 ecr 983483913], length 2896: HTTP
21:55:14.290095 IP 192.168.10.4.80 > 192.168.10.3.48104: Flags [P.], seq 190697:193593, ack 693, win 509, options [nop,nop,TS val 290858942 ecr 983483913], length 2896: HTTP
21:55:14.292065 IP 192.168.10.4.80 > 192.168.10.3.48104: Flags [P.], seq 193593:196489, ack 693, win 509, options [nop,nop,TS val 290858942 ecr 983483913], length 2896: HTTP
21:55:14.294131 IP 192.168.10.4.80 > 192.168.10.3.48104: Flags [P.], seq 196489:199385, ack 693, win 509, options [nop,nop,TS val 290858942 ecr 983483913], length 2896: HTTP
21:55:14.295165 IP 192.168.10.4.80 > 192.168.10.3.48104: Flags [.], seq 199385:200833, ack 693, win 509, options [nop,nop,TS val 290858942 ecr 983483913], length 1448: HTTP
21:55:14.296063 IP 192.168.10.4.80 > 192.168.10.3.48104: Flags [P.], seq 200833:202233, ack 693, win 509, options [nop,nop,TS val 290858942 ecr 983483913], length 1400: HTTP
21:55:14.298144 IP 192.168.10.4.80 > 192.168.10.3.48116: Flags [P.], seq 182013:184909, ack 697, win 509, options [nop,nop,TS val 290858956 ecr 983483927], length 2896: HTTP: HTTP/1.1 206 Partial Content
21:55:14.300137 IP 192.168.10.4.80 > 192.168.10.3.48116: Flags [P.], seq 184909:187805, ack 697, win 509, options [nop,nop,TS val 290858956 ecr 983483927], length 2896: HTTP
21:55:14.302176 IP 192.168.10.4.80 > 192.168.10.3.48116: Flags [P.], seq 187805:190701, ack 697, win 509, options [nop,nop,TS val 290858956 ecr 983483927], length 2896: HTTP
21:55:14.304171 IP 192.168.10.4.80 > 192.168.10.3.48116: Flags [P.], seq 190701:193597, ack 697, win 509, options [nop,nop,TS val 290858956 ecr 983483927], length 2896: HTTP
21:55:14.306212 IP 192.168.10.4.80 > 192.168.10.3.48116: Flags [P.], seq 193597:196493, ack 697, win 509, options [nop,nop,TS val 290858956 ecr 983483927], length 2896: HTTP
21:55:14.308213 IP 192.168.10.4.80 > 192.168.10.3.48116: Flags [P.], seq 196493:199389, ack 697, win 509, options [nop,nop,TS val 290858956 ecr 983483927], length 2896: HTTP
21:55:14.309241 IP 192.168.10.4.80 > 192.168.10.3.48116: Flags [.], seq 199389:200837, ack 697, win 509, options [nop,nop,TS val 290858956 ecr 983483927], length 1448: HTTP
21:55:14.310207 IP 192.168.10.4.80 > 192.168.10.3.48116: Flags [P.], seq 200837:202237, ack 697, win 509, options [nop,nop,TS val 290858956 ecr 983483927], length 1400: HTTP
21:55:14.312213 IP 192.168.10.4.80 > 192.168.10.3.48104: Flags [P.], seq 202233:205129, ack 763, win 509, options [nop,nop,TS val 290858970 ecr 983483941], length 2896: HTTP: HTTP/1.1 206 Partial Content
21:55:14.314259 IP 192.168.10.4.80 > 192.168.10.3.48104: Flags [P.], seq 205129:208025, ack 763, win 509, options [nop,nop,TS val 290858970 ecr 983483941], length 2896: HTTP
21:55:14.316252 IP 192.168.10.4.80 > 192.168.10.3.48104: Flags [P.], seq 208025:210921, ack 763, win 509, options [nop,nop,TS val 290858970 ecr 983483941], length 2896: HTTP
21:55:14.318293 IP 192.168.10.4.80 > 192.168.10.3.48104: Flags [P.], seq 210921:213817, ack 763, win 509, options [nop,nop,TS val 290858970 ecr 983483941], length 2896: HTTP
21:55:14.320309 IP 192.168.10.4.80 > 192.168.10.3.48104: Flags [P.], seq 213817:216713, ack 763, win 509, options [nop,nop,TS val 290858970 ecr 983483941], length 2896: HTTP
21:55:14.322328 IP 192.168.10.4.80 > 192.168.10.3.48104: Flags [P.], seq 216713:219609, ack 763, win 509, options [nop,nop,TS val 290858970 ecr 983483941], length 2896: HTTP
21:55:14.323336 IP 192.168.10.4.80 > 192.168.10.3.48104: Flags [.], seq 219609:221057, ack 763, win 509, options [nop,nop,TS val 290858970 ecr 983483941], length 1448: HTTP
21:55:14.324291 IP 192.168.10.4.80 > 192.168.10.3.48104: Flags [P.], seq 221057:222457, ack 763, win 509, options [nop,nop,TS val 290858970 ecr 983483941], length 1400: HTTP
21:55:14.326333 IP 192.168.10.4.80 > 192.168.10.3.48116: Flags [P.], seq 202237:205133, ack 767, win 509, options [nop,nop,TS val 290858984 ecr 983483956], length 2896: HTTP: HTTP/1.1 206 Partial Content
21:55:14.328347 IP 192.168.10.4.80 > 192.168.10.3.48116: Flags [P.], seq 205133:208029, ack 767, win 509, options [nop,nop,TS val 290858984 ecr 983483956], length 2896: HTTP
21:55:14.330371 IP 192.168.10.4.80 > 192.168.10.3.48116: Flags [P.], seq 208029:210925, ack 767, win 509, options [nop,nop,TS val 290858984 ecr 983483956], length 2896: HTTP
21:55:14.332390 IP 192.168.10.4.80 > 192.168.10.3.48116: Flags [P.], seq 210925:213821, ack 767, win 509, options [nop,nop,TS val 290858984 ecr 983483956], length 2896: HTTP
21:55:14.334409 IP 192.168.10.4.80 > 192.168.10.3.48116: Flags [P.], seq 213821:216717, ack 767, win 509, options [nop,nop,TS val 290858984 ecr 983483956], length 2896: HTTP
21:55:14.336426 IP 192.168.10.4.80 > 192.168.10.3.48116: Flags [P.], seq 216717:219613, ack 767, win 509, options [nop,nop,TS val 290858984 ecr 983483956], length 2896: HTTP
21:55:14.337461 IP 192.168.10.4.80 > 192.168.10.3.48116: Flags [.], seq 219613:221061, ack 767, win 509, options [nop,nop,TS val 290858984 ecr 983483956], length 1448: HTTP
21:55:14.338407 IP 192.168.10.4.80 > 192.168.10.3.48116: Flags [P.], seq 221061:222461, ack 767, win 509, options [nop,nop,TS val 290858984 ecr 983483956], length 1400: HTTP
21:55:14.340430 IP 192.168.10.4.80 > 192.168.10.3.48104: Flags [P.], seq 222457:225353, ack 833, win 509, options [nop,nop,TS val 290858998 ecr 983483970], length 2896: HTTP: HTTP/1.1 206 Partial Content
21:55:14.342453 IP 192.168.10.4.80 > 192.168.10.3.48104: Flags [P.], seq 225353:228249, ack 833, win 509, options [nop,nop,TS val 290858998 ecr 983483970], length 2896: HTTP
21:55:14.344470 IP 192.168.10.4.80 > 192.168.10.3.48104: Flags [P.], seq 228249:231145, ack 833, win 509, options [nop,nop,TS val 290858998 ecr 983483970], length 2896: HTTP
21:55:14.346489 IP 192.168.10.4.80 > 192.168.10.3.48104: Flags [P.], seq 231145:234041, ack 833, win 509, options [nop,nop,TS val 290858998 ecr 983483970], length 2896: HTTP
21:55:14.348512 IP 192.168.10.4.80 > 192.168.10.3.48104: Flags [P.], seq 234041:236937, ack 833, win 509, options [nop,nop,TS val 290858998 ecr 983483970], length 2896: HTTP
21:55:14.350531 IP 192.168.10.4.80 > 192.168.10.3.48104: Flags [P.], seq 236937:239833, ack 833, win 509, options [nop,nop,TS val 290858998 ecr 983483970], length 2896: HTTP
21:55:14.351563 IP 192.168.10.4.80 > 192.168.10.3.48104: Flags [.], seq 239833:241281, ack 833, win 509, options [nop,nop,TS val 290858998 ecr 983483970], length 1448: HTTP
21:55:14.352504 IP 192.168.10.4.80 > 192.168.10.3.48104: Flags [P.], seq 241281:242681, ack 833, win 509, options [nop,nop,TS val 290858998 ecr 983483970], length 1400: HTTP
21:55:14.354532 IP 192.168.10.4.80 > 192.168.10.3.48116: Flags [P.], seq 222461:225357, ack 837, win 509, options [nop,nop,TS val 290859012 ecr 983483984], length 2896: HTTP: HTTP/1.1 206 Partial Content
21:55:14.356549 IP 192.168.10.4.80 > 192.168.10.3.48116: Flags [P.], seq 225357:228253, ack 837, win 509, options [nop,nop,TS val 290859012 ecr 983483984], length 2896: HTTP
21:55:14.358568 IP 192.168.10.4.80 > 192.168.10.3.48116: Flags [P.], seq 228253:231149, ack 837, win 509, options [nop,nop,TS val 290859012 ecr 983483984], length 2896: HTTP
21:55:14.360589 IP 192.168.10.4.80 > 192.168.10.3.48116: Flags [P.], seq 231149:234045, ack 837, win 509, options [nop,nop,TS val 290859012 ecr 983483984], length 2896: HTTP
21:55:14.362607 IP 192.168.10.4.80 > 192.168.10.3.48116: Flags [P.], seq 234045:236941, ack 837, win 509, options [nop,nop,TS val 290859012 ecr 983483984], length 2896: HTTP
21:55:14.364625 IP 192.168.10.4.80 > 192.168.10.3.48116: Flags [P.], seq 236941:239837, ack 837, win 509, options [nop,nop,TS val 290859012 ecr 983483984], length 2896: HTTP
21:55:14.365629 IP 192.168.10.4.80 > 192.168.10.3.48116: Flags [.], seq 239837:241285, ack 837, win 509, options [nop,nop,TS val 290859012 ecr 983483984], length 1448: HTTP
21:55:14.366605 IP 192.168.10.4.80 > 192.168.10.3.48116: Flags [P.], seq 241285:242685, ack 837, win 509, options [nop,nop,TS val 290859012 ecr 983483984], length 1400: HTTP
21:55:14.368634 IP 192.168.10.4.80 > 192.168.10.3.48104: Flags [P.], seq 242681:245577, ack 903, win 509, options [nop,nop,TS val 290859026 ecr 983483998], length 2896: HTTP: HTTP/1.1 206 Partial Content
21:55:14.370649 IP 192.168.10.4.80 > 192.168.10.3.48104: Flags [P.], seq 245577:248473, ack 903, win 509, options [nop,nop,TS val 290859026 ecr 983483998], length 2896: HTTP
21:55:14.372671 IP 192.168.10.4.80 > 192.168.10.3.48104: Flags [P.], seq 248473:251369, ack 903, win 509, options [nop,nop,TS val 290859026 ecr 983483998], length 2896: HTTP
21:55:14.374714 IP 192.168.10.4.80 > 192.168.10.3.48104: Flags [P.], seq 251369:254265, ack 903, win 509, options [nop,nop,TS val 290859026 ecr 983483998], length 2896: HTTP
21:55:14.376703 IP 192.168.10.4.80 > 192.168.10.3.48104: Flags [P.], seq 254265:257161, ack 903, win 509, options [nop,nop,TS val 290859026 ecr 983483998], length 2896: HTTP
21:55:14.378728 IP 192.168.10.4.80 > 192.168.10.3.48104: Flags [P.], seq 257161:260057, ack 903, win 509, options [nop,nop,TS val 290859026 ecr 983483998], length 2896: HTTP
21:55:14.379734 IP 192.168.10.4.80 > 192.168.10.3.48104: Flags [.], seq 260057:261505, ack 903, win 509, options [nop,nop,TS val 290859026 ecr 983483998], length 1448: HTTP
21:55:14.380703 IP 192.168.10.4.80 > 192.168.10.3.48104: Flags [P.], seq 261505:262905, ack 903, win 509, options [nop,nop,TS val 290859027 ecr 983483998], length 1400: HTTP
21:55:14.382733 IP 192.168.10.4.80 > 192.168.10.3.48116: Flags [P.], seq 242685:245581, ack 907, win 509, options [nop,nop,TS val 290859041 ecr 983484012], length 2896: HTTP: HTTP/1.1 206 Partial Content
21:55:14.384757 IP 192.168.10.4.80 > 192.168.10.3.48116: Flags [P.], seq 245581:248477, ack 907, win 509, options [nop,nop,TS val 290859041 ecr 983484012], length 2896: HTTP
21:55:14.386768 IP 192.168.10.4.80 > 192.168.10.3.48116: Flags [P.], seq 248477:251373, ack 907, win 509, options [nop,nop,TS val 290859041 ecr 983484012], length 2896: HTTP
21:55:14.388787 IP 192.168.10.4.80 > 192.168.10.3.48116: Flags [P.], seq 251373:254269, ack 907, win 509, options [nop,nop,TS val 290859041 ecr 983484012], length 2896: HTTP
21:55:14.390805 IP 192.168.10.4.80 > 192.168.10.3.48116: Flags [P.], seq 254269:257165, ack 907, win 509, options [nop,nop,TS val 290859041 ecr 983484012], length 2896: HTTP
21:55:14.392822 IP 192.168.10.4.80 > 192.168.10.3.48116: Flags [P.], seq 257165:260061, ack 907, win 509, options [nop,nop,TS val 290859041 ecr 983484012], length 2896: HTTP
21:55:14.393836 IP 192.168.10.4.80 > 192.168.10.3.48116: Flags [.], seq 260061:261509, ack 907, win 509, options [nop,nop,TS val 290859041 ecr 983484012], length 1448: HTTP
21:55:14.394831 IP 192.168.10.4.80 > 192.168.10.3.48116: Flags [P.], seq 261509:262909, ack 907, win 509, options [nop,nop,TS val 290859041 ecr 983484012], length 1400: HTTP
21:55:14.396830 IP 192.168.10.4.80 > 192.168.10.3.48104: Flags [P.], seq 262905:265801, ack 973, win 509, options [nop,nop,TS val 290859055 ecr 983484026], length 2896: HTTP: HTTP/1.1 206 Partial Content
21:55:14.398844 IP 192.168.10.4.80 > 192.168.10.3.48104: Flags [P.], seq 265801:268697, ack 973, win 509, options [nop,nop,TS val 290859055 ecr 983484026], length 2896: HTTP
21:55:14.400856 IP 192.168.10.4.80 > 192.168.10.3.48104: Flags [P.], seq 268697:271593, ack 973, win 509, options [nop,nop,TS val 290859055 ecr 983484026], length 2896: HTTP
21:55:14.402886 IP 192.168.10.4.80 > 192.168.10.3.48104: Flags [P.], seq 271593:274489, ack 973, win 509, options [nop,nop,TS val 290859055 ecr 983484026], length 2896: HTTP
21:55:14.404908 IP 192.168.10.4.80 > 192.168.10.3.48104: Flags [P.], seq 274489:277385, ack 973, win 509, options [nop,nop,TS val 290859055 ecr 983484026], length 2896: HTTP
21:55:14.406921 IP 192.168.10.4.80 > 192.168.10.3.48104: Flags [P.], seq 277385:280281, ack 973, win 509, options [nop,nop,TS val 290859055 ecr 983484026], length 2896: HTTP
21:55:14.407940 IP 192.168.10.4.80 > 192.168.10.3.48104: Flags [.], seq 280281:281729, ack 973, win 509, options [nop,nop,TS val 290859055 ecr 983484026], length 1448: HTTP
21:55:14.408888 IP 192.168.10.4.80 > 192.168.10.3.48104: Flags [P.], seq 281729:283129, ack 973, win 509, options [nop,nop,TS val 290859055 ecr 983484026], length 1400: HTTP
21:55:14.410929 IP 192.168.10.4.80 > 192.168.10.3.48116: Flags [P.], seq 262909:265805, ack 977, win 509, options [nop,nop,TS val 290859069 ecr 983484040], length 2896: HTTP: HTTP/1.1 206 Partial Content
21:55:14.412938 IP 192.168.10.4.80 > 192.168.10.3.48116: Flags [P.], seq 265805:268701, ack 977, win 509, options [nop,nop,TS val 290859069 ecr 983484040], length 2896: HTTP
