21:55:15.084128 IP 192.168.20.4.80 > 192.168.20.3.37886: Flags [S.], seq 4182498682, ack 979823191, win 65160, options [mss 1460,sackOK,TS val 2631976612 ecr 981175798,nop,wscale 7], length 0
21:55:15.092664 IP 192.168.20.4.80 > 192.168.20.3.37886: Flags [.], ack 73, win 509, options [nop,nop,TS val 2631976621 ecr 981175806], length 0
21:55:15.092665 IP 192.168.20.4.80 > 192.168.20.3.37894: Flags [S.], seq 1763462056, ack 981968539, win 65160, options [mss 1460,sackOK,TS val 2631976621 ecr 981175806,nop,wscale 7], length 0
21:55:15.094759 IP 192.168.20.4.80 > 192.168.20.3.37886: Flags [P.], seq 1:2897, ack 73, win 509, options [nop,nop,TS val 2631976621 ecr 981175806], length 2896: HTTP: HTTP/1.1 206 Partial Content
21:55:15.096778 IP 192.168.20.4.80 > 192.168.20.3.37886: Flags [P.], seq 2897:5793, ack 73, win 509, options [nop,nop,TS val 2631976621 ecr 981175806], length 2896: HTTP
21:55:15.098797 IP 192.168.20.4.80 > 192.168.20.3.37886: Flags [P.], seq 5793:8689, ack 73, win 509, options [nop,nop,TS val 2631976621 ecr 981175806], length 2896: HTTP
21:55:15.100818 IP 192.168.20.4.80 > 192.168.20.3.37886: Flags [P.], seq 8689:11585, ack 73, win 509, options [nop,nop,TS val 2631976621 ecr 981175806], length 2896: HTTP
21:55:15.102834 IP 192.168.20.4.80 > 192.168.20.3.37886: Flags [P.], seq 11585:14481, ack 73, win 509, options [nop,nop,TS val 2631976621 ecr 981175806], length 2896: HTTP
21:55:15.102835 IP 192.168.20.4.80 > 192.168.20.3.37894: Flags [.], ack 73, win 509, options [nop,nop,TS val 2631976630 ecr 981175815], length 0
21:55:15.102835 IP 192.168.20.4.80 > 192.168.20.3.37910: Flags [S.], seq 1591620004, ack 4007260138, win 65160, options [mss 1460,sackOK,TS val 2631976630 ecr 981175815,nop,wscale 7], length 0
21:55:15.104914 IP 192.168.20.4.80 > 192.168.20.3.37894: Flags [P.], seq 1:2897, ack 73, win 509, options [nop,nop,TS val 2631976630 ecr 981175815], length 2896: HTTP: HTTP/1.1 206 Partial Content
21:55:15.106944 IP 192.168.20.4.80 > 192.168.20.3.37894: Flags [P.], seq 2897:5793, ack 73, win 509, options [nop,nop,TS val 2631976630 ecr 981175815], length 2896: HTTP
21:55:15.108986 IP 192.168.20.4.80 > 192.168.20.3.37894: Flags [P.], seq 5793:8689, ack 73, win 509, options [nop,nop,TS val 2631976630 ecr 981175815], length 2896: HTTP
21:55:15.110997 IP 192.168.20.4.80 > 192.168.20.3.37894: Flags [P.], seq 8689:11585, ack 73, win 509, options [nop,nop,TS val 2631976630 ecr 981175815], length 2896: HTTP
21:55:15.113008 IP 192.168.20.4.80 > 192.168.20.3.37894: Flags [P.], seq 11585:14481, ack 73, win 509, options [nop,nop,TS val 2631976630 ecr 981175815], length 2896: HTTP
21:55:15.115073 IP 192.168.20.4.80 > 192.168.20.3.37886: Flags [P.], seq 14481:17377, ack 73, win 509, options [nop,nop,TS val 2631976631 ecr 981175817], length 2896: HTTP
21:55:15.117020 IP 192.168.20.4.80 > 192.168.20.3.37886: Flags [P.], seq 17377:20227, ack 73, win 509, options [nop,nop,TS val 2631976631 ecr 981175817], length 2850: HTTP
21:55:15.117021 IP 192.168.20.4.80 > 192.168.20.3.37910: Flags [.], ack 73, win 509, options [nop,nop,TS val 2631976640 ecr 981175825], length 0
21:55:15.117021 IP 192.168.20.4.80 > 192.168.20.3.37924: Flags [S.], seq 1122374023, ack 459320332, win 65160, options [mss 1460,sackOK,TS val 2631976640 ecr 981175825,nop,wscale 7], length 0
21:55:15.119133 IP 192.168.20.4.80 > 192.168.20.3.37910: Flags [P.], seq 1:2897, ack 73, win 509, options [nop,nop,TS val 2631976640 ecr 981175825], length 2896: HTTP: HTTP/1.1 206 Partial Content
21:55:15.121132 IP 192.168.20.4.80 > 192.168.20.3.37910: Flags [P.], seq 2897:5793, ack 73, win 509, options [nop,nop,TS val 2631976640 ecr 981175825], length 2896: HTTP
21:55:15.123127 IP 192.168.20.4.80 > 192.168.20.3.37910: Flags [P.], seq 5793:8689, ack 73, win 509, options [nop,nop,TS val 2631976640 ecr 981175825], length 2896: HTTP
21:55:15.125165 IP 192.168.20.4.80 > 192.168.20.3.37910: Flags [P.], seq 8689:11585, ack 73, win 509, options [nop,nop,TS val 2631976640 ecr 981175825], length 2896: HTTP
21:55:15.127198 IP 192.168.20.4.80 > 192.168.20.3.37910: Flags [P.], seq 11585:14481, ack 73, win 509, options [nop,nop,TS val 2631976640 ecr 981175825], length 2896: HTTP
21:55:15.129221 IP 192.168.20.4.80 > 192.168.20.3.37894: Flags [P.], seq 14481:17377, ack 73, win 509, options [nop,nop,TS val 2631976642 ecr 981175827], length 2896: HTTP
21:55:15.131217 IP 192.168.20.4.80 > 192.168.20.3.37894: Flags [P.], seq 17377:20227, ack 73, win 509, options [nop,nop,TS val 2631976642 ecr 981175827], length 2850: HTTP
21:55:15.131218 IP 192.168.20.4.80 > 192.168.20.3.37924: Flags [.], ack 73, win 509, options [nop,nop,TS val 2631976654 ecr 981175839], length 0
21:55:15.131219 IP 192.168.20.4.80 > 192.168.20.3.37886: Flags [.], ack 141, win 509, options [nop,nop,TS val 2631976654 ecr 981175839], length 0
21:55:15.134325 IP 192.168.20.4.80 > 192.168.20.3.37886: Flags [.], seq 20227:23123, ack 141, win 509, options [nop,nop,TS val 2631976654 ecr 981175839], length 2896: HTTP: HTTP/1.1 206 Partial Content
21:55:15.134360 IP 192.168.20.4.80 > 192.168.20.3.37886: Flags [P.], seq 23123:24571, ack 141, win 509, options [nop,nop,TS val 2631976654 ecr 981175839], length 1448: HTTP
21:55:15.137381 IP 192.168.20.4.80 > 192.168.20.3.37886: Flags [P.], seq 24571:28915, ack 141, win 509, options [nop,nop,TS val 2631976654 ecr 981175839], length 4344: HTTP
21:55:15.140397 IP 192.168.20.4.80 > 192.168.20.3.37886: Flags [P.], seq 28915:33259, ack 141, win 509, options [nop,nop,TS val 2631976654 ecr 981175839], length 4344: HTTP
21:55:15.143389 IP 192.168.20.4.80 > 192.168.20.3.37886: Flags [.], seq 33259:34707, ack 141, win 509, options [nop,nop,TS val 2631976654 ecr 981175839], length 1448: HTTP
21:55:15.143425 IP 192.168.20.4.80 > 192.168.20.3.37886: Flags [P.], seq 34707:37603, ack 141, win 509, options [nop,nop,TS val 2631976654 ecr 981175839], length 2896: HTTP
21:55:15.144398 IP 192.168.20.4.80 > 192.168.20.3.37886: Flags [.], seq 37603:39051, ack 141, win 509, options [nop,nop,TS val 2631976654 ecr 981175839], length 1448: HTTP
21:55:15.145360 IP 192.168.20.4.80 > 192.168.20.3.37886: Flags [P.], seq 39051:40449, ack 141, win 509, options [nop,nop,TS val 2631976654 ecr 981175839], length 1398: HTTP
21:55:15.147409 IP 192.168.20.4.80 > 192.168.20.3.37924: Flags [P.], seq 1:2897, ack 73, win 509, options [nop,nop,TS val 2631976654 ecr 981175839], length 2896: HTTP: HTTP/1.1 206 Partial Content
21:55:15.149420 IP 192.168.20.4.80 > 192.168.20.3.37924: Flags [P.], seq 2897:5793, ack 73, win 509, options [nop,nop,TS val 2631976654 ecr 981175839], length 2896: HTTP
21:55:15.151439 IP 192.168.20.4.80 > 192.168.20.3.37924: Flags [P.], seq 5793:8689, ack 73, win 509, options [nop,nop,TS val 2631976654 ecr 981175839], length 2896: HTTP
21:55:15.153475 IP 192.168.20.4.80 > 192.168.20.3.37924: Flags [P.], seq 8689:11585, ack 73, win 509, options [nop,nop,TS val 2631976654 ecr 981175839], length 2896: HTTP
21:55:15.155480 IP 192.168.20.4.80 > 192.168.20.3.37924: Flags [P.], seq 11585:14481, ack 73, win 509, options [nop,nop,TS val 2631976654 ecr 981175839], length 2896: HTTP
21:55:15.157506 IP 192.168.20.4.80 > 192.168.20.3.37910: Flags [P.], seq 14481:17377, ack 73, win 509, options [nop,nop,TS val 2631976656 ecr 981175841], length 2896: HTTP
21:55:15.159483 IP 192.168.20.4.80 > 192.168.20.3.37910: Flags [P.], seq 17377:20227, ack 73, win 509, options [nop,nop,TS val 2631976656 ecr 981175841], length 2850: HTTP
21:55:15.159484 IP 192.168.20.4.80 > 192.168.20.3.37894: Flags [.], ack 145, win 509, options [nop,nop,TS val 2631976670 ecr 981175855], length 0
21:55:15.162546 IP 192.168.20.4.80 > 192.168.20.3.37894: Flags [.], seq 20227:21675, ack 145, win 509, options [nop,nop,TS val 2631976670 ecr 981175855], length 1448: HTTP: HTTP/1.1 206 Partial Content
21:55:15.162598 IP 192.168.20.4.80 > 192.168.20.3.37894: Flags [P.], seq 21675:24571, ack 145, win 509, options [nop,nop,TS val 2631976670 ecr 981175855], length 2896: HTTP
21:55:15.165596 IP 192.168.20.4.80 > 192.168.20.3.37894: Flags [.], seq 24571:27467, ack 145, win 509, options [nop,nop,TS val 2631976670 ecr 981175855], length 2896: HTTP
21:55:15.165630 IP 192.168.20.4.80 > 192.168.20.3.37894: Flags [P.], seq 27467:28915, ack 145, win 509, options [nop,nop,TS val 2631976670 ecr 981175855], length 1448: HTTP
21:55:15.168640 IP 192.168.20.4.80 > 192.168.20.3.37894: Flags [P.], seq 28915:33259, ack 145, win 509, options [nop,nop,TS val 2631976670 ecr 981175855], length 4344: HTTP
21:55:15.171694 IP 192.168.20.4.80 > 192.168.20.3.37894: Flags [P.], seq 33259:37603, ack 145, win 509, options [nop,nop,TS val 2631976670 ecr 981175855], length 4344: HTTP
21:55:15.172649 IP 192.168.20.4.80 > 192.168.20.3.37894: Flags [.], seq 37603:39051, ack 145, win 509, options [nop,nop,TS val 2631976670 ecr 981175855], length 1448: HTTP
21:55:15.173637 IP 192.168.20.4.80 > 192.168.20.3.37894: Flags [P.], seq 39051:40453, ack 145, win 509, options [nop,nop,TS val 2631976670 ecr 981175855], length 1402: HTTP
21:55:15.175665 IP 192.168.20.4.80 > 192.168.20.3.37924: Flags [P.], seq 14481:17377, ack 73, win 509, options [nop,nop,TS val 2631976684 ecr 981175870], length 2896: HTTP
21:55:15.177644 IP 192.168.20.4.80 > 192.168.20.3.37924: Flags [.], seq 17377:18825, ack 73, win 509, options [nop,nop,TS val 2631976684 ecr 981175870], length 1448: HTTP
21:55:15.177678 IP 192.168.20.4.80 > 192.168.20.3.37924: Flags [P.], seq 18825:20227, ack 73, win 509, options [nop,nop,TS val 2631976684 ecr 981175870], length 1402: HTTP
21:55:15.177679 IP 192.168.20.4.80 > 192.168.20.3.37886: Flags [.], ack 213, win 509, options [nop,nop,TS val 2631976689 ecr 981175875], length 0
21:55:15.180752 IP 192.168.20.4.80 > 192.168.20.3.37886: Flags [P.], seq 40449:44793, ack 213, win 509, options [nop,nop,TS val 2631976689 ecr 981175875], length 4344: HTTP: HTTP/1.1 206 Partial Content
21:55:15.183749 IP 192.168.20.4.80 > 192.168.20.3.37886: Flags [P.], seq 44793:49137, ack 213, win 509, options [nop,nop,TS val 2631976689 ecr 981175875], length 4344: HTTP
21:55:15.186789 IP 192.168.20.4.80 > 192.168.20.3.37886: Flags [P.], seq 49137:53481, ack 213, win 509, options [nop,nop,TS val 2631976689 ecr 981175875], length 4344: HTTP
21:55:15.189775 IP 192.168.20.4.80 > 192.168.20.3.37886: Flags [.], seq 53481:54929, ack 213, win 509, options [nop,nop,TS val 2631976689 ecr 981175875], length 1448: HTTP
21:55:15.189885 IP 192.168.20.4.80 > 192.168.20.3.37886: Flags [P.], seq 54929:57825, ack 213, win 509, options [nop,nop,TS val 2631976689 ecr 981175875], length 2896: HTTP
21:55:15.190790 IP 192.168.20.4.80 > 192.168.20.3.37886: Flags [.], seq 57825:59273, ack 213, win 509, options [nop,nop,TS val 2631976689 ecr 981175875], length 1448: HTTP
21:55:15.191764 IP 192.168.20.4.80 > 192.168.20.3.37886: Flags [P.], seq 59273:60675, ack 213, win 509, options [nop,nop,TS val 2631976689 ecr 981175875], length 1402: HTTP
21:55:15.191765 IP 192.168.20.4.80 > 192.168.20.3.37910: Flags [.], ack 141, win 509, options [nop,nop,TS val 2631976699 ecr 981175885], length 0
21:55:15.193871 IP 192.168.20.4.80 > 192.168.20.3.37910: Flags [P.], seq 20227:23123, ack 141, win 509, options [nop,nop,TS val 2631976699 ecr 981175885], length 2896: HTTP: HTTP/1.1 206 Partial Content
21:55:15.195825 IP 192.168.20.4.80 > 192.168.20.3.37910: Flags [.], seq 23123:24571, ack 141, win 509, options [nop,nop,TS val 2631976699 ecr 981175885], length 1448: HTTP
21:55:15.195868 IP 192.168.20.4.80 > 192.168.20.3.37910: Flags [P.], seq 24571:26019, ack 141, win 509, options [nop,nop,TS val 2631976699 ecr 981175885], length 1448: HTTP
21:55:15.197903 IP 192.168.20.4.80 > 192.168.20.3.37910: Flags [P.], seq 26019:28915, ack 141, win 509, options [nop,nop,TS val 2631976699 ecr 981175885], length 2896: HTTP
21:55:15.199890 IP 192.168.20.4.80 > 192.168.20.3.37910: Flags [.], seq 28915:30363, ack 141, win 509, options [nop,nop,TS val 2631976699 ecr 981175885], length 1448: HTTP
21:55:15.199913 IP 192.168.20.4.80 > 192.168.20.3.37910: Flags [P.], seq 30363:31811, ack 141, win 509, options [nop,nop,TS val 2631976699 ecr 981175885], length 1448: HTTP
21:55:15.201938 IP 192.168.20.4.80 > 192.168.20.3.37910: Flags [P.], seq 31811:34707, ack 141, win 509, options [nop,nop,TS val 2631976699 ecr 981175885], length 2896: HTTP
21:55:15.203948 IP 192.168.20.4.80 > 192.168.20.3.37910: Flags [P.], seq 34707:37603, ack 141, win 509, options [nop,nop,TS val 2631976699 ecr 981175885], length 2896: HTTP
21:55:15.204969 IP 192.168.20.4.80 > 192.168.20.3.37910: Flags [.], seq 37603:39051, ack 141, win 509, options [nop,nop,TS val 2631976699 ecr 981175885], length 1448: HTTP
21:55:15.205916 IP 192.168.20.4.80 > 192.168.20.3.37910: Flags [P.], seq 39051:40449, ack 141, win 509, options [nop,nop,TS val 2631976699 ecr 981175885], length 1398: HTTP
21:55:15.205917 IP 192.168.20.4.80 > 192.168.20.3.37894: Flags [.], ack 217, win 509, options [nop,nop,TS val 2631976718 ecr 981175904], length 0
21:55:15.208048 IP 192.168.20.4.80 > 192.168.20.3.37894: Flags [P.], seq 40453:43349, ack 217, win 509, options [nop,nop,TS val 2631976719 ecr 981175904], length 2896: HTTP: HTTP/1.1 206 Partial Content
21:55:15.210002 IP 192.168.20.4.80 > 192.168.20.3.37894: Flags [P.], seq 43349:46245, ack 217, win 509, options [nop,nop,TS val 2631976719 ecr 981175904], length 2896: HTTP
21:55:15.212051 IP 192.168.20.4.80 > 192.168.20.3.37894: Flags [P.], seq 46245:49141, ack 217, win 509, options [nop,nop,TS val 2631976719 ecr 981175904], length 2896: HTTP
21:55:15.214041 IP 192.168.20.4.80 > 192.168.20.3.37894: Flags [P.], seq 49141:52037, ack 217, win 509, options [nop,nop,TS val 2631976719 ecr 981175904], length 2896: HTTP
21:55:15.216061 IP 192.168.20.4.80 > 192.168.20.3.37894: Flags [P.], seq 52037:54933, ack 217, win 509, options [nop,nop,TS val 2631976719 ecr 981175904], length 2896: HTTP
21:55:15.218071 IP 192.168.20.4.80 > 192.168.20.3.37894: Flags [P.], seq 54933:57829, ack 217, win 509, options [nop,nop,TS val 2631976719 ecr 981175904], length 2896: HTTP
21:55:15.219104 IP 192.168.20.4.80 > 192.168.20.3.37894: Flags [.], seq 57829:59277, ack 217, win 509, options [nop,nop,TS val 2631976719 ecr 981175904], length 1448: HTTP
21:55:15.220087 IP 192.168.20.4.80 > 192.168.20.3.37894: Flags [P.], seq 59277:60679, ack 217, win 509, options [nop,nop,TS val 2631976719 ecr 981175904], length 1402: HTTP
21:55:15.220088 IP 192.168.20.4.80 > 192.168.20.3.37924: Flags [.], ack 145, win 509, options [nop,nop,TS val 2631976720 ecr 981175906], length 0
21:55:15.222110 IP 192.168.20.4.80 > 192.168.20.3.37924: Flags [.], seq 20227:21675, ack 145, win 509, options [nop,nop,TS val 2631976721 ecr 981175906], length 1448: HTTP: HTTP/1.1 206 Partial Content
21:55:15.222134 IP 192.168.20.4.80 > 192.168.20.3.37924: Flags [P.], seq 21675:23123, ack 145, win 509, options [nop,nop,TS val 2631976721 ecr 981175906], length 1448: HTTP
21:55:15.224161 IP 192.168.20.4.80 > 192.168.20.3.37924: Flags [P.], seq 23123:26019, ack 145, win 509, options [nop,nop,TS val 2631976721 ecr 981175906], length 2896: HTTP
21:55:15.226149 IP 192.168.20.4.80 > 192.168.20.3.37924: Flags [.], seq 26019:27467, ack 145, win 509, options [nop,nop,TS val 2631976721 ecr 981175906], length 1448: HTTP
21:55:15.226172 IP 192.168.20.4.80 > 192.168.20.3.37924: Flags [P.], seq 27467:28915, ack 145, win 509, options [nop,nop,TS val 2631976721 ecr 981175906], length 1448: HTTP
21:55:15.228223 IP 192.168.20.4.80 > 192.168.20.3.37924: Flags [P.], seq 28915:31811, ack 145, win 509, options [nop,nop,TS val 2631976721 ecr 981175906], length 2896: HTTP
21:55:15.230201 IP 192.168.20.4.80 > 192.168.20.3.37924: Flags [.], seq 31811:33259, ack 145, win 509, options [nop,nop,TS val 2631976721 ecr 981175906], length 1448: HTTP
21:55:15.230225 IP 192.168.20.4.80 > 192.168.20.3.37924: Flags [P.], seq 33259:34707, ack 145, win 509, options [nop,nop,TS val 2631976721 ecr 981175906], length 1448: HTTP
21:55:15.232232 IP 192.168.20.4.80 > 192.168.20.3.37924: Flags [P.], seq 34707:37603, ack 145, win 509, options [nop,nop,TS val 2631976721 ecr 981175906], length 2896: HTTP
21:55:15.233227 IP 192.168.20.4.80 > 192.168.20.3.37886: Flags [.], ack 285, win 509, options [nop,nop,TS val 2631976729 ecr 981175914], length 0
21:55:15.233228 IP 192.168.20.4.80 > 192.168.20.3.37924: Flags [.], seq 37603:39051, ack 145, win 509, options [nop,nop,TS val 2631976721 ecr 981175906], length 1448: HTTP
21:55:15.235339 IP 192.168.20.4.80 > 192.168.20.3.37886: Flags [P.], seq 60675:63571, ack 285, win 509, options [nop,nop,TS val 2631976729 ecr 981175914], length 2896: HTTP: HTTP/1.1 206 Partial Content
21:55:15.237303 IP 192.168.20.4.80 > 192.168.20.3.37886: Flags [.], seq 63571:65019, ack 285, win 509, options [nop,nop,TS val 2631976729 ecr 981175914], length 1448: HTTP
21:55:15.237328 IP 192.168.20.4.80 > 192.168.20.3.37886: Flags [P.], seq 65019:66467, ack 285, win 509, options [nop,nop,TS val 2631976729 ecr 981175914], length 1448: HTTP
21:55:15.239353 IP 192.168.20.4.80 > 192.168.20.3.37886: Flags [P.], seq 66467:69363, ack 285, win 509, options [nop,nop,TS val 2631976729 ecr 981175914], length 2896: HTTP
21:55:15.241359 IP 192.168.20.4.80 > 192.168.20.3.37886: Flags [P.], seq 69363:72259, ack 285, win 509, options [nop,nop,TS val 2631976729 ecr 981175914], length 2896: HTTP
21:55:15.243363 IP 192.168.20.4.80 > 192.168.20.3.37886: Flags [P.], seq 72259:75155, ack 285, win 509, options [nop,nop,TS val 2631976729 ecr 981175914], length 2896: HTTP
21:55:15.245395 IP 192.168.20.4.80 > 192.168.20.3.37886: Flags [P.], seq 75155:78051, ack 285, win 509, options [nop,nop,TS val 2631976729 ecr 981175914], length 2896: HTTP
21:55:15.246416 IP 192.168.20.4.80 > 192.168.20.3.37886: Flags [.], seq 78051:79499, ack 285, win 509, options [nop,nop,TS val 2631976729 ecr 981175914], length 1448: HTTP
21:55:15.247349 IP 192.168.20.4.80 > 192.168.20.3.37886: Flags [P.], seq 79499:80901, ack 285, win 509, options [nop,nop,TS val 2631976729 ecr 981175914], length 1402: HTTP
21:55:15.247350 IP 192.168.20.4.80 > 192.168.20.3.37910: Flags [.], ack 213, win 509, options [nop,nop,TS val 2631976743 ecr 981175928], length 0
21:55:15.249472 IP 192.168.20.4.80 > 192.168.20.3.37910: Flags [P.], seq 40449:43345, ack 213, win 509, options [nop,nop,TS val 2631976743 ecr 981175928], length 2896: HTTP: HTTP/1.1 206 Partial Content
21:55:15.251436 IP 192.168.20.4.80 > 192.168.20.3.37910: Flags [P.], seq 43345:46241, ack 213, win 509, options [nop,nop,TS val 2631976743 ecr 981175928], length 2896: HTTP
21:55:15.253499 IP 192.168.20.4.80 > 192.168.20.3.37910: Flags [P.], seq 46241:49137, ack 213, win 509, options [nop,nop,TS val 2631976743 ecr 981175928], length 2896: HTTP
21:55:15.255473 IP 192.168.20.4.80 > 192.168.20.3.37910: Flags [P.], seq 49137:52033, ack 213, win 509, options [nop,nop,TS val 2631976743 ecr 981175928], length 2896: HTTP
21:55:15.257557 IP 192.168.20.4.80 > 192.168.20.3.37910: Flags [P.], seq 52033:54929, ack 213, win 509, options [nop,nop,TS val 2631976743 ecr 981175928], length 2896: HTTP
21:55:15.259507 IP 192.168.20.4.80 > 192.168.20.3.37910: Flags [P.], seq 54929:57825, ack 213, win 509, options [nop,nop,TS val 2631976743 ecr 981175928], length 2896: HTTP
21:55:15.260556 IP 192.168.20.4.80 > 192.168.20.3.37910: Flags [.], seq 57825:59273, ack 213, win 509, options [nop,nop,TS val 2631976743 ecr 981175928], length 1448: HTTP
21:55:15.261532 IP 192.168.20.4.80 > 192.168.20.3.37910: Flags [P.], seq 59273:60675, ack 213, win 509, options [nop,nop,TS val 2631976743 ecr 981175928], length 1402: HTTP
21:55:15.261533 IP 192.168.20.4.80 > 192.168.20.3.37894: Flags [.], ack 289, win 509, options [nop,nop,TS val 2631976767 ecr 981175953], length 0
21:55:15.263545 IP 192.168.20.4.80 > 192.168.20.3.37894: Flags [.], seq 60679:62127, ack 289, win 509, options [nop,nop,TS val 2631976767 ecr 981175953], length 1448: HTTP: HTTP/1.1 206 Partial Content
21:55:15.263590 IP 192.168.20.4.80 > 192.168.20.3.37894: Flags [P.], seq 62127:63575, ack 289, win 509, options [nop,nop,TS val 2631976767 ecr 981175953], length 1448: HTTP
21:55:15.265635 IP 192.168.20.4.80 > 192.168.20.3.37894: Flags [P.], seq 63575:66471, ack 289, win 509, options [nop,nop,TS val 2631976767 ecr 981175953], length 2896: HTTP
21:55:15.267580 IP 192.168.20.4.80 > 192.168.20.3.37894: Flags [.], seq 66471:67919, ack 289, win 509, options [nop,nop,TS val 2631976767 ecr 981175953], length 1448: HTTP
21:55:15.267628 IP 192.168.20.4.80 > 192.168.20.3.37894: Flags [P.], seq 67919:69367, ack 289, win 509, options [nop,nop,TS val 2631976767 ecr 981175953], length 1448: HTTP
21:55:15.269685 IP 192.168.20.4.80 > 192.168.20.3.37894: Flags [P.], seq 69367:72263, ack 289, win 509, options [nop,nop,TS val 2631976767 ecr 981175953], length 2896: HTTP
21:55:15.271652 IP 192.168.20.4.80 > 192.168.20.3.37894: Flags [.], seq 72263:73711, ack 289, win 509, options [nop,nop,TS val 2631976767 ecr 981175953], length 1448: HTTP
21:55:15.271673 IP 192.168.20.4.80 > 192.168.20.3.37894: Flags [P.], seq 73711:75159, ack 289, win 509, options [nop,nop,TS val 2631976767 ecr 981175953], length 1448: HTTP
21:55:15.273697 IP 192.168.20.4.80 > 192.168.20.3.37894: Flags [P.], seq 75159:78055, ack 289, win 509, options [nop,nop,TS val 2631976767 ecr 981175953], length 2896: HTTP
21:55:15.274678 IP 192.168.20.4.80 > 192.168.20.3.37894: Flags [.], seq 78055:79503, ack 289, win 509, options [nop,nop,TS val 2631976767 ecr 981175953], length 1448: HTTP
21:55:15.275682 IP 192.168.20.4.80 > 192.168.20.3.37894: Flags [P.], seq 79503:80905, ack 289, win 509, options [nop,nop,TS val 2631976767 ecr 981175953], length 1402: HTTP
21:55:15.277702 IP 192.168.20.4.80 > 192.168.20.3.37886: Flags [P.], seq 80901:83797, ack 357, win 509, options [nop,nop,TS val 2631976786 ecr 981175972], length 2896: HTTP: HTTP/1.1 206 Partial Content
21:55:15.279670 IP 192.168.20.4.80 > 192.168.20.3.37886: Flags [.], seq 83797:85245, ack 357, win 509, options [nop,nop,TS val 2631976786 ecr 981175972], length 1448: HTTP
21:55:15.279704 IP 192.168.20.4.80 > 192.168.20.3.37886: Flags [P.], seq 85245:86693, ack 357, win 509, options [nop,nop,TS val 2631976786 ecr 981175972], length 1448: HTTP
21:55:15.281738 IP 192.168.20.4.80 > 192.168.20.3.37886: Flags [P.], seq 86693:89589, ack 357, win 509, options [nop,nop,TS val 2631976786 ecr 981175972], length 2896: HTTP
21:55:15.283655 IP 192.168.20.4.80 > 192.168.20.3.37886: Flags [.], seq 89589:91037, ack 357, win 509, options [nop,nop,TS val 2631976786 ecr 981175972], length 1448: HTTP
21:55:15.283701 IP 192.168.20.4.80 > 192.168.20.3.37886: Flags [P.], seq 91037:92485, ack 357, win 509, options [nop,nop,TS val 2631976786 ecr 981175972], length 1448: HTTP
21:55:15.285770 IP 192.168.20.4.80 > 192.168.20.3.37886: Flags [P.], seq 92485:95381, ack 357, win 509, options [nop,nop,TS val 2631976786 ecr 981175972], length 2896: HTTP
21:55:15.287748 IP 192.168.20.4.80 > 192.168.20.3.37886: Flags [.], seq 95381:96829, ack 357, win 509, options [nop,nop,TS val 2631976786 ecr 981175972], length 1448: HTTP
21:55:15.287784 IP 192.168.20.4.80 > 192.168.20.3.37886: Flags [P.], seq 96829:98277, ack 357, win 509, options [nop,nop,TS val 2631976786 ecr 981175972], length 1448: HTTP
21:55:15.288820 IP 192.168.20.4.80 > 192.168.20.3.37886: Flags [.], seq 98277:99725, ack 357, win 509, options [nop,nop,TS val 2631976786 ecr 981175972], length 1448: HTTP
21:55:15.289771 IP 192.168.20.4.80 > 192.168.20.3.37886: Flags [P.], seq 99725:101127, ack 357, win 509, options [nop,nop,TS val 2631976787 ecr 981175972], length 1402: HTTP
21:55:15.289772 IP 192.168.20.4.80 > 192.168.20.3.37910: Flags [.], ack 285, win 509, options [nop,nop,TS val 2631976800 ecr 981175985], length 0
21:55:15.291839 IP 192.168.20.4.80 > 192.168.20.3.37910: Flags [P.], seq 60675:63571, ack 285, win 509, options [nop,nop,TS val 2631976800 ecr 981175985], length 2896: HTTP: HTTP/1.1 206 Partial Content
21:55:15.293872 IP 192.168.20.4.80 > 192.168.20.3.37910: Flags [P.], seq 63571:66467, ack 285, win 509, options [nop,nop,TS val 2631976800 ecr 981175985], length 2896: HTTP
21:55:15.295885 IP 192.168.20.4.80 > 192.168.20.3.37910: Flags [P.], seq 66467:69363, ack 285, win 509, options [nop,nop,TS val 2631976800 ecr 981175985], length 2896: HTTP
21:55:15.297889 IP 192.168.20.4.80 > 192.168.20.3.37910: Flags [P.], seq 69363:72259, ack 285, win 509, options [nop,nop,TS val 2631976800 ecr 981175985], length 2896: HTTP
21:55:15.299949 IP 192.168.20.4.80 > 192.168.20.3.37910: Flags [P.], seq 72259:75155, ack 285, win 509, options [nop,nop,TS val 2631976800 ecr 981175985], length 2896: HTTP
21:55:15.301927 IP 192.168.20.4.80 > 192.168.20.3.37910: Flags [P.], seq 75155:78051, ack 285, win 509, options [nop,nop,TS val 2631976800 ecr 981175985], length 2896: HTTP
21:55:15.302945 IP 192.168.20.4.80 > 192.168.20.3.37910: Flags [.], seq 78051:79499, ack 285, win 509, options [nop,nop,TS val 2631976800 ecr 981175985], length 1448: HTTP
21:55:15.303939 IP 192.168.20.4.80 > 192.168.20.3.37910: Flags [P.], seq 79499:80901, ack 285, win 509, options [nop,nop,TS val 2631976800 ecr 981175985], length 1402: HTTP
21:55:15.305935 IP 192.168.20.4.80 > 192.168.20.3.37894: Flags [P.], seq 80905:83801, ack 361, win 509, options [nop,nop,TS val 2631976819 ecr 981176004], length 2896: HTTP: HTTP/1.1 206 Partial Content
21:55:15.307934 IP 192.168.20.4.80 > 192.168.20.3.37894: Flags [P.], seq 83801:86697, ack 361, win 509, options [nop,nop,TS val 2631976819 ecr 981176004], length 2896: HTTP
21:55:15.309973 IP 192.168.20.4.80 > 192.168.20.3.37894: Flags [P.], seq 86697:89593, ack 361, win 509, options [nop,nop,TS val 2631976819 ecr 981176004], length 2896: HTTP
21:55:15.312025 IP 192.168.20.4.80 > 192.168.20.3.37894: Flags [P.], seq 89593:92489, ack 361, win 509, options [nop,nop,TS val 2631976819 ecr 981176004], length 2896: HTTP
21:55:15.314016 IP 192.168.20.4.80 > 192.168.20.3.37894: Flags [P.], seq 92489:95385, ack 361, win 509, options [nop,nop,TS val 2631976819 ecr 981176004], length 2896: HTTP
21:55:15.316060 IP 192.168.20.4.80 > 192.168.20.3.37894: Flags [P.], seq 95385:98281, ack 361, win 509, options [nop,nop,TS val 2631976819 ecr 981176004], length 2896: HTTP
21:55:15.317036 IP 192.168.20.4.80 > 192.168.20.3.37894: Flags [P.], seq 99729:101131, ack 361, win 509, options [nop,nop,TS val 2631976819 ecr 981176004], length 1402: HTTP
21:55:15.319025 IP 192.168.20.4.80 > 192.168.20.3.37886: Flags [P.], seq 101127:104023, ack 429, win 509, options [nop,nop,TS val 2631976831 ecr 981176016], length 2896: HTTP: HTTP/1.1 206 Partial Content
21:55:15.321069 IP 192.168.20.4.80 > 192.168.20.3.37886: Flags [P.], seq 104023:106919, ack 429, win 509, options [nop,nop,TS val 2631976831 ecr 981176016], length 2896: HTTP
21:55:15.323045 IP 192.168.20.4.80 > 192.168.20.3.37886: Flags [.], seq 106919:108367, ack 429, win 509, options [nop,nop,TS val 2631976831 ecr 981176016], length 1448: HTTP
21:55:15.323069 IP 192.168.20.4.80 > 192.168.20.3.37886: Flags [P.], seq 108367:109815, ack 429, win 509, options [nop,nop,TS val 2631976831 ecr 981176016], length 1448: HTTP
21:55:15.325102 IP 192.168.20.4.80 > 192.168.20.3.37886: Flags [P.], seq 109815:112711, ack 429, win 509, options [nop,nop,TS val 2631976831 ecr 981176016], length 2896: HTTP
21:55:15.327084 IP 192.168.20.4.80 > 192.168.20.3.37886: Flags [.], seq 112711:114159, ack 429, win 509, options [nop,nop,TS val 2631976831 ecr 981176016], length 1448: HTTP
21:55:15.327124 IP 192.168.20.4.80 > 192.168.20.3.37886: Flags [P.], seq 114159:115607, ack 429, win 509, options [nop,nop,TS val 2631976831 ecr 981176016], length 1448: HTTP
21:55:15.329139 IP 192.168.20.4.80 > 192.168.20.3.37886: Flags [P.], seq 115607:118503, ack 429, win 509, options [nop,nop,TS val 2631976831 ecr 981176016], length 2896: HTTP
21:55:15.330117 IP 192.168.20.4.80 > 192.168.20.3.37886: Flags [.], seq 118503:119951, ack 429, win 509, options [nop,nop,TS val 2631976831 ecr 981176016], length 1448: HTTP
21:55:15.331108 IP 192.168.20.4.80 > 192.168.20.3.37886: Flags [P.], seq 119951:121353, ack 429, win 509, options [nop,nop,TS val 2631976831 ecr 981176016], length 1402: HTTP
21:55:15.333145 IP 192.168.20.4.80 > 192.168.20.3.37910: Flags [P.], seq 80901:83797, ack 357, win 509, options [nop,nop,TS val 2631976845 ecr 981176030], length 2896: HTTP: HTTP/1.1 206 Partial Content
21:55:15.335121 IP 192.168.20.4.80 > 192.168.20.3.37910: Flags [.], seq 83797:85245, ack 357, win 509, options [nop,nop,TS val 2631976845 ecr 981176030], length 1448: HTTP
21:55:15.335213 IP 192.168.20.4.80 > 192.168.20.3.37910: Flags [P.], seq 85245:86693, ack 357, win 509, options [nop,nop,TS val 2631976845 ecr 981176030], length 1448: HTTP
21:55:15.337177 IP 192.168.20.4.80 > 192.168.20.3.37910: Flags [P.], seq 86693:89589, ack 357, win 509, options [nop,nop,TS val 2631976845 ecr 981176030], length 2896: HTTP
21:55:15.339167 IP 192.168.20.4.80 > 192.168.20.3.37910: Flags [.], seq 89589:91037, ack 357, win 509, options [nop,nop,TS val 2631976845 ecr 981176030], length 1448: HTTP
21:55:15.339200 IP 192.168.20.4.80 > 192.168.20.3.37910: Flags [P.], seq 91037:92485, ack 357, win 509, options [nop,nop,TS val 2631976845 ecr 981176030], length 1448: HTTP
21:55:15.341215 IP 192.168.20.4.80 > 192.168.20.3.37910: Flags [P.], seq 92485:95381, ack 357, win 509, options [nop,nop,TS val 2631976845 ecr 981176030], length 2896: HTTP
21:55:15.343199 IP 192.168.20.4.80 > 192.168.20.3.37910: Flags [.], seq 95381:96829, ack 357, win 509, options [nop,nop,TS val 2631976845 ecr 981176030], length 1448: HTTP
21:55:15.343231 IP 192.168.20.4.80 > 192.168.20.3.37910: Flags [P.], seq 96829:98277, ack 357, win 509, options [nop,nop,TS val 2631976845 ecr 981176030], length 1448: HTTP
21:55:15.344223 IP 192.168.20.4.80 > 192.168.20.3.37910: Flags [.], seq 98277:99725, ack 357, win 509, options [nop,nop,TS val 2631976845 ecr 981176030], length 1448: HTTP
21:55:15.345208 IP 192.168.20.4.80 > 192.168.20.3.37910: Flags [P.], seq 99725:101127, ack 357, win 509, options [nop,nop,TS val 2631976845 ecr 981176030], length 1402: HTTP
21:55:15.346207 IP 192.168.20.4.80 > 192.168.20.3.37894: Flags [.], seq 98281:99729, ack 361, win 509, options [nop,nop,TS val 2631976868 ecr 981176039], length 1448: HTTP
21:55:15.348243 IP 192.168.20.4.80 > 192.168.20.3.37886: Flags [P.], seq 121353:124249, ack 501, win 509, options [nop,nop,TS val 2631976870 ecr 981176055], length 2896: HTTP: HTTP/1.1 206 Partial Content
21:55:15.350258 IP 192.168.20.4.80 > 192.168.20.3.37886: Flags [P.], seq 124249:127145, ack 501, win 509, options [nop,nop,TS val 2631976870 ecr 981176055], length 2896: HTTP
21:55:15.352280 IP 192.168.20.4.80 > 192.168.20.3.37886: Flags [P.], seq 127145:130041, ack 501, win 509, options [nop,nop,TS val 2631976870 ecr 981176055], length 2896: HTTP
21:55:15.354290 IP 192.168.20.4.80 > 192.168.20.3.37886: Flags [P.], seq 130041:132937, ack 501, win 509, options [nop,nop,TS val 2631976870 ecr 981176055], length 2896: HTTP
21:55:15.356343 IP 192.168.20.4.80 > 192.168.20.3.37886: Flags [P.], seq 132937:135833, ack 501, win 509, options [nop,nop,TS val 2631976870 ecr 981176055], length 2896: HTTP
21:55:15.358339 IP 192.168.20.4.80 > 192.168.20.3.37886: Flags [P.], seq 135833:138729, ack 501, win 509, options [nop,nop,TS val 2631976870 ecr 981176055], length 2896: HTTP
21:55:15.359322 IP 192.168.20.4.80 > 192.168.20.3.37886: Flags [.], seq 138729:140177, ack 501, win 509, options [nop,nop,TS val 2631976870 ecr 981176055], length 1448: HTTP
21:55:15.360312 IP 192.168.20.4.80 > 192.168.20.3.37886: Flags [P.], seq 140177:141579, ack 501, win 509, options [nop,nop,TS val 2631976870 ecr 981176055], length 1402: HTTP
21:55:15.362339 IP 192.168.20.4.80 > 192.168.20.3.37894: Flags [P.], seq 101131:104027, ack 433, win 509, options [nop,nop,TS val 2631976888 ecr 981176073], length 2896: HTTP: HTTP/1.1 206 Partial Content
21:55:15.364364 IP 192.168.20.4.80 > 192.168.20.3.37894: Flags [P.], seq 104027:106923, ack 433, win 509, options [nop,nop,TS val 2631976888 ecr 981176073], length 2896: HTTP
21:55:15.366368 IP 192.168.20.4.80 > 192.168.20.3.37894: Flags [P.], seq 106923:109819, ack 433, win 509, options [nop,nop,TS val 2631976888 ecr 981176073], length 2896: HTTP
21:55:15.368401 IP 192.168.20.4.80 > 192.168.20.3.37894: Flags [P.], seq 109819:112715, ack 433, win 509, options [nop,nop,TS val 2631976888 ecr 981176073], length 2896: HTTP
21:55:15.370413 IP 192.168.20.4.80 > 192.168.20.3.37894: Flags [P.], seq 112715:115611, ack 433, win 509, options [nop,nop,TS val 2631976888 ecr 981176073], length 2896: HTTP
21:55:15.372442 IP 192.168.20.4.80 > 192.168.20.3.37894: Flags [P.], seq 115611:118507, ack 433, win 509, options [nop,nop,TS val 2631976888 ecr 981176073], length 2896: HTTP
21:55:15.373463 IP 192.168.20.4.80 > 192.168.20.3.37894: Flags [.], seq 118507:119955, ack 433, win 509, options [nop,nop,TS val 2631976888 ecr 981176073], length 1448: HTTP
21:55:15.374409 IP 192.168.20.4.80 > 192.168.20.3.37894: Flags [P.], seq 119955:121357, ack 433, win 509, options [nop,nop,TS val 2631976888 ecr 981176073], length 1402: HTTP
21:55:15.376459 IP 192.168.20.4.80 > 192.168.20.3.37910: Flags [P.], seq 101127:104023, ack 429, win 509, options [nop,nop,TS val 2631976888 ecr 981176073], length 2896: HTTP: HTTP/1.1 206 Partial Content
21:55:15.378444 IP 192.168.20.4.80 > 192.168.20.3.37910: Flags [P.], seq 104023:106919, ack 429, win 509, options [nop,nop,TS val 2631976888 ecr 981176073], length 2896: HTTP
21:55:15.380461 IP 192.168.20.4.80 > 192.168.20.3.37910: Flags [P.], seq 106919:109815, ack 429, win 509, options [nop,nop,TS val 2631976888 ecr 981176073], length 2896: HTTP
21:55:15.382488 IP 192.168.20.4.80 > 192.168.20.3.37910: Flags [P.], seq 109815:112711, ack 429, win 509, options [nop,nop,TS val 2631976888 ecr 981176073], length 2896: HTTP
21:55:15.384520 IP 192.168.20.4.80 > 192.168.20.3.37910: Flags [P.], seq 112711:115607, ack 429, win 509, options [nop,nop,TS val 2631976888 ecr 981176073], length 2896: HTTP
21:55:15.386520 IP 192.168.20.4.80 > 192.168.20.3.37910: Flags [P.], seq 115607:118503, ack 429, win 509, options [nop,nop,TS val 2631976888 ecr 981176073], length 2896: HTTP
21:55:15.387533 IP 192.168.20.4.80 > 192.168.20.3.37910: Flags [.], seq 118503:119951, ack 429, win 509, options [nop,nop,TS val 2631976888 ecr 981176073], length 1448: HTTP
21:55:15.388517 IP 192.168.20.4.80 > 192.168.20.3.37910: Flags [P.], seq 119951:121353, ack 429, win 509, options [nop,nop,TS val 2631976888 ecr 981176073], length 1402: HTTP
21:55:15.390532 IP 192.168.20.4.80 > 192.168.20.3.37886: Flags [P.], seq 141579:144475, ack 573, win 509, options [nop,nop,TS val 2631976898 ecr 981176083], length 2896: HTTP: HTTP/1.1 206 Partial Content
21:55:15.392569 IP 192.168.20.4.80 > 192.168.20.3.37886: Flags [P.], seq 144475:147371, ack 573, win 509, options [nop,nop,TS val 2631976898 ecr 981176083], length 2896: HTTP
21:55:15.394568 IP 192.168.20.4.80 > 192.168.20.3.37886: Flags [P.], seq 147371:150267, ack 573, win 509, options [nop,nop,TS val 2631976898 ecr 981176083], length 2896: HTTP
21:55:15.396606 IP 192.168.20.4.80 > 192.168.20.3.37886: Flags [P.], seq 150267:153163, ack 573, win 509, options [nop,nop,TS val 2631976898 ecr 981176083], length 2896: HTTP
21:55:15.398609 IP 192.168.20.4.80 > 192.168.20.3.37886: Flags [P.], seq 153163:156059, ack 573, win 509, options [nop,nop,TS val 2631976898 ecr 981176083], length 2896: HTTP
21:55:15.400641 IP 192.168.20.4.80 > 192.168.20.3.37886: Flags [P.], seq 156059:158955, ack 573, win 509, options [nop,nop,TS val 2631976898 ecr 981176083], length 2896: HTTP
21:55:15.401637 IP 192.168.20.4.80 > 192.168.20.3.37886: Flags [.], seq 158955:160403, ack 573, win 509, options [nop,nop,TS val 2631976898 ecr 981176083], length 1448: HTTP
21:55:15.402609 IP 192.168.20.4.80 > 192.168.20.3.37886: Flags [P.], seq 160403:161805, ack 573, win 509, options [nop,nop,TS val 2631976898 ecr 981176083], length 1402: HTTP
21:55:15.404648 IP 192.168.20.4.80 > 192.168.20.3.37894: Flags [P.], seq 121357:124253, ack 505, win 509, options [nop,nop,TS val 2631976913 ecr 981176098], length 2896: HTTP: HTTP/1.1 206 Partial Content
21:55:15.406661 IP 192.168.20.4.80 > 192.168.20.3.37894: Flags [P.], seq 124253:127149, ack 505, win 509, options [nop,nop,TS val 2631976913 ecr 981176098], length 2896: HTTP
21:55:15.408680 IP 192.168.20.4.80 > 192.168.20.3.37894: Flags [P.], seq 127149:130045, ack 505, win 509, options [nop,nop,TS val 2631976913 ecr 981176098], length 2896: HTTP
21:55:15.410707 IP 192.168.20.4.80 > 192.168.20.3.37894: Flags [P.], seq 130045:132941, ack 505, win 509, options [nop,nop,TS val 2631976913 ecr 981176098], length 2896: HTTP
21:55:15.412732 IP 192.168.20.4.80 > 192.168.20.3.37894: Flags [P.], seq 132941:135837, ack 505, win 509, options [nop,nop,TS val 2631976913 ecr 981176098], length 2896: HTTP
21:55:15.414724 IP 192.168.20.4.80 > 192.168.20.3.37894: Flags [P.], seq 135837:138733, ack 505, win 509, options [nop,nop,TS val 2631976913 ecr 981176098], length 2896: HTTP
21:55:15.415744 IP 192.168.20.4.80 > 192.168.20.3.37894: Flags [.], seq 138733:140181, ack 505, win 509, options [nop,nop,TS val 2631976913 ecr 981176098], length 1448: HTTP
21:55:15.416723 IP 192.168.20.4.80 > 192.168.20.3.37894: Flags [P.], seq 140181:141583, ack 505, win 509, options [nop,nop,TS val 2631976913 ecr 981176098], length 1402: HTTP
21:55:15.418766 IP 192.168.20.4.80 > 192.168.20.3.37910: Flags [P.], seq 121353:124249, ack 501, win 509, options [nop,nop,TS val 2631976925 ecr 981176111], length 2896: HTTP: HTTP/1.1 206 Partial Content
21:55:15.420783 IP 192.168.20.4.80 > 192.168.20.3.37910: Flags [P.], seq 124249:127145, ack 501, win 509, options [nop,nop,TS val 2631976925 ecr 981176111], length 2896: HTTP
21:55:15.422777 IP 192.168.20.4.80 > 192.168.20.3.37910: Flags [P.], seq 127145:130041, ack 501, win 509, options [nop,nop,TS val 2631976925 ecr 981176111], length 2896: HTTP
21:55:15.424797 IP 192.168.20.4.80 > 192.168.20.3.37910: Flags [P.], seq 130041:132937, ack 501, win 509, options [nop,nop,TS val 2631976925 ecr 981176111], length 2896: HTTP
21:55:15.426809 IP 192.168.20.4.80 > 192.168.20.3.37910: Flags [P.], seq 132937:135833, ack 501, win 509, options [nop,nop,TS val 2631976925 ecr 981176111], length 2896: HTTP
21:55:15.428857 IP 192.168.20.4.80 > 192.168.20.3.37910: Flags [P.], seq 135833:138729, ack 501, win 509, options [nop,nop,TS val 2631976925 ecr 981176111], length 2896: HTTP
21:55:15.429853 IP 192.168.20.4.80 > 192.168.20.3.37910: Flags [.], seq 138729:140177, ack 501, win 509, options [nop,nop,TS val 2631976925 ecr 981176111], length 1448: HTTP
21:55:15.430802 IP 192.168.20.4.80 > 192.168.20.3.37910: Flags [P.], seq 140177:141579, ack 501, win 509, options [nop,nop,TS val 2631976926 ecr 981176111], length 1402: HTTP
21:55:15.432849 IP 192.168.20.4.80 > 192.168.20.3.37886: Flags [P.], seq 161805:164701, ack 645, win 509, options [nop,nop,TS val 2631976942 ecr 981176128], length 2896: HTTP: HTTP/1.1 206 Partial Content
21:55:15.434889 IP 192.168.20.4.80 > 192.168.20.3.37886: Flags [P.], seq 164701:167597, ack 645, win 509, options [nop,nop,TS val 2631976942 ecr 981176128], length 2896: HTTP
21:55:15.436887 IP 192.168.20.4.80 > 192.168.20.3.37886: Flags [P.], seq 167597:170493, ack 645, win 509, options [nop,nop,TS val 2631976942 ecr 981176128], length 2896: HTTP
21:55:15.438893 IP 192.168.20.4.80 > 192.168.20.3.37886: Flags [P.], seq 170493:173389, ack 645, win 509, options [nop,nop,TS val 2631976942 ecr 981176128], length 2896: HTTP
21:55:15.440941 IP 192.168.20.4.80 > 192.168.20.3.37886: Flags [P.], seq 173389:176285, ack 645, win 509, options [nop,nop,TS val 2631976942 ecr 981176128], length 2896: HTTP
21:55:15.442935 IP 192.168.20.4.80 > 192.168.20.3.37886: Flags [P.], seq 176285:179181, ack 645, win 509, options [nop,nop,TS val 2631976942 ecr 981176128], length 2896: HTTP
