08:43:55.476080 IP 192.168.20.3.60460 > 192.168.20.4.80: Flags [S], seq 716913673, win 64240, options [mss 1460,sackOK,TS val 3973745721 ecr 0,nop,wscale 7], length 0
08:43:55.476287 IP 192.168.20.4.80 > 192.168.20.3.60460: Flags [S.], seq 2891479785, ack 716913674, win 65160, options [mss 1460,sackOK,TS val 4245445128 ecr 3973745721,nop,wscale 7], length 0
08:43:55.476308 IP 192.168.20.3.60460 > 192.168.20.4.80: Flags [.], ack 1, win 502, options [nop,nop,TS val 3973745721 ecr 4245445128], length 0
08:43:55.476346 IP 192.168.20.3.60460 > 192.168.20.4.80: Flags [P.], seq 1:69, ack 1, win 502, options [nop,nop,TS val 3973745721 ecr 4245445128], length 68: HTTP: GET /20MB HTTP/1.1
08:43:55.476395 IP 192.168.20.3.60466 > 192.168.20.4.80: Flags [S], seq 3882483136, win 64240, options [mss 1460,sackOK,TS val 3973745721 ecr 0,nop,wscale 7], length 0
08:43:55.476504 IP 192.168.20.4.80 > 192.168.20.3.60460: Flags [.], ack 69, win 509, options [nop,nop,TS val 4245445128 ecr 3973745721], length 0
08:43:55.476504 IP 192.168.20.4.80 > 192.168.20.3.60466: Flags [S.], seq 2263355008, ack 3882483137, win 65160, options [mss 1460,sackOK,TS val 4245445128 ecr 3973745721,nop,wscale 7], length 0
08:43:55.476521 IP 192.168.20.3.60466 > 192.168.20.4.80: Flags [.], ack 1, win 502, options [nop,nop,TS val 3973745721 ecr 4245445128], length 0
08:43:55.476549 IP 192.168.20.3.60466 > 192.168.20.4.80: Flags [P.], seq 1:69, ack 1, win 502, options [nop,nop,TS val 3973745722 ecr 4245445128], length 68: HTTP: GET /20MB HTTP/1.1
08:43:55.476697 IP 192.168.20.4.80 > 192.168.20.3.60466: Flags [.], ack 69, win 509, options [nop,nop,TS val 4245445128 ecr 3973745722], length 0
08:43:55.476956 IP 192.168.20.4.80 > 192.168.20.3.60460: Flags [.], seq 1:4345, ack 69, win 509, options [nop,nop,TS val 4245445129 ecr 3973745721], length 4344: HTTP: HTTP/1.1 206 Partial Content
08:43:55.476960 IP 192.168.20.3.60460 > 192.168.20.4.80: Flags [.], ack 4345, win 489, options [nop,nop,TS val 3973745722 ecr 4245445129], length 0
08:43:55.477005 IP 192.168.20.4.80 > 192.168.20.3.60460: Flags [P.], seq 4345:7241, ack 69, win 509, options [nop,nop,TS val 4245445129 ecr 3973745721], length 2896: HTTP
08:43:55.477006 IP 192.168.20.4.80 > 192.168.20.3.60460: Flags [.], seq 7241:10137, ack 69, win 509, options [nop,nop,TS val 4245445129 ecr 3973745721], length 2896: HTTP
08:43:55.477009 IP 192.168.20.3.60460 > 192.168.20.4.80: Flags [.], ack 7241, win 496, options [nop,nop,TS val 3973745722 ecr 4245445129], length 0
08:43:55.477013 IP 192.168.20.3.60460 > 192.168.20.4.80: Flags [.], ack 10137, win 481, options [nop,nop,TS val 3973745722 ecr 4245445129], length 0
08:43:55.477053 IP 192.168.20.4.80 > 192.168.20.3.60460: Flags [.], seq 10137:11585, ack 69, win 509, options [nop,nop,TS val 4245445129 ecr 3973745721], length 1448: HTTP
08:43:55.477055 IP 192.168.20.3.60460 > 192.168.20.4.80: Flags [.], ack 11585, win 501, options [nop,nop,TS val 3973745722 ecr 4245445129], length 0
08:43:55.477104 IP 192.168.20.4.80 > 192.168.20.3.60460: Flags [P.], seq 11585:14481, ack 69, win 509, options [nop,nop,TS val 4245445129 ecr 3973745721], length 2896: HTTP
08:43:55.477106 IP 192.168.20.3.60460 > 192.168.20.4.80: Flags [.], ack 14481, win 496, options [nop,nop,TS val 3973745722 ecr 4245445129], length 0
08:43:55.477153 IP 192.168.20.4.80 > 192.168.20.3.60460: Flags [.], seq 14481:15929, ack 69, win 509, options [nop,nop,TS val 4245445129 ecr 3973745722], length 1448: HTTP
08:43:55.477155 IP 192.168.20.3.60460 > 192.168.20.4.80: Flags [.], ack 15929, win 501, options [nop,nop,TS val 3973745722 ecr 4245445129], length 0
08:43:55.477208 IP 192.168.20.4.80 > 192.168.20.3.60460: Flags [P.], seq 15929:20267, ack 69, win 509, options [nop,nop,TS val 4245445129 ecr 3973745722], length 4338: HTTP
08:43:55.477209 IP 192.168.20.4.80 > 192.168.20.3.60466: Flags [.], seq 1:4345, ack 69, win 509, options [nop,nop,TS val 4245445129 ecr 3973745722], length 4344: HTTP: HTTP/1.1 206 Partial Content
08:43:55.477212 IP 192.168.20.3.60460 > 192.168.20.4.80: Flags [.], ack 20267, win 489, options [nop,nop,TS val 3973745722 ecr 4245445129], length 0
08:43:55.477215 IP 192.168.20.3.60466 > 192.168.20.4.80: Flags [.], ack 4345, win 489, options [nop,nop,TS val 3973745722 ecr 4245445129], length 0
08:43:55.477255 IP 192.168.20.4.80 > 192.168.20.3.60466: Flags [P.], seq 4345:7241, ack 69, win 509, options [nop,nop,TS val 4245445129 ecr 3973745722], length 2896: HTTP
08:43:55.477257 IP 192.168.20.3.60466 > 192.168.20.4.80: Flags [.], ack 7241, win 496, options [nop,nop,TS val 3973745722 ecr 4245445129], length 0
08:43:55.477269 IP 192.168.20.3.60460 > 192.168.20.4.80: Flags [P.], seq 69:139, ack 20267, win 501, options [nop,nop,TS val 3973745722 ecr 4245445129], length 70: HTTP: GET /20MB HTTP/1.1
08:43:55.477306 IP 192.168.20.4.80 > 192.168.20.3.60466: Flags [P.], seq 7241:14481, ack 69, win 509, options [nop,nop,TS val 4245445129 ecr 3973745722], length 7240: HTTP
08:43:55.477309 IP 192.168.20.3.60466 > 192.168.20.4.80: Flags [.], ack 14481, win 474, options [nop,nop,TS val 3973745722 ecr 4245445129], length 0
08:43:55.477362 IP 192.168.20.4.80 > 192.168.20.3.60466: Flags [.], seq 14481:18825, ack 69, win 509, options [nop,nop,TS val 4245445129 ecr 3973745722], length 4344: HTTP
08:43:55.477364 IP 192.168.20.3.60466 > 192.168.20.4.80: Flags [.], ack 18825, win 489, options [nop,nop,TS val 3973745722 ecr 4245445129], length 0
08:43:55.477410 IP 192.168.20.4.80 > 192.168.20.3.60466: Flags [P.], seq 18825:20267, ack 69, win 509, options [nop,nop,TS val 4245445129 ecr 3973745722], length 1442: HTTP
08:43:55.477411 IP 192.168.20.4.80 > 192.168.20.3.60460: Flags [.], ack 139, win 509, options [nop,nop,TS val 4245445129 ecr 3973745722], length 0
08:43:55.477413 IP 192.168.20.3.60466 > 192.168.20.4.80: Flags [.], ack 20267, win 501, options [nop,nop,TS val 3973745722 ecr 4245445129], length 0
08:43:55.477569 IP 192.168.20.3.60466 > 192.168.20.4.80: Flags [P.], seq 69:139, ack 20267, win 501, options [nop,nop,TS val 3973745723 ecr 4245445129], length 70: HTTP: GET /20MB HTTP/1.1
08:43:55.477704 IP 192.168.20.4.80 > 192.168.20.3.60466: Flags [.], ack 139, win 509, options [nop,nop,TS val 4245445129 ecr 3973745723], length 0
08:43:55.477866 IP 192.168.20.4.80 > 192.168.20.3.60460: Flags [.], seq 20267:21715, ack 139, win 509, options [nop,nop,TS val 4245445129 ecr 3973745722], length 1448: HTTP: HTTP/1.1 206 Partial Content
08:43:55.477916 IP 192.168.20.4.80 > 192.168.20.3.60460: Flags [.], seq 21715:27507, ack 139, win 509, options [nop,nop,TS val 4245445129 ecr 3973745722], length 5792: HTTP
08:43:55.477919 IP 192.168.20.3.60460 > 192.168.20.4.80: Flags [.], ack 27507, win 592, options [nop,nop,TS val 3973745723 ecr 4245445129], length 0
08:43:55.477967 IP 192.168.20.4.80 > 192.168.20.3.60460: Flags [.], seq 27507:34747, ack 139, win 509, options [nop,nop,TS val 4245445129 ecr 3973745722], length 7240: HTTP
08:43:55.477970 IP 192.168.20.3.60460 > 192.168.20.4.80: Flags [.], ack 34747, win 705, options [nop,nop,TS val 3973745723 ecr 4245445129], length 0
08:43:55.478013 IP 192.168.20.4.80 > 192.168.20.3.60460: Flags [P.], seq 34747:37643, ack 139, win 509, options [nop,nop,TS val 4245445129 ecr 3973745722], length 2896: HTTP
08:43:55.478014 IP 192.168.20.4.80 > 192.168.20.3.60460: Flags [P.], seq 37643:40535, ack 139, win 509, options [nop,nop,TS val 4245445129 ecr 3973745722], length 2892: HTTP
08:43:55.478017 IP 192.168.20.3.60460 > 192.168.20.4.80: Flags [.], ack 37643, win 750, options [nop,nop,TS val 3973745723 ecr 4245445129], length 0
08:43:55.478020 IP 192.168.20.3.60460 > 192.168.20.4.80: Flags [.], ack 40535, win 795, options [nop,nop,TS val 3973745723 ecr 4245445129], length 0
08:43:55.478064 IP 192.168.20.4.80 > 192.168.20.3.60466: Flags [.], seq 20267:24611, ack 139, win 509, options [nop,nop,TS val 4245445130 ecr 3973745723], length 4344: HTTP: HTTP/1.1 206 Partial Content
08:43:55.478114 IP 192.168.20.4.80 > 192.168.20.3.60466: Flags [.], seq 24611:30403, ack 139, win 509, options [nop,nop,TS val 4245445130 ecr 3973745723], length 5792: HTTP
08:43:55.478161 IP 192.168.20.3.60466 > 192.168.20.4.80: Flags [.], ack 30403, win 501, options [nop,nop,TS val 3973745723 ecr 4245445130], length 0
08:43:55.478166 IP 192.168.20.4.80 > 192.168.20.3.60466: Flags [P.], seq 30403:36195, ack 139, win 509, options [nop,nop,TS val 4245445130 ecr 3973745723], length 5792: HTTP
08:43:55.478173 IP 192.168.20.3.60466 > 192.168.20.4.80: Flags [.], ack 36195, win 501, options [nop,nop,TS val 3973745723 ecr 4245445130], length 0
08:43:55.478185 IP 192.168.20.3.60460 > 192.168.20.4.80: Flags [P.], seq 139:209, ack 40535, win 795, options [nop,nop,TS val 3973745723 ecr 4245445129], length 70: HTTP: GET /20MB HTTP/1.1
08:43:55.478213 IP 192.168.20.4.80 > 192.168.20.3.60466: Flags [P.], seq 36195:40535, ack 139, win 509, options [nop,nop,TS val 4245445130 ecr 3973745723], length 4340: HTTP
08:43:55.478222 IP 192.168.20.3.60466 > 192.168.20.4.80: Flags [.], ack 40535, win 501, options [nop,nop,TS val 3973745723 ecr 4245445130], length 0
08:43:55.478315 IP 192.168.20.3.60466 > 192.168.20.4.80: Flags [P.], seq 139:209, ack 40535, win 501, options [nop,nop,TS val 3973745723 ecr 4245445130], length 70: HTTP: GET /20MB HTTP/1.1
08:43:55.478427 IP 192.168.20.4.80 > 192.168.20.3.60460: Flags [.], ack 209, win 509, options [nop,nop,TS val 4245445130 ecr 3973745723], length 0
08:43:55.478688 IP 192.168.20.4.80 > 192.168.20.3.60460: Flags [.], seq 40535:44879, ack 209, win 509, options [nop,nop,TS val 4245445130 ecr 3973745723], length 4344: HTTP: HTTP/1.1 206 Partial Content
08:43:55.478693 IP 192.168.20.3.60460 > 192.168.20.4.80: Flags [.], ack 44879, win 863, options [nop,nop,TS val 3973745724 ecr 4245445130], length 0
08:43:55.478734 IP 192.168.20.4.80 > 192.168.20.3.60460: Flags [.], seq 44879:47775, ack 209, win 509, options [nop,nop,TS val 4245445130 ecr 3973745723], length 2896: HTTP
08:43:55.478736 IP 192.168.20.3.60460 > 192.168.20.4.80: Flags [.], ack 47775, win 908, options [nop,nop,TS val 3973745724 ecr 4245445130], length 0
08:43:55.478791 IP 192.168.20.4.80 > 192.168.20.3.60460: Flags [.], seq 47775:57911, ack 209, win 509, options [nop,nop,TS val 4245445130 ecr 3973745723], length 10136: HTTP
08:43:55.478793 IP 192.168.20.3.60460 > 192.168.20.4.80: Flags [.], ack 57911, win 1008, options [nop,nop,TS val 3973745724 ecr 4245445130], length 0
08:43:55.478834 IP 192.168.20.4.80 > 192.168.20.3.60460: Flags [.], seq 57911:59359, ack 209, win 509, options [nop,nop,TS val 4245445130 ecr 3973745723], length 1448: HTTP
08:43:55.478843 IP 192.168.20.4.80 > 192.168.20.3.60460: Flags [P.], seq 59359:60803, ack 209, win 509, options [nop,nop,TS val 4245445130 ecr 3973745723], length 1444: HTTP
08:43:55.478844 IP 192.168.20.4.80 > 192.168.20.3.60466: Flags [.], ack 209, win 509, options [nop,nop,TS val 4245445130 ecr 3973745723], length 0
08:43:55.478846 IP 192.168.20.3.60460 > 192.168.20.4.80: Flags [.], ack 60803, win 1053, options [nop,nop,TS val 3973745724 ecr 4245445130], length 0
08:43:55.478853 IP 192.168.20.4.80 > 192.168.20.3.60466: Flags [.], seq 40535:41983, ack 209, win 509, options [nop,nop,TS val 4245445130 ecr 3973745723], length 1448: HTTP: HTTP/1.1 206 Partial Content
08:43:55.478901 IP 192.168.20.4.80 > 192.168.20.3.60466: Flags [.], seq 41983:46327, ack 209, win 509, options [nop,nop,TS val 4245445130 ecr 3973745723], length 4344: HTTP
08:43:55.478901 IP 192.168.20.3.60460 > 192.168.20.4.80: Flags [P.], seq 209:279, ack 60803, win 1053, options [nop,nop,TS val 3973745724 ecr 4245445130], length 70: HTTP: GET /20MB HTTP/1.1
08:43:55.478911 IP 192.168.20.3.60466 > 192.168.20.4.80: Flags [.], ack 46327, win 501, options [nop,nop,TS val 3973745724 ecr 4245445130], length 0
08:43:55.478958 IP 192.168.20.4.80 > 192.168.20.3.60466: Flags [.], seq 46327:53567, ack 209, win 509, options [nop,nop,TS val 4245445130 ecr 3973745723], length 7240: HTTP
08:43:55.478967 IP 192.168.20.3.60466 > 192.168.20.4.80: Flags [.], ack 53567, win 501, options [nop,nop,TS val 3973745724 ecr 4245445130], length 0
08:43:55.478982 IP 192.168.20.4.80 > 192.168.20.3.60466: Flags [.], seq 53567:56463, ack 209, win 509, options [nop,nop,TS val 4245445130 ecr 3973745723], length 2896: HTTP
08:43:55.478990 IP 192.168.20.3.60466 > 192.168.20.4.80: Flags [.], ack 56463, win 501, options [nop,nop,TS val 3973745724 ecr 4245445130], length 0
08:43:55.479034 IP 192.168.20.4.80 > 192.168.20.3.60466: Flags [P.], seq 56463:60803, ack 209, win 509, options [nop,nop,TS val 4245445130 ecr 3973745723], length 4340: HTTP
08:43:55.479042 IP 192.168.20.3.60466 > 192.168.20.4.80: Flags [.], ack 60803, win 501, options [nop,nop,TS val 3973745724 ecr 4245445130], length 0
08:43:55.479080 IP 192.168.20.3.60466 > 192.168.20.4.80: Flags [P.], seq 209:279, ack 60803, win 501, options [nop,nop,TS val 3973745724 ecr 4245445130], length 70: HTTP: GET /20MB HTTP/1.1
08:43:55.479342 IP 192.168.20.4.80 > 192.168.20.3.60466: Flags [.], ack 279, win 509, options [nop,nop,TS val 4245445131 ecr 3973745724], length 0
08:43:55.479394 IP 192.168.20.4.80 > 192.168.20.3.60460: Flags [.], ack 279, win 509, options [nop,nop,TS val 4245445131 ecr 3973745724], length 0
08:43:55.479539 IP 192.168.20.4.80 > 192.168.20.3.60466: Flags [.], seq 60803:62251, ack 279, win 509, options [nop,nop,TS val 4245445131 ecr 3973745724], length 1448: HTTP: HTTP/1.1 206 Partial Content
08:43:55.479594 IP 192.168.20.4.80 > 192.168.20.3.60466: Flags [.], seq 62251:68043, ack 279, win 509, options [nop,nop,TS val 4245445131 ecr 3973745724], length 5792: HTTP
08:43:55.479613 IP 192.168.20.3.60466 > 192.168.20.4.80: Flags [.], ack 68043, win 501, options [nop,nop,TS val 3973745725 ecr 4245445131], length 0
08:43:55.479651 IP 192.168.20.4.80 > 192.168.20.3.60466: Flags [.], seq 68043:75283, ack 279, win 509, options [nop,nop,TS val 4245445131 ecr 3973745724], length 7240: HTTP
08:43:55.479664 IP 192.168.20.3.60466 > 192.168.20.4.80: Flags [.], ack 75283, win 501, options [nop,nop,TS val 3973745725 ecr 4245445131], length 0
08:43:55.479698 IP 192.168.20.4.80 > 192.168.20.3.60466: Flags [.], seq 75283:79627, ack 279, win 509, options [nop,nop,TS val 4245445131 ecr 3973745724], length 4344: HTTP
08:43:55.479703 IP 192.168.20.3.60466 > 192.168.20.4.80: Flags [.], ack 79627, win 569, options [nop,nop,TS val 3973745725 ecr 4245445131], length 0
08:43:55.479746 IP 192.168.20.4.80 > 192.168.20.3.60466: Flags [P.], seq 79627:81071, ack 279, win 509, options [nop,nop,TS val 4245445131 ecr 3973745724], length 1444: HTTP
08:43:55.479748 IP 192.168.20.4.80 > 192.168.20.3.60460: Flags [.], seq 60803:65147, ack 279, win 509, options [nop,nop,TS val 4245445131 ecr 3973745724], length 4344: HTTP: HTTP/1.1 206 Partial Content
08:43:55.479790 IP 192.168.20.4.80 > 192.168.20.3.60460: Flags [.], seq 65147:70939, ack 279, win 509, options [nop,nop,TS val 4245445131 ecr 3973745724], length 5792: HTTP
08:43:55.479799 IP 192.168.20.3.60460 > 192.168.20.4.80: Flags [.], ack 70939, win 1053, options [nop,nop,TS val 3973745725 ecr 4245445131], length 0
08:43:55.479840 IP 192.168.20.4.80 > 192.168.20.3.60460: Flags [.], seq 70939:76731, ack 279, win 509, options [nop,nop,TS val 4245445131 ecr 3973745724], length 5792: HTTP
08:43:55.479842 IP 192.168.20.3.60460 > 192.168.20.4.80: Flags [.], ack 76731, win 1143, options [nop,nop,TS val 3973745725 ecr 4245445131], length 0
08:43:55.479889 IP 192.168.20.4.80 > 192.168.20.3.60460: Flags [P.], seq 76731:81071, ack 279, win 509, options [nop,nop,TS val 4245445131 ecr 3973745724], length 4340: HTTP
08:43:55.479891 IP 192.168.20.3.60460 > 192.168.20.4.80: Flags [.], ack 81071, win 1211, options [nop,nop,TS val 3973745725 ecr 4245445131], length 0
08:43:55.479958 IP 192.168.20.3.60466 > 192.168.20.4.80: Flags [P.], seq 279:349, ack 81071, win 592, options [nop,nop,TS val 3973745725 ecr 4245445131], length 70: HTTP: GET /20MB HTTP/1.1
08:43:55.480378 IP 192.168.20.4.80 > 192.168.20.3.60466: Flags [.], ack 349, win 509, options [nop,nop,TS val 4245445132 ecr 3973745725], length 0
08:43:55.480449 IP 192.168.20.3.60460 > 192.168.20.4.80: Flags [P.], seq 279:349, ack 81071, win 1211, options [nop,nop,TS val 3973745725 ecr 4245445131], length 70: HTTP: GET /20MB HTTP/1.1
08:43:55.480638 IP 192.168.20.4.80 > 192.168.20.3.60466: Flags [.], seq 81071:85415, ack 349, win 509, options [nop,nop,TS val 4245445132 ecr 3973745725], length 4344: HTTP: HTTP/1.1 206 Partial Content
08:43:55.480641 IP 192.168.20.3.60466 > 192.168.20.4.80: Flags [.], ack 85415, win 660, options [nop,nop,TS val 3973745726 ecr 4245445132], length 0
08:43:55.480692 IP 192.168.20.4.80 > 192.168.20.3.60466: Flags [.], seq 85415:91207, ack 349, win 509, options [nop,nop,TS val 4245445132 ecr 3973745725], length 5792: HTTP
08:43:55.480694 IP 192.168.20.3.60466 > 192.168.20.4.80: Flags [.], ack 91207, win 750, options [nop,nop,TS val 3973745726 ecr 4245445132], length 0
08:43:55.480740 IP 192.168.20.4.80 > 192.168.20.3.60466: Flags [.], seq 91207:98447, ack 349, win 509, options [nop,nop,TS val 4245445132 ecr 3973745725], length 7240: HTTP
08:43:55.480742 IP 192.168.20.3.60466 > 192.168.20.4.80: Flags [.], ack 98447, win 863, options [nop,nop,TS val 3973745726 ecr 4245445132], length 0
08:43:55.480787 IP 192.168.20.4.80 > 192.168.20.3.60466: Flags [P.], seq 98447:101339, ack 349, win 509, options [nop,nop,TS val 4245445132 ecr 3973745725], length 2892: HTTP
08:43:55.480789 IP 192.168.20.3.60466 > 192.168.20.4.80: Flags [.], ack 101339, win 908, options [nop,nop,TS val 3973745726 ecr 4245445132], length 0
08:43:55.480833 IP 192.168.20.3.60466 > 192.168.20.4.80: Flags [P.], seq 349:419, ack 101339, win 908, options [nop,nop,TS val 3973745726 ecr 4245445132], length 70: HTTP: GET /20MB HTTP/1.1
08:43:55.480986 IP 192.168.20.4.80 > 192.168.20.3.60460: Flags [.], ack 349, win 509, options [nop,nop,TS val 4245445133 ecr 3973745725], length 0
08:43:55.481166 IP 192.168.20.4.80 > 192.168.20.3.60466: Flags [.], ack 419, win 509, options [nop,nop,TS val 4245445133 ecr 3973745726], length 0
08:43:55.481255 IP 192.168.20.4.80 > 192.168.20.3.60460: Flags [.], seq 81071:85415, ack 349, win 509, options [nop,nop,TS val 4245445133 ecr 3973745725], length 4344: HTTP: HTTP/1.1 206 Partial Content
08:43:55.481257 IP 192.168.20.3.60460 > 192.168.20.4.80: Flags [.], ack 85415, win 1279, options [nop,nop,TS val 3973745726 ecr 4245445133], length 0
08:43:55.481308 IP 192.168.20.4.80 > 192.168.20.3.60460: Flags [.], seq 85415:92655, ack 349, win 509, options [nop,nop,TS val 4245445133 ecr 3973745725], length 7240: HTTP
08:43:55.481310 IP 192.168.20.3.60460 > 192.168.20.4.80: Flags [.], ack 92655, win 1392, options [nop,nop,TS val 3973745726 ecr 4245445133], length 0
08:43:55.481363 IP 192.168.20.4.80 > 192.168.20.3.60460: Flags [.], seq 92655:98447, ack 349, win 509, options [nop,nop,TS val 4245445133 ecr 3973745725], length 5792: HTTP
08:43:55.481368 IP 192.168.20.3.60460 > 192.168.20.4.80: Flags [.], ack 98447, win 1483, options [nop,nop,TS val 3973745726 ecr 4245445133], length 0
08:43:55.481407 IP 192.168.20.4.80 > 192.168.20.3.60460: Flags [P.], seq 98447:101339, ack 349, win 509, options [nop,nop,TS val 4245445133 ecr 3973745725], length 2892: HTTP
08:43:55.481409 IP 192.168.20.4.80 > 192.168.20.3.60466: Flags [.], seq 101339:104235, ack 419, win 509, options [nop,nop,TS val 4245445133 ecr 3973745726], length 2896: HTTP: HTTP/1.1 206 Partial Content
08:43:55.481414 IP 192.168.20.3.60460 > 192.168.20.4.80: Flags [.], ack 101339, win 1528, options [nop,nop,TS val 3973745726 ecr 4245445133], length 0
08:43:55.481420 IP 192.168.20.3.60466 > 192.168.20.4.80: Flags [.], ack 104235, win 954, options [nop,nop,TS val 3973745726 ecr 4245445133], length 0
08:43:55.481458 IP 192.168.20.4.80 > 192.168.20.3.60466: Flags [.], seq 104235:110027, ack 419, win 509, options [nop,nop,TS val 4245445133 ecr 3973745726], length 5792: HTTP
08:43:55.481463 IP 192.168.20.3.60466 > 192.168.20.4.80: Flags [.], ack 110027, win 1044, options [nop,nop,TS val 3973745726 ecr 4245445133], length 0
08:43:55.481505 IP 192.168.20.4.80 > 192.168.20.3.60466: Flags [.], seq 110027:115819, ack 419, win 509, options [nop,nop,TS val 4245445133 ecr 3973745726], length 5792: HTTP
08:43:55.481508 IP 192.168.20.3.60466 > 192.168.20.4.80: Flags [.], ack 115819, win 1135, options [nop,nop,TS val 3973745726 ecr 4245445133], length 0
08:43:55.481557 IP 192.168.20.4.80 > 192.168.20.3.60466: Flags [P.], seq 115819:121607, ack 419, win 509, options [nop,nop,TS val 4245445133 ecr 3973745726], length 5788: HTTP
08:43:55.481560 IP 192.168.20.3.60466 > 192.168.20.4.80: Flags [.], ack 121607, win 1225, options [nop,nop,TS val 3973745727 ecr 4245445133], length 0
08:43:55.481633 IP 192.168.20.3.60460 > 192.168.20.4.80: Flags [P.], seq 349:419, ack 101339, win 1528, options [nop,nop,TS val 3973745727 ecr 4245445133], length 70: HTTP: GET /20MB HTTP/1.1
08:43:55.481646 IP 192.168.20.3.60466 > 192.168.20.4.80: Flags [P.], seq 419:489, ack 121607, win 1225, options [nop,nop,TS val 3973745727 ecr 4245445133], length 70: HTTP: GET /20MB HTTP/1.1
08:43:55.482176 IP 192.168.20.4.80 > 192.168.20.3.60460: Flags [.], ack 419, win 509, options [nop,nop,TS val 4245445134 ecr 3973745727], length 0
08:43:55.482229 IP 192.168.20.4.80 > 192.168.20.3.60466: Flags [.], ack 489, win 509, options [nop,nop,TS val 4245445134 ecr 3973745727], length 0
08:43:55.482382 IP 192.168.20.4.80 > 192.168.20.3.60460: Flags [.], seq 101339:104235, ack 419, win 509, options [nop,nop,TS val 4245445134 ecr 3973745727], length 2896: HTTP: HTTP/1.1 206 Partial Content
08:43:55.482386 IP 192.168.20.3.60460 > 192.168.20.4.80: Flags [.], ack 104235, win 1573, options [nop,nop,TS val 3973745727 ecr 4245445134], length 0
08:43:55.482433 IP 192.168.20.4.80 > 192.168.20.3.60460: Flags [.], seq 104235:110027, ack 419, win 509, options [nop,nop,TS val 4245445134 ecr 3973745727], length 5792: HTTP
08:43:55.482436 IP 192.168.20.3.60460 > 192.168.20.4.80: Flags [.], ack 110027, win 1663, options [nop,nop,TS val 3973745727 ecr 4245445134], length 0
08:43:55.482483 IP 192.168.20.4.80 > 192.168.20.3.60460: Flags [.], seq 110027:115819, ack 419, win 509, options [nop,nop,TS val 4245445134 ecr 3973745727], length 5792: HTTP
08:43:55.482487 IP 192.168.20.3.60460 > 192.168.20.4.80: Flags [.], ack 115819, win 1754, options [nop,nop,TS val 3973745727 ecr 4245445134], length 0
08:43:55.482536 IP 192.168.20.4.80 > 192.168.20.3.60460: Flags [P.], seq 115819:121607, ack 419, win 509, options [nop,nop,TS val 4245445134 ecr 3973745727], length 5788: HTTP
08:43:55.482539 IP 192.168.20.3.60460 > 192.168.20.4.80: Flags [.], ack 121607, win 1844, options [nop,nop,TS val 3973745728 ecr 4245445134], length 0
08:43:55.482584 IP 192.168.20.4.80 > 192.168.20.3.60466: Flags [.], seq 121607:127399, ack 489, win 509, options [nop,nop,TS val 4245445134 ecr 3973745727], length 5792: HTTP: HTTP/1.1 206 Partial Content
08:43:55.482586 IP 192.168.20.3.60466 > 192.168.20.4.80: Flags [.], ack 127399, win 1316, options [nop,nop,TS val 3973745728 ecr 4245445134], length 0
08:43:55.482604 IP 192.168.20.3.60460 > 192.168.20.4.80: Flags [P.], seq 419:489, ack 121607, win 1844, options [nop,nop,TS val 3973745728 ecr 4245445134], length 70: HTTP: GET /20MB HTTP/1.1
08:43:55.482632 IP 192.168.20.4.80 > 192.168.20.3.60466: Flags [.], seq 127399:133191, ack 489, win 509, options [nop,nop,TS val 4245445134 ecr 3973745727], length 5792: HTTP
08:43:55.482634 IP 192.168.20.3.60466 > 192.168.20.4.80: Flags [.], ack 133191, win 1406, options [nop,nop,TS val 3973745728 ecr 4245445134], length 0
08:43:55.482682 IP 192.168.20.4.80 > 192.168.20.3.60466: Flags [.], seq 133191:138983, ack 489, win 509, options [nop,nop,TS val 4245445134 ecr 3973745727], length 5792: HTTP
08:43:55.482684 IP 192.168.20.3.60466 > 192.168.20.4.80: Flags [.], ack 138983, win 1497, options [nop,nop,TS val 3973745728 ecr 4245445134], length 0
08:43:55.482730 IP 192.168.20.4.80 > 192.168.20.3.60466: Flags [P.], seq 138983:141875, ack 489, win 509, options [nop,nop,TS val 4245445134 ecr 3973745727], length 2892: HTTP
08:43:55.482732 IP 192.168.20.3.60466 > 192.168.20.4.80: Flags [.], ack 141875, win 1542, options [nop,nop,TS val 3973745728 ecr 4245445134], length 0
08:43:55.483043 IP 192.168.20.4.80 > 192.168.20.3.60460: Flags [.], ack 489, win 509, options [nop,nop,TS val 4245445135 ecr 3973745728], length 0
08:43:55.483111 IP 192.168.20.3.60466 > 192.168.20.4.80: Flags [P.], seq 489:559, ack 141875, win 1542, options [nop,nop,TS val 3973745728 ecr 4245445134], length 70: HTTP: GET /20MB HTTP/1.1
08:43:55.483251 IP 192.168.20.4.80 > 192.168.20.3.60460: Flags [.], seq 121607:123055, ack 489, win 509, options [nop,nop,TS val 4245445135 ecr 3973745728], length 1448: HTTP: HTTP/1.1 206 Partial Content
08:43:55.483305 IP 192.168.20.4.80 > 192.168.20.3.60460: Flags [.], seq 123055:128847, ack 489, win 509, options [nop,nop,TS val 4245445135 ecr 3973745728], length 5792: HTTP
08:43:55.483308 IP 192.168.20.3.60460 > 192.168.20.4.80: Flags [.], ack 128847, win 1958, options [nop,nop,TS val 3973745728 ecr 4245445135], length 0
08:43:55.483352 IP 192.168.20.4.80 > 192.168.20.3.60460: Flags [.], seq 128847:134639, ack 489, win 509, options [nop,nop,TS val 4245445135 ecr 3973745728], length 5792: HTTP
08:43:55.483355 IP 192.168.20.3.60460 > 192.168.20.4.80: Flags [.], ack 134639, win 2048, options [nop,nop,TS val 3973745728 ecr 4245445135], length 0
08:43:55.483411 IP 192.168.20.4.80 > 192.168.20.3.60460: Flags [.], seq 134639:140431, ack 489, win 509, options [nop,nop,TS val 4245445135 ecr 3973745728], length 5792: HTTP
08:43:55.483415 IP 192.168.20.3.60460 > 192.168.20.4.80: Flags [.], ack 140431, win 2139, options [nop,nop,TS val 3973745728 ecr 4245445135], length 0
08:43:55.483451 IP 192.168.20.4.80 > 192.168.20.3.60460: Flags [P.], seq 140431:141875, ack 489, win 509, options [nop,nop,TS val 4245445135 ecr 3973745728], length 1444: HTTP
08:43:55.483499 IP 192.168.20.3.60460 > 192.168.20.4.80: Flags [P.], seq 489:559, ack 141875, win 2161, options [nop,nop,TS val 3973745728 ecr 4245445135], length 70: HTTP: GET /20MB HTTP/1.1
08:43:55.483664 IP 192.168.20.4.80 > 192.168.20.3.60466: Flags [.], ack 559, win 509, options [nop,nop,TS val 4245445135 ecr 3973745728], length 0
08:43:55.483843 IP 192.168.20.4.80 > 192.168.20.3.60460: Flags [.], ack 559, win 509, options [nop,nop,TS val 4245445135 ecr 3973745728], length 0
08:43:55.483894 IP 192.168.20.4.80 > 192.168.20.3.60466: Flags [.], seq 141875:143323, ack 559, win 509, options [nop,nop,TS val 4245445135 ecr 3973745728], length 1448: HTTP: HTTP/1.1 206 Partial Content
08:43:55.483976 IP 192.168.20.4.80 > 192.168.20.3.60466: Flags [.], seq 143323:154907, ack 559, win 509, options [nop,nop,TS val 4245445135 ecr 3973745728], length 11584: HTTP
08:43:55.483978 IP 192.168.20.3.60466 > 192.168.20.4.80: Flags [.], ack 154907, win 1745, options [nop,nop,TS val 3973745729 ecr 4245445135], length 0
08:43:55.484003 IP 192.168.20.4.80 > 192.168.20.3.60466: Flags [.], seq 154907:157803, ack 559, win 509, options [nop,nop,TS val 4245445135 ecr 3973745728], length 2896: HTTP
08:43:55.484007 IP 192.168.20.3.60466 > 192.168.20.4.80: Flags [.], ack 157803, win 1791, options [nop,nop,TS val 3973745729 ecr 4245445135], length 0
08:43:55.484267 IP 192.168.20.4.80 > 192.168.20.3.60466: Flags [P.], seq 157803:162143, ack 559, win 509, options [nop,nop,TS val 4245445135 ecr 3973745728], length 4340: HTTP
08:43:55.484272 IP 192.168.20.4.80 > 192.168.20.3.60460: Flags [P.], seq 141875:162143, ack 559, win 509, options [nop,nop,TS val 4245445136 ecr 3973745728], length 20268: HTTP: HTTP/1.1 206 Partial Content
08:43:55.484279 IP 192.168.20.3.60466 > 192.168.20.4.80: Flags [.], ack 162143, win 1858, options [nop,nop,TS val 3973745729 ecr 4245445135], length 0
08:43:55.484288 IP 192.168.20.3.60460 > 192.168.20.4.80: Flags [.], ack 162143, win 2478, options [nop,nop,TS val 3973745729 ecr 4245445136], length 0
08:43:55.484442 IP 192.168.20.3.60460 > 192.168.20.4.80: Flags [P.], seq 559:629, ack 162143, win 2478, options [nop,nop,TS val 3973745729 ecr 4245445136], length 70: HTTP: GET /20MB HTTP/1.1
08:43:55.484455 IP 192.168.20.3.60466 > 192.168.20.4.80: Flags [P.], seq 559:629, ack 162143, win 1858, options [nop,nop,TS val 3973745729 ecr 4245445135], length 70: HTTP: GET /20MB HTTP/1.1
08:43:55.484930 IP 192.168.20.4.80 > 192.168.20.3.60460: Flags [.], ack 629, win 509, options [nop,nop,TS val 4245445137 ecr 3973745729], length 0
08:43:55.484964 IP 192.168.20.4.80 > 192.168.20.3.60466: Flags [.], ack 629, win 509, options [nop,nop,TS val 4245445137 ecr 3973745729], length 0
08:43:55.485230 IP 192.168.20.4.80 > 192.168.20.3.60466: Flags [.], seq 162143:166487, ack 629, win 509, options [nop,nop,TS val 4245445137 ecr 3973745729], length 4344: HTTP: HTTP/1.1 206 Partial Content
08:43:55.485235 IP 192.168.20.3.60466 > 192.168.20.4.80: Flags [.], ack 166487, win 1926, options [nop,nop,TS val 3973745730 ecr 4245445137], length 0
08:43:55.485253 IP 192.168.20.4.80 > 192.168.20.3.60466: Flags [.], seq 166487:169383, ack 629, win 509, options [nop,nop,TS val 4245445137 ecr 3973745729], length 2896: HTTP
08:43:55.485258 IP 192.168.20.3.60466 > 192.168.20.4.80: Flags [.], ack 169383, win 1972, options [nop,nop,TS val 3973745730 ecr 4245445137], length 0
08:43:55.485274 IP 192.168.20.4.80 > 192.168.20.3.60466: Flags [.], seq 169383:172279, ack 629, win 509, options [nop,nop,TS val 4245445137 ecr 3973745729], length 2896: HTTP
08:43:55.485276 IP 192.168.20.3.60466 > 192.168.20.4.80: Flags [.], ack 172279, win 2017, options [nop,nop,TS val 3973745730 ecr 4245445137], length 0
08:43:55.485325 IP 192.168.20.4.80 > 192.168.20.3.60466: Flags [.], seq 172279:178071, ack 629, win 509, options [nop,nop,TS val 4245445137 ecr 3973745729], length 5792: HTTP
08:43:55.485330 IP 192.168.20.3.60466 > 192.168.20.4.80: Flags [.], ack 178071, win 2107, options [nop,nop,TS val 3973745730 ecr 4245445137], length 0
08:43:55.485368 IP 192.168.20.4.80 > 192.168.20.3.60466: Flags [.], seq 178071:179519, ack 629, win 509, options [nop,nop,TS val 4245445137 ecr 3973745729], length 1448: HTTP
08:43:55.485425 IP 192.168.20.4.80 > 192.168.20.3.60466: Flags [P.], seq 179519:182411, ack 629, win 509, options [nop,nop,TS val 4245445137 ecr 3973745729], length 2892: HTTP
08:43:55.485427 IP 192.168.20.4.80 > 192.168.20.3.60460: Flags [.], seq 162143:169383, ack 629, win 509, options [nop,nop,TS val 4245445137 ecr 3973745729], length 7240: HTTP: HTTP/1.1 206 Partial Content
08:43:55.485430 IP 192.168.20.3.60466 > 192.168.20.4.80: Flags [.], ack 182411, win 2175, options [nop,nop,TS val 3973745730 ecr 4245445137], length 0
08:43:55.485433 IP 192.168.20.3.60460 > 192.168.20.4.80: Flags [.], ack 169383, win 2591, options [nop,nop,TS val 3973745730 ecr 4245445137], length 0
08:43:55.485468 IP 192.168.20.4.80 > 192.168.20.3.60460: Flags [.], seq 169383:170831, ack 629, win 509, options [nop,nop,TS val 4245445137 ecr 3973745729], length 1448: HTTP
08:43:55.485634 IP 192.168.20.3.60466 > 192.168.20.4.80: Flags [P.], seq 629:699, ack 182411, win 2175, options [nop,nop,TS val 3973745731 ecr 4245445137], length 70: HTTP: GET /20MB HTTP/1.1
08:43:55.485725 IP 192.168.20.4.80 > 192.168.20.3.60460: Flags [P.], seq 170831:182411, ack 629, win 509, options [nop,nop,TS val 4245445137 ecr 3973745729], length 11580: HTTP
08:43:55.485727 IP 192.168.20.3.60460 > 192.168.20.4.80: Flags [.], ack 182411, win 2795, options [nop,nop,TS val 3973745731 ecr 4245445137], length 0
08:43:55.485803 IP 192.168.20.3.60460 > 192.168.20.4.80: Flags [P.], seq 629:699, ack 182411, win 2795, options [nop,nop,TS val 3973745731 ecr 4245445137], length 70: HTTP: GET /20MB HTTP/1.1
08:43:55.486126 IP 192.168.20.4.80 > 192.168.20.3.60466: Flags [.], ack 699, win 509, options [nop,nop,TS val 4245445138 ecr 3973745731], length 0
08:43:55.486190 IP 192.168.20.4.80 > 192.168.20.3.60460: Flags [.], ack 699, win 509, options [nop,nop,TS val 4245445138 ecr 3973745731], length 0
08:43:55.486309 IP 192.168.20.4.80 > 192.168.20.3.60466: Flags [.], seq 182411:183859, ack 699, win 509, options [nop,nop,TS val 4245445138 ecr 3973745731], length 1448: HTTP: HTTP/1.1 206 Partial Content
08:43:55.486362 IP 192.168.20.4.80 > 192.168.20.3.60466: Flags [.], seq 183859:188203, ack 699, win 509, options [nop,nop,TS val 4245445138 ecr 3973745731], length 4344: HTTP
08:43:55.486367 IP 192.168.20.3.60466 > 192.168.20.4.80: Flags [.], ack 188203, win 2266, options [nop,nop,TS val 3973745731 ecr 4245445138], length 0
08:43:55.486413 IP 192.168.20.4.80 > 192.168.20.3.60466: Flags [.], seq 188203:195443, ack 699, win 509, options [nop,nop,TS val 4245445138 ecr 3973745731], length 7240: HTTP
08:43:55.486415 IP 192.168.20.3.60466 > 192.168.20.4.80: Flags [.], ack 195443, win 2379, options [nop,nop,TS val 3973745731 ecr 4245445138], length 0
08:43:55.486429 IP 192.168.20.4.80 > 192.168.20.3.60466: Flags [.], seq 195443:196891, ack 699, win 509, options [nop,nop,TS val 4245445138 ecr 3973745731], length 1448: HTTP
08:43:55.486480 IP 192.168.20.4.80 > 192.168.20.3.60466: Flags [.], seq 196891:201235, ack 699, win 509, options [nop,nop,TS val 4245445138 ecr 3973745731], length 4344: HTTP
08:43:55.486482 IP 192.168.20.3.60466 > 192.168.20.4.80: Flags [.], ack 201235, win 2469, options [nop,nop,TS val 3973745731 ecr 4245445138], length 0
08:43:55.486529 IP 192.168.20.4.80 > 192.168.20.3.60466: Flags [P.], seq 201235:202679, ack 699, win 509, options [nop,nop,TS val 4245445138 ecr 3973745731], length 1444: HTTP
08:43:55.486530 IP 192.168.20.4.80 > 192.168.20.3.60460: Flags [.], seq 182411:186755, ack 699, win 509, options [nop,nop,TS val 4245445138 ecr 3973745731], length 4344: HTTP: HTTP/1.1 206 Partial Content
08:43:55.486533 IP 192.168.20.3.60460 > 192.168.20.4.80: Flags [.], ack 186755, win 2862, options [nop,nop,TS val 3973745732 ecr 4245445138], length 0
08:43:55.486582 IP 192.168.20.4.80 > 192.168.20.3.60460: Flags [.], seq 186755:193995, ack 699, win 509, options [nop,nop,TS val 4245445138 ecr 3973745731], length 7240: HTTP
08:43:55.486585 IP 192.168.20.3.60460 > 192.168.20.4.80: Flags [.], ack 193995, win 2976, options [nop,nop,TS val 3973745732 ecr 4245445138], length 0
08:43:55.486631 IP 192.168.20.4.80 > 192.168.20.3.60460: Flags [.], seq 193995:198339, ack 699, win 509, options [nop,nop,TS val 4245445138 ecr 3973745731], length 4344: HTTP
08:43:55.486633 IP 192.168.20.3.60460 > 192.168.20.4.80: Flags [.], ack 198339, win 3043, options [nop,nop,TS val 3973745732 ecr 4245445138], length 0
08:43:55.486649 IP 192.168.20.3.60466 > 192.168.20.4.80: Flags [P.], seq 699:769, ack 202679, win 2492, options [nop,nop,TS val 3973745732 ecr 4245445138], length 70: HTTP: GET /20MB HTTP/1.1
08:43:55.486679 IP 192.168.20.4.80 > 192.168.20.3.60460: Flags [P.], seq 198339:202679, ack 699, win 509, options [nop,nop,TS val 4245445138 ecr 3973745731], length 4340: HTTP
08:43:55.486681 IP 192.168.20.3.60460 > 192.168.20.4.80: Flags [.], ack 202679, win 3111, options [nop,nop,TS val 3973745732 ecr 4245445138], length 0
08:43:55.486743 IP 192.168.20.3.60460 > 192.168.20.4.80: Flags [P.], seq 699:769, ack 202679, win 3111, options [nop,nop,TS val 3973745732 ecr 4245445138], length 70: HTTP: GET /20MB HTTP/1.1
08:43:55.487194 IP 192.168.20.4.80 > 192.168.20.3.60466: Flags [.], seq 202679:204127, ack 769, win 509, options [nop,nop,TS val 4245445139 ecr 3973745732], length 1448: HTTP: HTTP/1.1 206 Partial Content
08:43:55.487246 IP 192.168.20.4.80 > 192.168.20.3.60466: Flags [.], seq 204127:209919, ack 769, win 509, options [nop,nop,TS val 4245445139 ecr 3973745732], length 5792: HTTP
08:43:55.487250 IP 192.168.20.3.60466 > 192.168.20.4.80: Flags [.], ack 209919, win 2605, options [nop,nop,TS val 3973745732 ecr 4245445139], length 0
08:43:55.487298 IP 192.168.20.4.80 > 192.168.20.3.60466: Flags [.], seq 209919:215711, ack 769, win 509, options [nop,nop,TS val 4245445139 ecr 3973745732], length 5792: HTTP
08:43:55.487301 IP 192.168.20.3.60466 > 192.168.20.4.80: Flags [.], ack 215711, win 2695, options [nop,nop,TS val 3973745732 ecr 4245445139], length 0
08:43:55.487346 IP 192.168.20.4.80 > 192.168.20.3.60466: Flags [.], seq 215711:221503, ack 769, win 509, options [nop,nop,TS val 4245445139 ecr 3973745732], length 5792: HTTP
08:43:55.487349 IP 192.168.20.3.60466 > 192.168.20.4.80: Flags [.], ack 221503, win 2786, options [nop,nop,TS val 3973745732 ecr 4245445139], length 0
08:43:55.487394 IP 192.168.20.4.80 > 192.168.20.3.60466: Flags [P.], seq 221503:222947, ack 769, win 509, options [nop,nop,TS val 4245445139 ecr 3973745732], length 1444: HTTP
08:43:55.487394 IP 192.168.20.4.80 > 192.168.20.3.60460: Flags [.], ack 769, win 509, options [nop,nop,TS val 4245445139 ecr 3973745732], length 0
08:43:55.487474 IP 192.168.20.4.80 > 192.168.20.3.60460: Flags [.], seq 202679:205575, ack 769, win 509, options [nop,nop,TS val 4245445139 ecr 3973745732], length 2896: HTTP: HTTP/1.1 206 Partial Content
08:43:55.487477 IP 192.168.20.3.60460 > 192.168.20.4.80: Flags [.], ack 205575, win 3156, options [nop,nop,TS val 3973745732 ecr 4245445139], length 0
08:43:55.487495 IP 192.168.20.3.60466 > 192.168.20.4.80: Flags [P.], seq 769:839, ack 222947, win 2809, options [nop,nop,TS val 3973745732 ecr 4245445139], length 70: HTTP: GET /20MB HTTP/1.1
08:43:55.487525 IP 192.168.20.4.80 > 192.168.20.3.60460: Flags [.], seq 205575:211367, ack 769, win 509, options [nop,nop,TS val 4245445139 ecr 3973745732], length 5792: HTTP
08:43:55.487529 IP 192.168.20.3.60460 > 192.168.20.4.80: Flags [.], ack 211367, win 3247, options [nop,nop,TS val 3973745732 ecr 4245445139], length 0
08:43:55.487576 IP 192.168.20.4.80 > 192.168.20.3.60460: Flags [.], seq 211367:217159, ack 769, win 509, options [nop,nop,TS val 4245445139 ecr 3973745732], length 5792: HTTP
08:43:55.487580 IP 192.168.20.3.60460 > 192.168.20.4.80: Flags [.], ack 217159, win 3337, options [nop,nop,TS val 3973745733 ecr 4245445139], length 0
08:43:55.487627 IP 192.168.20.4.80 > 192.168.20.3.60460: Flags [P.], seq 217159:222947, ack 769, win 509, options [nop,nop,TS val 4245445139 ecr 3973745732], length 5788: HTTP
08:43:55.487629 IP 192.168.20.3.60460 > 192.168.20.4.80: Flags [.], ack 222947, win 3420, options [nop,nop,TS val 3973745733 ecr 4245445139], length 0
08:43:55.487857 IP 192.168.20.3.60460 > 192.168.20.4.80: Flags [P.], seq 769:841, ack 222947, win 3420, options [nop,nop,TS val 3973745733 ecr 4245445139], length 72: HTTP: GET /20MB HTTP/1.1
08:43:55.488141 IP 192.168.20.4.80 > 192.168.20.3.60466: Flags [.], seq 222947:227291, ack 839, win 509, options [nop,nop,TS val 4245445140 ecr 3973745732], length 4344: HTTP: HTTP/1.1 206 Partial Content
08:43:55.488145 IP 192.168.20.3.60466 > 192.168.20.4.80: Flags [.], ack 227291, win 2876, options [nop,nop,TS val 3973745733 ecr 4245445140], length 0
08:43:55.488192 IP 192.168.20.4.80 > 192.168.20.3.60466: Flags [.], seq 227291:233083, ack 839, win 509, options [nop,nop,TS val 4245445140 ecr 3973745732], length 5792: HTTP
08:43:55.488194 IP 192.168.20.3.60466 > 192.168.20.4.80: Flags [.], ack 233083, win 2967, options [nop,nop,TS val 3973745733 ecr 4245445140], length 0
08:43:55.488241 IP 192.168.20.4.80 > 192.168.20.3.60466: Flags [.], seq 233083:238875, ack 839, win 509, options [nop,nop,TS val 4245445140 ecr 3973745732], length 5792: HTTP
08:43:55.488243 IP 192.168.20.3.60466 > 192.168.20.4.80: Flags [.], ack 238875, win 3057, options [nop,nop,TS val 3973745733 ecr 4245445140], length 0
08:43:55.488293 IP 192.168.20.4.80 > 192.168.20.3.60466: Flags [P.], seq 238875:243215, ack 839, win 509, options [nop,nop,TS val 4245445140 ecr 3973745732], length 4340: HTTP
08:43:55.488293 IP 192.168.20.4.80 > 192.168.20.3.60460: Flags [.], ack 841, win 509, options [nop,nop,TS val 4245445140 ecr 3973745733], length 0
