06:18:28.673264 IP 192.168.10.3.49842 > 192.168.10.4.80: Flags [S], seq 1627913227, win 64240, options [mss 1460,sackOK,TS val 477316145 ecr 0,nop,wscale 7], length 0
06:18:28.673504 IP 192.168.10.4.80 > 192.168.10.3.49842: Flags [S.], seq 289750478, ack 1627913228, win 65160, options [mss 1460,sackOK,TS val 487234720 ecr 477316145,nop,wscale 7], length 0
06:18:28.673530 IP 192.168.10.3.49842 > 192.168.10.4.80: Flags [.], ack 1, win 502, options [nop,nop,TS val 477316145 ecr 487234720], length 0
06:18:28.673578 IP 192.168.10.3.49842 > 192.168.10.4.80: Flags [P.], seq 1:65, ack 1, win 502, options [nop,nop,TS val 477316146 ecr 487234720], length 64: HTTP: GET /20MB HTTP/1.1
06:18:28.674101 IP 192.168.10.4.80 > 192.168.10.3.49842: Flags [.], ack 65, win 509, options [nop,nop,TS val 487234720 ecr 477316146], length 0
06:18:28.924425 IP 192.168.10.4.80 > 192.168.10.3.49842: Flags [P.], seq 1:7241, ack 65, win 509, options [nop,nop,TS val 487234971 ecr 477316146], length 7240: HTTP: HTTP/1.1 206 Partial Content
06:18:28.924446 IP 192.168.10.3.49842 > 192.168.10.4.80: Flags [.], ack 7241, win 467, options [nop,nop,TS val 477316396 ecr 487234971], length 0
06:18:28.924530 IP 192.168.10.4.80 > 192.168.10.3.49842: Flags [.], seq 7241:13033, ack 65, win 509, options [nop,nop,TS val 487234971 ecr 477316146], length 5792: HTTP
06:18:28.924552 IP 192.168.10.3.49842 > 192.168.10.4.80: Flags [.], ack 13033, win 476, options [nop,nop,TS val 477316397 ecr 487234971], length 0
06:18:28.924613 IP 192.168.10.4.80 > 192.168.10.3.49842: Flags [P.], seq 13033:14481, ack 65, win 509, options [nop,nop,TS val 487234971 ecr 477316146], length 1448: HTTP
06:18:28.924615 IP 192.168.10.4.80 > 192.168.10.3.49842: Flags [P.], seq 14481:20263, ack 65, win 509, options [nop,nop,TS val 487234971 ecr 477316396], length 5782: HTTP
06:18:28.924639 IP 192.168.10.3.49842 > 192.168.10.4.80: Flags [.], ack 14481, win 501, options [nop,nop,TS val 477316397 ecr 487234971], length 0
06:18:28.924653 IP 192.168.10.3.49842 > 192.168.10.4.80: Flags [.], ack 20263, win 467, options [nop,nop,TS val 477316397 ecr 487234971], length 0
06:18:28.924873 IP 192.168.10.3.49842 > 192.168.10.4.80: Flags [P.], seq 65:133, ack 20263, win 501, options [nop,nop,TS val 477316397 ecr 487234971], length 68: HTTP: GET /20MB HTTP/1.1
06:18:28.925090 IP 192.168.10.4.80 > 192.168.10.3.49842: Flags [.], ack 133, win 509, options [nop,nop,TS val 487234971 ecr 477316397], length 0
06:18:28.925580 IP 192.168.10.4.80 > 192.168.10.3.49842: Flags [.], seq 20263:23159, ack 133, win 509, options [nop,nop,TS val 487234972 ecr 477316397], length 2896: HTTP: HTTP/1.1 206 Partial Content
06:18:28.925663 IP 192.168.10.3.49842 > 192.168.10.4.80: Flags [.], ack 23159, win 501, options [nop,nop,TS val 477316398 ecr 487234972], length 0
06:18:28.925693 IP 192.168.10.4.80 > 192.168.10.3.49842: Flags [P.], seq 23159:34743, ack 133, win 509, options [nop,nop,TS val 487234972 ecr 477316397], length 11584: HTTP
06:18:28.925740 IP 192.168.10.3.49842 > 192.168.10.4.80: Flags [.], ack 34743, win 501, options [nop,nop,TS val 477316398 ecr 487234972], length 0
06:18:28.925774 IP 192.168.10.4.80 > 192.168.10.3.49842: Flags [P.], seq 34743:40529, ack 133, win 509, options [nop,nop,TS val 487234972 ecr 477316397], length 5786: HTTP
06:18:28.925788 IP 192.168.10.3.49842 > 192.168.10.4.80: Flags [.], ack 40529, win 592, options [nop,nop,TS val 477316398 ecr 487234972], length 0
06:18:28.926140 IP 192.168.10.3.49842 > 192.168.10.4.80: Flags [P.], seq 133:201, ack 40529, win 592, options [nop,nop,TS val 477316398 ecr 487234972], length 68: HTTP: GET /20MB HTTP/1.1
06:18:28.926700 IP 192.168.10.4.80 > 192.168.10.3.49842: Flags [.], ack 201, win 509, options [nop,nop,TS val 487234973 ecr 477316398], length 0
06:18:28.927102 IP 192.168.10.4.80 > 192.168.10.3.49842: Flags [P.], seq 40529:60795, ack 201, win 509, options [nop,nop,TS val 487234973 ecr 477316398], length 20266: HTTP: HTTP/1.1 206 Partial Content
06:18:28.927125 IP 192.168.10.3.49842 > 192.168.10.4.80: Flags [.], ack 60795, win 795, options [nop,nop,TS val 477316399 ecr 487234973], length 0
06:18:28.927341 IP 192.168.10.3.49842 > 192.168.10.4.80: Flags [P.], seq 201:271, ack 60795, win 795, options [nop,nop,TS val 477316399 ecr 487234973], length 70: HTTP: GET /20MB HTTP/1.1
06:18:28.927802 IP 192.168.10.4.80 > 192.168.10.3.49842: Flags [.], ack 271, win 509, options [nop,nop,TS val 487234974 ecr 477316399], length 0
06:18:28.933467 IP 192.168.10.4.80 > 192.168.10.3.49842: Flags [.], seq 60795:69483, ack 271, win 509, options [nop,nop,TS val 487234980 ecr 477316399], length 8688: HTTP: HTTP/1.1 206 Partial Content
06:18:28.933484 IP 192.168.10.3.49842 > 192.168.10.4.80: Flags [.], ack 69483, win 891, options [nop,nop,TS val 477316405 ecr 487234980], length 0
06:18:28.933619 IP 192.168.10.4.80 > 192.168.10.3.49842: Flags [P.], seq 69483:81063, ack 271, win 509, options [nop,nop,TS val 487234980 ecr 477316399], length 11580: HTTP
06:18:28.933660 IP 192.168.10.3.49842 > 192.168.10.4.80: Flags [.], ack 81063, win 891, options [nop,nop,TS val 477316406 ecr 487234980], length 0
06:18:28.933728 IP 192.168.10.3.49842 > 192.168.10.4.80: Flags [P.], seq 271:341, ack 81063, win 891, options [nop,nop,TS val 477316406 ecr 487234980], length 70: HTTP: GET /20MB HTTP/1.1
06:18:28.934103 IP 192.168.10.4.80 > 192.168.10.3.49842: Flags [.], ack 341, win 509, options [nop,nop,TS val 487234980 ecr 477316406], length 0
06:18:28.934353 IP 192.168.10.4.80 > 192.168.10.3.49842: Flags [.], seq 81063:88303, ack 341, win 509, options [nop,nop,TS val 487234981 ecr 477316406], length 7240: HTTP: HTTP/1.1 206 Partial Content
06:18:28.934368 IP 192.168.10.3.49842 > 192.168.10.4.80: Flags [.], ack 88303, win 900, options [nop,nop,TS val 477316406 ecr 487234981], length 0
06:18:28.934493 IP 192.168.10.4.80 > 192.168.10.3.49842: Flags [P.], seq 88303:101331, ack 341, win 509, options [nop,nop,TS val 487234981 ecr 477316406], length 13028: HTTP
06:18:28.934520 IP 192.168.10.3.49842 > 192.168.10.4.80: Flags [.], ack 101331, win 900, options [nop,nop,TS val 477316406 ecr 487234981], length 0
06:18:28.935202 IP 192.168.10.3.49842 > 192.168.10.4.80: Flags [P.], seq 341:411, ack 101331, win 900, options [nop,nop,TS val 477316407 ecr 487234981], length 70: HTTP: GET /20MB HTTP/1.1
06:18:28.935610 IP 192.168.10.4.80 > 192.168.10.3.49842: Flags [.], ack 411, win 509, options [nop,nop,TS val 487234982 ecr 477316407], length 0
06:18:28.936151 IP 192.168.10.4.80 > 192.168.10.3.49842: Flags [P.], seq 101331:121599, ack 411, win 509, options [nop,nop,TS val 487234982 ecr 477316407], length 20268: HTTP: HTTP/1.1 206 Partial Content
06:18:28.936203 IP 192.168.10.3.49842 > 192.168.10.4.80: Flags [.], ack 121599, win 900, options [nop,nop,TS val 477316408 ecr 487234982], length 0
06:18:28.936394 IP 192.168.10.3.49842 > 192.168.10.4.80: Flags [P.], seq 411:481, ack 121599, win 900, options [nop,nop,TS val 477316408 ecr 487234982], length 70: HTTP: GET /20MB HTTP/1.1
06:18:28.936918 IP 192.168.10.4.80 > 192.168.10.3.49842: Flags [.], ack 481, win 509, options [nop,nop,TS val 487234983 ecr 477316408], length 0
06:18:28.937169 IP 192.168.10.4.80 > 192.168.10.3.49842: Flags [.], seq 121599:131735, ack 481, win 509, options [nop,nop,TS val 487234983 ecr 477316408], length 10136: HTTP: HTTP/1.1 206 Partial Content
06:18:28.937185 IP 192.168.10.3.49842 > 192.168.10.4.80: Flags [.], ack 131735, win 940, options [nop,nop,TS val 477316409 ecr 487234983], length 0
06:18:28.937319 IP 192.168.10.4.80 > 192.168.10.3.49842: Flags [P.], seq 131735:141867, ack 481, win 509, options [nop,nop,TS val 487234983 ecr 477316408], length 10132: HTTP
06:18:28.937335 IP 192.168.10.3.49842 > 192.168.10.4.80: Flags [.], ack 141867, win 940, options [nop,nop,TS val 477316409 ecr 487234983], length 0
06:18:28.937590 IP 192.168.10.3.49842 > 192.168.10.4.80: Flags [P.], seq 481:551, ack 141867, win 940, options [nop,nop,TS val 477316410 ecr 487234983], length 70: HTTP: GET /20MB HTTP/1.1
06:18:28.938031 IP 192.168.10.4.80 > 192.168.10.3.49842: Flags [.], ack 551, win 509, options [nop,nop,TS val 487234984 ecr 477316410], length 0
06:18:28.938464 IP 192.168.10.4.80 > 192.168.10.3.49842: Flags [P.], seq 141867:162135, ack 551, win 509, options [nop,nop,TS val 487234984 ecr 477316410], length 20268: HTTP: HTTP/1.1 206 Partial Content
06:18:28.938546 IP 192.168.10.3.49842 > 192.168.10.4.80: Flags [.], ack 162135, win 940, options [nop,nop,TS val 477316411 ecr 487234984], length 0
06:18:28.938696 IP 192.168.10.3.49842 > 192.168.10.4.80: Flags [P.], seq 551:621, ack 162135, win 940, options [nop,nop,TS val 477316411 ecr 487234984], length 70: HTTP: GET /20MB HTTP/1.1
06:18:28.939279 IP 192.168.10.4.80 > 192.168.10.3.49842: Flags [.], ack 621, win 509, options [nop,nop,TS val 487234985 ecr 477316411], length 0
06:18:28.939612 IP 192.168.10.4.80 > 192.168.10.3.49842: Flags [.], seq 162135:163583, ack 621, win 509, options [nop,nop,TS val 487234986 ecr 477316411], length 1448: HTTP: HTTP/1.1 206 Partial Content
06:18:28.939777 IP 192.168.10.4.80 > 192.168.10.3.49842: Flags [P.], seq 163583:182403, ack 621, win 509, options [nop,nop,TS val 487234986 ecr 477316411], length 18820: HTTP
06:18:28.939810 IP 192.168.10.3.49842 > 192.168.10.4.80: Flags [.], ack 182403, win 963, options [nop,nop,TS val 477316412 ecr 487234986], length 0
06:18:28.939901 IP 192.168.10.3.49842 > 192.168.10.4.80: Flags [P.], seq 621:691, ack 182403, win 963, options [nop,nop,TS val 477316412 ecr 487234986], length 70: HTTP: GET /20MB HTTP/1.1
06:18:28.940502 IP 192.168.10.4.80 > 192.168.10.3.49842: Flags [.], ack 691, win 509, options [nop,nop,TS val 487234987 ecr 477316412], length 0
06:18:28.940911 IP 192.168.10.4.80 > 192.168.10.3.49842: Flags [P.], seq 182403:202671, ack 691, win 509, options [nop,nop,TS val 487234987 ecr 477316412], length 20268: HTTP: HTTP/1.1 206 Partial Content
06:18:28.940997 IP 192.168.10.3.49842 > 192.168.10.4.80: Flags [.], ack 202671, win 963, options [nop,nop,TS val 477316413 ecr 487234987], length 0
06:18:28.941238 IP 192.168.10.3.49842 > 192.168.10.4.80: Flags [P.], seq 691:761, ack 202671, win 963, options [nop,nop,TS val 477316413 ecr 487234987], length 70: HTTP: GET /20MB HTTP/1.1
06:18:28.941638 IP 192.168.10.4.80 > 192.168.10.3.49842: Flags [.], ack 761, win 509, options [nop,nop,TS val 487234988 ecr 477316413], length 0
06:18:28.941827 IP 192.168.10.4.80 > 192.168.10.3.49842: Flags [.], seq 202671:207015, ack 761, win 509, options [nop,nop,TS val 487234988 ecr 477316413], length 4344: HTTP: HTTP/1.1 206 Partial Content
06:18:28.941839 IP 192.168.10.3.49842 > 192.168.10.4.80: Flags [.], ack 207015, win 1030, options [nop,nop,TS val 477316414 ecr 487234988], length 0
06:18:28.941885 IP 192.168.10.4.80 > 192.168.10.3.49842: Flags [.], seq 207015:212807, ack 761, win 509, options [nop,nop,TS val 487234988 ecr 477316413], length 5792: HTTP
06:18:28.941893 IP 192.168.10.3.49842 > 192.168.10.4.80: Flags [.], ack 212807, win 1121, options [nop,nop,TS val 477316414 ecr 487234988], length 0
06:18:28.941979 IP 192.168.10.4.80 > 192.168.10.3.49842: Flags [P.], seq 212807:222939, ack 761, win 509, options [nop,nop,TS val 487234988 ecr 477316413], length 10132: HTTP
06:18:28.942010 IP 192.168.10.3.49842 > 192.168.10.4.80: Flags [.], ack 222939, win 1121, options [nop,nop,TS val 477316414 ecr 487234988], length 0
06:18:28.942131 IP 192.168.10.3.49842 > 192.168.10.4.80: Flags [P.], seq 761:831, ack 222939, win 1121, options [nop,nop,TS val 477316414 ecr 487234988], length 70: HTTP: GET /20MB HTTP/1.1
06:18:28.942644 IP 192.168.10.4.80 > 192.168.10.3.49842: Flags [.], ack 831, win 509, options [nop,nop,TS val 487234989 ecr 477316414], length 0
06:18:28.943063 IP 192.168.10.4.80 > 192.168.10.3.49842: Flags [P.], seq 222939:243207, ack 831, win 509, options [nop,nop,TS val 487234989 ecr 477316414], length 20268: HTTP: HTTP/1.1 206 Partial Content
06:18:28.943094 IP 192.168.10.3.49842 > 192.168.10.4.80: Flags [.], ack 243207, win 1121, options [nop,nop,TS val 477316415 ecr 487234989], length 0
06:18:28.943708 IP 192.168.10.3.49842 > 192.168.10.4.80: Flags [P.], seq 831:901, ack 243207, win 1121, options [nop,nop,TS val 477316416 ecr 487234989], length 70: HTTP: GET /20MB HTTP/1.1
06:18:28.943997 IP 192.168.10.4.80 > 192.168.10.3.49842: Flags [.], ack 901, win 509, options [nop,nop,TS val 487234990 ecr 477316416], length 0
06:18:28.944166 IP 192.168.10.4.80 > 192.168.10.3.49842: Flags [.], seq 243207:244655, ack 901, win 509, options [nop,nop,TS val 487234990 ecr 477316416], length 1448: HTTP: HTTP/1.1 206 Partial Content
06:18:28.944221 IP 192.168.10.4.80 > 192.168.10.3.49842: Flags [.], seq 244655:250447, ack 901, win 509, options [nop,nop,TS val 487234990 ecr 477316416], length 5792: HTTP
06:18:28.944226 IP 192.168.10.3.49842 > 192.168.10.4.80: Flags [.], ack 250447, win 1142, options [nop,nop,TS val 477316416 ecr 487234990], length 0
06:18:28.944300 IP 192.168.10.4.80 > 192.168.10.3.49842: Flags [.], seq 250447:259135, ack 901, win 509, options [nop,nop,TS val 487234990 ecr 477316416], length 8688: HTTP
06:18:28.944322 IP 192.168.10.3.49842 > 192.168.10.4.80: Flags [.], ack 259135, win 1144, options [nop,nop,TS val 477316416 ecr 487234990], length 0
06:18:28.944355 IP 192.168.10.4.80 > 192.168.10.3.49842: Flags [P.], seq 259135:263475, ack 901, win 509, options [nop,nop,TS val 487234990 ecr 477316416], length 4340: HTTP
06:18:28.944360 IP 192.168.10.3.49842 > 192.168.10.4.80: Flags [.], ack 263475, win 1151, options [nop,nop,TS val 477316416 ecr 487234990], length 0
06:18:28.944464 IP 192.168.10.3.49842 > 192.168.10.4.80: Flags [P.], seq 901:971, ack 263475, win 1151, options [nop,nop,TS val 477316416 ecr 487234990], length 70: HTTP: GET /20MB HTTP/1.1
06:18:28.944714 IP 192.168.10.4.80 > 192.168.10.3.49842: Flags [.], ack 971, win 509, options [nop,nop,TS val 487234991 ecr 477316416], length 0
06:18:28.944912 IP 192.168.10.4.80 > 192.168.10.3.49842: Flags [.], seq 263475:266371, ack 971, win 509, options [nop,nop,TS val 487234991 ecr 477316416], length 2896: HTTP: HTTP/1.1 206 Partial Content
06:18:28.944920 IP 192.168.10.3.49842 > 192.168.10.4.80: Flags [.], ack 266371, win 1160, options [nop,nop,TS val 477316417 ecr 487234991], length 0
06:18:28.944963 IP 192.168.10.4.80 > 192.168.10.3.49842: Flags [.], seq 266371:272163, ack 971, win 509, options [nop,nop,TS val 487234991 ecr 477316416], length 5792: HTTP
06:18:28.945000 IP 192.168.10.3.49842 > 192.168.10.4.80: Flags [.], ack 272163, win 1160, options [nop,nop,TS val 477316417 ecr 487234991], length 0
06:18:28.945012 IP 192.168.10.4.80 > 192.168.10.3.49842: Flags [.], seq 272163:277955, ack 971, win 509, options [nop,nop,TS val 487234991 ecr 477316416], length 5792: HTTP
06:18:28.945026 IP 192.168.10.3.49842 > 192.168.10.4.80: Flags [.], ack 277955, win 1160, options [nop,nop,TS val 477316417 ecr 487234991], length 0
06:18:28.945066 IP 192.168.10.4.80 > 192.168.10.3.49842: Flags [P.], seq 277955:283743, ack 971, win 509, options [nop,nop,TS val 487234991 ecr 477316416], length 5788: HTTP
06:18:28.945088 IP 192.168.10.3.49842 > 192.168.10.4.80: Flags [.], ack 283743, win 1160, options [nop,nop,TS val 477316417 ecr 487234991], length 0
06:18:28.945450 IP 192.168.10.3.49842 > 192.168.10.4.80: Flags [P.], seq 971:1041, ack 283743, win 1160, options [nop,nop,TS val 477316417 ecr 487234991], length 70: HTTP: GET /20MB HTTP/1.1
06:18:28.945713 IP 192.168.10.4.80 > 192.168.10.3.49842: Flags [.], ack 1041, win 509, options [nop,nop,TS val 487234992 ecr 477316417], length 0
06:18:28.946033 IP 192.168.10.4.80 > 192.168.10.3.49842: Flags [.], seq 283743:288087, ack 1041, win 509, options [nop,nop,TS val 487234992 ecr 477316417], length 4344: HTTP: HTTP/1.1 206 Partial Content
06:18:28.946049 IP 192.168.10.3.49842 > 192.168.10.4.80: Flags [.], ack 288087, win 1160, options [nop,nop,TS val 477316418 ecr 487234992], length 0
06:18:28.946085 IP 192.168.10.4.80 > 192.168.10.3.49842: Flags [.], seq 288087:293879, ack 1041, win 509, options [nop,nop,TS val 487234992 ecr 477316417], length 5792: HTTP
06:18:28.946099 IP 192.168.10.3.49842 > 192.168.10.4.80: Flags [.], ack 293879, win 1160, options [nop,nop,TS val 477316418 ecr 487234992], length 0
06:18:28.946134 IP 192.168.10.4.80 > 192.168.10.3.49842: Flags [.], seq 293879:299671, ack 1041, win 509, options [nop,nop,TS val 487234992 ecr 477316417], length 5792: HTTP
06:18:28.946148 IP 192.168.10.3.49842 > 192.168.10.4.80: Flags [.], ack 299671, win 1160, options [nop,nop,TS val 477316418 ecr 487234992], length 0
06:18:28.946183 IP 192.168.10.4.80 > 192.168.10.3.49842: Flags [.], seq 299671:302567, ack 1041, win 509, options [nop,nop,TS val 487234992 ecr 477316417], length 2896: HTTP
06:18:28.946187 IP 192.168.10.3.49842 > 192.168.10.4.80: Flags [.], ack 302567, win 1160, options [nop,nop,TS val 477316418 ecr 487234992], length 0
06:18:28.946232 IP 192.168.10.4.80 > 192.168.10.3.49842: Flags [P.], seq 302567:304011, ack 1041, win 509, options [nop,nop,TS val 487234992 ecr 477316417], length 1444: HTTP
06:18:28.946307 IP 192.168.10.3.49842 > 192.168.10.4.80: Flags [P.], seq 1041:1111, ack 304011, win 1169, options [nop,nop,TS val 477316418 ecr 487234992], length 70: HTTP: GET /20MB HTTP/1.1
06:18:28.946751 IP 192.168.10.4.80 > 192.168.10.3.49842: Flags [.], ack 1111, win 509, options [nop,nop,TS val 487234993 ecr 477316418], length 0
06:18:28.946982 IP 192.168.10.4.80 > 192.168.10.3.49842: Flags [.], seq 304011:308355, ack 1111, win 509, options [nop,nop,TS val 487234993 ecr 477316418], length 4344: HTTP: HTTP/1.1 206 Partial Content
06:18:28.946998 IP 192.168.10.3.49842 > 192.168.10.4.80: Flags [.], ack 308355, win 1169, options [nop,nop,TS val 477316419 ecr 487234993], length 0
06:18:28.947028 IP 192.168.10.4.80 > 192.168.10.3.49842: Flags [.], seq 308355:311251, ack 1111, win 509, options [nop,nop,TS val 487234993 ecr 477316418], length 2896: HTTP
06:18:28.947042 IP 192.168.10.3.49842 > 192.168.10.4.80: Flags [.], ack 311251, win 1169, options [nop,nop,TS val 477316419 ecr 487234993], length 0
06:18:28.947083 IP 192.168.10.4.80 > 192.168.10.3.49842: Flags [.], seq 311251:321387, ack 1111, win 509, options [nop,nop,TS val 487234993 ecr 477316418], length 10136: HTTP
06:18:28.947098 IP 192.168.10.3.49842 > 192.168.10.4.80: Flags [.], ack 321387, win 1169, options [nop,nop,TS val 477316419 ecr 487234993], length 0
06:18:28.947127 IP 192.168.10.4.80 > 192.168.10.3.49842: Flags [.], seq 321387:322835, ack 1111, win 509, options [nop,nop,TS val 487234993 ecr 477316418], length 1448: HTTP
06:18:28.947135 IP 192.168.10.4.80 > 192.168.10.3.49842: Flags [P.], seq 322835:324279, ack 1111, win 509, options [nop,nop,TS val 487234993 ecr 477316418], length 1444: HTTP
06:18:28.947144 IP 192.168.10.3.49842 > 192.168.10.4.80: Flags [.], ack 324279, win 1169, options [nop,nop,TS val 477316419 ecr 487234993], length 0
06:18:28.947204 IP 192.168.10.3.49842 > 192.168.10.4.80: Flags [P.], seq 1111:1181, ack 324279, win 1169, options [nop,nop,TS val 477316419 ecr 487234993], length 70: HTTP: GET /20MB HTTP/1.1
06:18:28.947498 IP 192.168.10.4.80 > 192.168.10.3.49842: Flags [.], ack 1181, win 509, options [nop,nop,TS val 487234994 ecr 477316419], length 0
06:18:28.947658 IP 192.168.10.4.80 > 192.168.10.3.49842: Flags [.], seq 324279:325727, ack 1181, win 509, options [nop,nop,TS val 487234994 ecr 477316419], length 1448: HTTP: HTTP/1.1 206 Partial Content
06:18:28.947708 IP 192.168.10.4.80 > 192.168.10.3.49842: Flags [.], seq 325727:330071, ack 1181, win 509, options [nop,nop,TS val 487234994 ecr 477316419], length 4344: HTTP
06:18:28.947723 IP 192.168.10.3.49842 > 192.168.10.4.80: Flags [.], ack 330071, win 1169, options [nop,nop,TS val 477316420 ecr 487234994], length 0
06:18:28.947765 IP 192.168.10.4.80 > 192.168.10.3.49842: Flags [.], seq 330071:337311, ack 1181, win 509, options [nop,nop,TS val 487234994 ecr 477316419], length 7240: HTTP
06:18:28.947781 IP 192.168.10.3.49842 > 192.168.10.4.80: Flags [.], ack 337311, win 1169, options [nop,nop,TS val 477316420 ecr 487234994], length 0
06:18:28.947812 IP 192.168.10.4.80 > 192.168.10.3.49842: Flags [.], seq 337311:343103, ack 1181, win 509, options [nop,nop,TS val 487234994 ecr 477316419], length 5792: HTTP
06:18:28.947825 IP 192.168.10.3.49842 > 192.168.10.4.80: Flags [.], ack 343103, win 1169, options [nop,nop,TS val 477316420 ecr 487234994], length 0
06:18:28.947859 IP 192.168.10.4.80 > 192.168.10.3.49842: Flags [P.], seq 343103:344547, ack 1181, win 509, options [nop,nop,TS val 487234994 ecr 477316419], length 1444: HTTP
06:18:28.947922 IP 192.168.10.3.49842 > 192.168.10.4.80: Flags [P.], seq 1181:1251, ack 344547, win 1169, options [nop,nop,TS val 477316420 ecr 487234994], length 70: HTTP: GET /20MB HTTP/1.1
06:18:28.948251 IP 192.168.10.4.80 > 192.168.10.3.49842: Flags [.], ack 1251, win 509, options [nop,nop,TS val 487234994 ecr 477316420], length 0
06:18:28.948433 IP 192.168.10.4.80 > 192.168.10.3.49842: Flags [.], seq 344547:347443, ack 1251, win 509, options [nop,nop,TS val 487234995 ecr 477316420], length 2896: HTTP: HTTP/1.1 206 Partial Content
06:18:28.948450 IP 192.168.10.3.49842 > 192.168.10.4.80: Flags [.], ack 347443, win 1169, options [nop,nop,TS val 477316420 ecr 487234995], length 0
06:18:28.948484 IP 192.168.10.4.80 > 192.168.10.3.49842: Flags [.], seq 347443:353235, ack 1251, win 509, options [nop,nop,TS val 487234995 ecr 477316420], length 5792: HTTP
06:18:28.948495 IP 192.168.10.3.49842 > 192.168.10.4.80: Flags [.], ack 353235, win 1169, options [nop,nop,TS val 477316420 ecr 487234995], length 0
06:18:28.948536 IP 192.168.10.4.80 > 192.168.10.3.49842: Flags [.], seq 353235:359027, ack 1251, win 509, options [nop,nop,TS val 487234995 ecr 477316420], length 5792: HTTP
06:18:28.948550 IP 192.168.10.3.49842 > 192.168.10.4.80: Flags [.], ack 359027, win 1169, options [nop,nop,TS val 477316421 ecr 487234995], length 0
06:18:28.948583 IP 192.168.10.4.80 > 192.168.10.3.49842: Flags [P.], seq 359027:364815, ack 1251, win 509, options [nop,nop,TS val 487234995 ecr 477316420], length 5788: HTTP
06:18:28.948596 IP 192.168.10.3.49842 > 192.168.10.4.80: Flags [.], ack 364815, win 1169, options [nop,nop,TS val 477316421 ecr 487234995], length 0
06:18:28.949161 IP 192.168.10.3.49842 > 192.168.10.4.80: Flags [P.], seq 1251:1321, ack 364815, win 1169, options [nop,nop,TS val 477316421 ecr 487234995], length 70: HTTP: GET /20MB HTTP/1.1
06:18:28.949389 IP 192.168.10.4.80 > 192.168.10.3.49842: Flags [.], ack 1321, win 509, options [nop,nop,TS val 487234996 ecr 477316421], length 0
06:18:28.949581 IP 192.168.10.4.80 > 192.168.10.3.49842: Flags [.], seq 364815:369159, ack 1321, win 509, options [nop,nop,TS val 487234996 ecr 477316421], length 4344: HTTP: HTTP/1.1 206 Partial Content
06:18:28.949597 IP 192.168.10.3.49842 > 192.168.10.4.80: Flags [.], ack 369159, win 1169, options [nop,nop,TS val 477316422 ecr 487234996], length 0
06:18:28.949632 IP 192.168.10.4.80 > 192.168.10.3.49842: Flags [.], seq 369159:374951, ack 1321, win 509, options [nop,nop,TS val 487234996 ecr 477316421], length 5792: HTTP
06:18:28.949645 IP 192.168.10.3.49842 > 192.168.10.4.80: Flags [.], ack 374951, win 1169, options [nop,nop,TS val 477316422 ecr 487234996], length 0
06:18:28.949684 IP 192.168.10.4.80 > 192.168.10.3.49842: Flags [.], seq 374951:380743, ack 1321, win 509, options [nop,nop,TS val 487234996 ecr 477316421], length 5792: HTTP
06:18:28.949697 IP 192.168.10.3.49842 > 192.168.10.4.80: Flags [.], ack 380743, win 1169, options [nop,nop,TS val 477316422 ecr 487234996], length 0
06:18:28.949730 IP 192.168.10.4.80 > 192.168.10.3.49842: Flags [P.], seq 380743:385083, ack 1321, win 509, options [nop,nop,TS val 487234996 ecr 477316421], length 4340: HTTP
06:18:28.949743 IP 192.168.10.3.49842 > 192.168.10.4.80: Flags [.], ack 385083, win 1169, options [nop,nop,TS val 477316422 ecr 487234996], length 0
06:18:28.949804 IP 192.168.10.3.49842 > 192.168.10.4.80: Flags [P.], seq 1321:1391, ack 385083, win 1169, options [nop,nop,TS val 477316422 ecr 487234996], length 70: HTTP: GET /20MB HTTP/1.1
06:18:28.950062 IP 192.168.10.4.80 > 192.168.10.3.49842: Flags [.], ack 1391, win 509, options [nop,nop,TS val 487234996 ecr 477316422], length 0
06:18:28.950301 IP 192.168.10.4.80 > 192.168.10.3.49842: Flags [.], seq 385083:390875, ack 1391, win 509, options [nop,nop,TS val 487234997 ecr 477316422], length 5792: HTTP: HTTP/1.1 206 Partial Content
06:18:28.950324 IP 192.168.10.3.49842 > 192.168.10.4.80: Flags [.], ack 390875, win 1169, options [nop,nop,TS val 477316422 ecr 487234997], length 0
06:18:28.950345 IP 192.168.10.4.80 > 192.168.10.3.49842: Flags [.], seq 390875:392323, ack 1391, win 509, options [nop,nop,TS val 487234997 ecr 477316422], length 1448: HTTP
06:18:28.950402 IP 192.168.10.4.80 > 192.168.10.3.49842: Flags [.], seq 392323:402459, ack 1391, win 509, options [nop,nop,TS val 487234997 ecr 477316422], length 10136: HTTP
06:18:28.950423 IP 192.168.10.3.49842 > 192.168.10.4.80: Flags [.], ack 402459, win 1169, options [nop,nop,TS val 477316422 ecr 487234997], length 0
06:18:28.950445 IP 192.168.10.4.80 > 192.168.10.3.49842: Flags [.], seq 402459:403907, ack 1391, win 509, options [nop,nop,TS val 487234997 ecr 477316422], length 1448: HTTP
06:18:28.950709 IP 192.168.10.4.80 > 192.168.10.3.49842: Flags [P.], seq 403907:405351, ack 1391, win 509, options [nop,nop,TS val 487234997 ecr 477316422], length 1444: HTTP
06:18:28.950714 IP 192.168.10.3.49842 > 192.168.10.4.80: Flags [.], ack 405351, win 1169, options [nop,nop,TS val 477316423 ecr 487234997], length 0
06:18:28.950806 IP 192.168.10.3.49842 > 192.168.10.4.80: Flags [P.], seq 1391:1461, ack 405351, win 1169, options [nop,nop,TS val 477316423 ecr 487234997], length 70: HTTP: GET /20MB HTTP/1.1
06:18:28.951246 IP 192.168.10.4.80 > 192.168.10.3.49842: Flags [.], ack 1461, win 509, options [nop,nop,TS val 487234997 ecr 477316423], length 0
06:18:28.951426 IP 192.168.10.4.80 > 192.168.10.3.49842: Flags [.], seq 405351:406799, ack 1461, win 509, options [nop,nop,TS val 487234998 ecr 477316423], length 1448: HTTP: HTTP/1.1 206 Partial Content
06:18:28.951463 IP 192.168.10.4.80 > 192.168.10.3.49842: Flags [.], seq 406799:412591, ack 1461, win 509, options [nop,nop,TS val 487234998 ecr 477316423], length 5792: HTTP
06:18:28.951516 IP 192.168.10.4.80 > 192.168.10.3.49842: Flags [.], seq 412591:418383, ack 1461, win 509, options [nop,nop,TS val 487234998 ecr 477316423], length 5792: HTTP
06:18:28.951530 IP 192.168.10.3.49842 > 192.168.10.4.80: Flags [.], ack 418383, win 1169, options [nop,nop,TS val 477316423 ecr 487234998], length 0
06:18:28.951565 IP 192.168.10.4.80 > 192.168.10.3.49842: Flags [.], seq 418383:424175, ack 1461, win 509, options [nop,nop,TS val 487234998 ecr 477316423], length 5792: HTTP
06:18:28.951585 IP 192.168.10.3.49842 > 192.168.10.4.80: Flags [.], ack 424175, win 1169, options [nop,nop,TS val 477316424 ecr 487234998], length 0
06:18:28.951612 IP 192.168.10.4.80 > 192.168.10.3.49842: Flags [P.], seq 424175:425619, ack 1461, win 509, options [nop,nop,TS val 487234998 ecr 477316423], length 1444: HTTP
06:18:28.952308 IP 192.168.10.3.49842 > 192.168.10.4.80: Flags [P.], seq 1461:1531, ack 425619, win 1169, options [nop,nop,TS val 477316424 ecr 487234998], length 70: HTTP: GET /20MB HTTP/1.1
06:18:28.952561 IP 192.168.10.4.80 > 192.168.10.3.49842: Flags [.], ack 1531, win 509, options [nop,nop,TS val 487234999 ecr 477316424], length 0
06:18:28.952750 IP 192.168.10.4.80 > 192.168.10.3.49842: Flags [.], seq 425619:428515, ack 1531, win 509, options [nop,nop,TS val 487234999 ecr 477316424], length 2896: HTTP: HTTP/1.1 206 Partial Content
06:18:28.952765 IP 192.168.10.3.49842 > 192.168.10.4.80: Flags [.], ack 428515, win 1169, options [nop,nop,TS val 477316425 ecr 487234999], length 0
06:18:28.952812 IP 192.168.10.4.80 > 192.168.10.3.49842: Flags [.], seq 428515:434307, ack 1531, win 509, options [nop,nop,TS val 487234999 ecr 477316424], length 5792: HTTP
06:18:28.952831 IP 192.168.10.3.49842 > 192.168.10.4.80: Flags [.], ack 434307, win 1169, options [nop,nop,TS val 477316425 ecr 487234999], length 0
06:18:28.952873 IP 192.168.10.4.80 > 192.168.10.3.49842: Flags [.], seq 434307:441547, ack 1531, win 509, options [nop,nop,TS val 487234999 ecr 477316424], length 7240: HTTP
06:18:28.952892 IP 192.168.10.3.49842 > 192.168.10.4.80: Flags [.], ack 441547, win 1169, options [nop,nop,TS val 477316425 ecr 487234999], length 0
06:18:28.952901 IP 192.168.10.4.80 > 192.168.10.3.49842: Flags [P.], seq 441547:445887, ack 1531, win 509, options [nop,nop,TS val 487234999 ecr 477316424], length 4340: HTTP
06:18:28.952915 IP 192.168.10.3.49842 > 192.168.10.4.80: Flags [.], ack 445887, win 1169, options [nop,nop,TS val 477316425 ecr 487234999], length 0
06:18:28.952983 IP 192.168.10.3.49842 > 192.168.10.4.80: Flags [P.], seq 1531:1601, ack 445887, win 1169, options [nop,nop,TS val 477316425 ecr 487234999], length 70: HTTP: GET /20MB HTTP/1.1
06:18:28.953291 IP 192.168.10.4.80 > 192.168.10.3.49842: Flags [.], ack 1601, win 509, options [nop,nop,TS val 487235000 ecr 477316425], length 0
06:18:28.953502 IP 192.168.10.4.80 > 192.168.10.3.49842: Flags [.], seq 445887:450231, ack 1601, win 509, options [nop,nop,TS val 487235000 ecr 477316425], length 4344: HTTP: HTTP/1.1 206 Partial Content
06:18:28.953518 IP 192.168.10.3.49842 > 192.168.10.4.80: Flags [.], ack 450231, win 1169, options [nop,nop,TS val 477316425 ecr 487235000], length 0
06:18:28.953554 IP 192.168.10.4.80 > 192.168.10.3.49842: Flags [.], seq 450231:456023, ack 1601, win 509, options [nop,nop,TS val 487235000 ecr 477316425], length 5792: HTTP
06:18:28.953565 IP 192.168.10.3.49842 > 192.168.10.4.80: Flags [.], ack 456023, win 1169, options [nop,nop,TS val 477316426 ecr 487235000], length 0
06:18:28.953601 IP 192.168.10.4.80 > 192.168.10.3.49842: Flags [.], seq 456023:461815, ack 1601, win 509, options [nop,nop,TS val 487235000 ecr 477316425], length 5792: HTTP
06:18:28.953615 IP 192.168.10.3.49842 > 192.168.10.4.80: Flags [.], ack 461815, win 1169, options [nop,nop,TS val 477316426 ecr 487235000], length 0
06:18:28.953649 IP 192.168.10.4.80 > 192.168.10.3.49842: Flags [.], seq 461815:464711, ack 1601, win 509, options [nop,nop,TS val 487235000 ecr 477316425], length 2896: HTTP
06:18:28.953662 IP 192.168.10.3.49842 > 192.168.10.4.80: Flags [.], ack 464711, win 1169, options [nop,nop,TS val 477316426 ecr 487235000], length 0
06:18:28.953698 IP 192.168.10.4.80 > 192.168.10.3.49842: Flags [P.], seq 464711:466155, ack 1601, win 509, options [nop,nop,TS val 487235000 ecr 477316425], length 1444: HTTP
06:18:28.953765 IP 192.168.10.3.49842 > 192.168.10.4.80: Flags [P.], seq 1601:1671, ack 466155, win 1169, options [nop,nop,TS val 477316426 ecr 487235000], length 70: HTTP: GET /20MB HTTP/1.1
06:18:28.953982 IP 192.168.10.4.80 > 192.168.10.3.49842: Flags [.], ack 1671, win 509, options [nop,nop,TS val 487235000 ecr 477316426], length 0
06:18:28.954243 IP 192.168.10.4.80 > 192.168.10.3.49842: Flags [.], seq 466155:471947, ack 1671, win 509, options [nop,nop,TS val 487235000 ecr 477316426], length 5792: HTTP: HTTP/1.1 206 Partial Content
06:18:28.954263 IP 192.168.10.3.49842 > 192.168.10.4.80: Flags [.], ack 471947, win 1169, options [nop,nop,TS val 477316426 ecr 487235000], length 0
06:18:28.954280 IP 192.168.10.4.80 > 192.168.10.3.49842: Flags [.], seq 471947:473395, ack 1671, win 509, options [nop,nop,TS val 487235000 ecr 477316426], length 1448: HTTP
06:18:28.954340 IP 192.168.10.4.80 > 192.168.10.3.49842: Flags [.], seq 473395:483531, ack 1671, win 509, options [nop,nop,TS val 487235000 ecr 477316426], length 10136: HTTP
06:18:28.954378 IP 192.168.10.4.80 > 192.168.10.3.49842: Flags [.], seq 483531:484979, ack 1671, win 509, options [nop,nop,TS val 487235000 ecr 477316426], length 1448: HTTP
06:18:28.954387 IP 192.168.10.4.80 > 192.168.10.3.49842: Flags [P.], seq 484979:486423, ack 1671, win 509, options [nop,nop,TS val 487235000 ecr 477316426], length 1444: HTTP
06:18:28.954411 IP 192.168.10.3.49842 > 192.168.10.4.80: Flags [.], ack 486423, win 1169, options [nop,nop,TS val 477316426 ecr 487235000], length 0
06:18:28.955000 IP 192.168.10.3.49842 > 192.168.10.4.80: Flags [P.], seq 1671:1743, ack 486423, win 1169, options [nop,nop,TS val 477316427 ecr 487235000], length 72: HTTP: GET /20MB HTTP/1.1
06:18:28.955227 IP 192.168.10.4.80 > 192.168.10.3.49842: Flags [.], ack 1743, win 509, options [nop,nop,TS val 487235001 ecr 477316427], length 0
06:18:28.955506 IP 192.168.10.4.80 > 192.168.10.3.49842: Flags [.], seq 486423:487871, ack 1743, win 509, options [nop,nop,TS val 487235002 ecr 477316427], length 1448: HTTP: HTTP/1.1 206 Partial Content
06:18:28.955538 IP 192.168.10.4.80 > 192.168.10.3.49842: Flags [.], seq 487871:492215, ack 1743, win 509, options [nop,nop,TS val 487235002 ecr 477316427], length 4344: HTTP
06:18:28.955571 IP 192.168.10.3.49842 > 192.168.10.4.80: Flags [.], ack 492215, win 1169, options [nop,nop,TS val 477316428 ecr 487235002], length 0
06:18:28.955599 IP 192.168.10.4.80 > 192.168.10.3.49842: Flags [.], seq 492215:499455, ack 1743, win 509, options [nop,nop,TS val 487235002 ecr 477316427], length 7240: HTTP
06:18:28.955619 IP 192.168.10.3.49842 > 192.168.10.4.80: Flags [.], ack 499455, win 1169, options [nop,nop,TS val 477316428 ecr 487235002], length 0
06:18:28.955646 IP 192.168.10.4.80 > 192.168.10.3.49842: Flags [.], seq 499455:505247, ack 1743, win 509, options [nop,nop,TS val 487235002 ecr 477316427], length 5792: HTTP
06:18:28.955664 IP 192.168.10.3.49842 > 192.168.10.4.80: Flags [.], ack 505247, win 1169, options [nop,nop,TS val 477316428 ecr 487235002], length 0
06:18:28.955690 IP 192.168.10.4.80 > 192.168.10.3.49842: Flags [P.], seq 505247:506693, ack 1743, win 509, options [nop,nop,TS val 487235002 ecr 477316427], length 1446: HTTP
06:18:28.955760 IP 192.168.10.3.49842 > 192.168.10.4.80: Flags [P.], seq 1743:1815, ack 506693, win 1169, options [nop,nop,TS val 477316428 ecr 487235002], length 72: HTTP: GET /20MB HTTP/1.1
06:18:28.956270 IP 192.168.10.4.80 > 192.168.10.3.49842: Flags [.], ack 1815, win 509, options [nop,nop,TS val 487235002 ecr 477316428], length 0
06:18:28.956466 IP 192.168.10.4.80 > 192.168.10.3.49842: Flags [.], seq 506693:509589, ack 1815, win 509, options [nop,nop,TS val 487235003 ecr 477316428], length 2896: HTTP: HTTP/1.1 206 Partial Content
06:18:28.956517 IP 192.168.10.4.80 > 192.168.10.3.49842: Flags [.], seq 509589:515381, ack 1815, win 509, options [nop,nop,TS val 487235003 ecr 477316428], length 5792: HTTP
06:18:28.956524 IP 192.168.10.3.49842 > 192.168.10.4.80: Flags [.], ack 509589, win 1147, options [nop,nop,TS val 477316428 ecr 487235003], length 0
06:18:28.956567 IP 192.168.10.4.80 > 192.168.10.3.49842: Flags [.], seq 515381:521173, ack 1815, win 509, options [nop,nop,TS val 487235003 ecr 477316428], length 5792: HTTP
06:18:28.956585 IP 192.168.10.3.49842 > 192.168.10.4.80: Flags [.], ack 521173, win 1169, options [nop,nop,TS val 477316429 ecr 487235003], length 0
06:18:28.956617 IP 192.168.10.4.80 > 192.168.10.3.49842: Flags [P.], seq 521173:526963, ack 1815, win 509, options [nop,nop,TS val 487235003 ecr 477316428], length 5790: HTTP
06:18:28.956637 IP 192.168.10.3.49842 > 192.168.10.4.80: Flags [.], ack 526963, win 1169, options [nop,nop,TS val 477316429 ecr 487235003], length 0
06:18:28.956720 IP 192.168.10.3.49842 > 192.168.10.4.80: Flags [P.], seq 1815:1887, ack 526963, win 1169, options [nop,nop,TS val 477316429 ecr 487235003], length 72: HTTP: GET /20MB HTTP/1.1
06:18:28.957025 IP 192.168.10.4.80 > 192.168.10.3.49842: Flags [.], ack 1887, win 509, options [nop,nop,TS val 487235003 ecr 477316429], length 0
06:18:28.957214 IP 192.168.10.4.80 > 192.168.10.3.49842: Flags [.], seq 526963:531307, ack 1887, win 509, options [nop,nop,TS val 487235003 ecr 477316429], length 4344: HTTP: HTTP/1.1 206 Partial Content
06:18:28.957258 IP 192.168.10.3.49842 > 192.168.10.4.80: Flags [.], ack 531307, win 1169, options [nop,nop,TS val 477316429 ecr 487235003], length 0
06:18:28.957266 IP 192.168.10.4.80 > 192.168.10.3.49842: Flags [.], seq 531307:537099, ack 1887, win 509, options [nop,nop,TS val 487235003 ecr 477316429], length 5792: HTTP
06:18:28.957285 IP 192.168.10.3.49842 > 192.168.10.4.80: Flags [.], ack 537099, win 1169, options [nop,nop,TS val 477316429 ecr 487235003], length 0
06:18:28.957312 IP 192.168.10.4.80 > 192.168.10.3.49842: Flags [.], seq 537099:542891, ack 1887, win 509, options [nop,nop,TS val 487235003 ecr 477316429], length 5792: HTTP
06:18:28.957331 IP 192.168.10.3.49842 > 192.168.10.4.80: Flags [.], ack 542891, win 1169, options [nop,nop,TS val 477316429 ecr 487235003], length 0
06:18:28.957375 IP 192.168.10.4.80 > 192.168.10.3.49842: Flags [P.], seq 542891:547233, ack 1887, win 509, options [nop,nop,TS val 487235003 ecr 477316429], length 4342: HTTP
06:18:28.957394 IP 192.168.10.3.49842 > 192.168.10.4.80: Flags [.], ack 547233, win 1169, options [nop,nop,TS val 477316429 ecr 487235003], length 0
06:18:28.957530 IP 192.168.10.3.49842 > 192.168.10.4.80: Flags [P.], seq 1887:1959, ack 547233, win 1169, options [nop,nop,TS val 477316429 ecr 487235003], length 72: HTTP: GET /20MB HTTP/1.1
06:18:28.958033 IP 192.168.10.4.80 > 192.168.10.3.49842: Flags [.], ack 1959, win 509, options [nop,nop,TS val 487235004 ecr 477316429], length 0
06:18:28.958362 IP 192.168.10.4.80 > 192.168.10.3.49842: Flags [.], seq 547233:553025, ack 1959, win 509, options [nop,nop,TS val 487235005 ecr 477316429], length 5792: HTTP: HTTP/1.1 206 Partial Content
06:18:28.958375 IP 192.168.10.3.49842 > 192.168.10.4.80: Flags [.], ack 553025, win 1169, options [nop,nop,TS val 477316430 ecr 487235005], length 0
06:18:28.958424 IP 192.168.10.4.80 > 192.168.10.3.49842: Flags [.], seq 553025:558817, ack 1959, win 509, options [nop,nop,TS val 487235005 ecr 477316429], length 5792: HTTP
06:18:28.958444 IP 192.168.10.3.49842 > 192.168.10.4.80: Flags [.], ack 558817, win 1169, options [nop,nop,TS val 477316430 ecr 487235005], length 0
06:18:28.958455 IP 192.168.10.4.80 > 192.168.10.3.49842: Flags [.], seq 558817:561713, ack 1959, win 509, options [nop,nop,TS val 487235005 ecr 477316429], length 2896: HTTP
06:18:28.958467 IP 192.168.10.3.49842 > 192.168.10.4.80: Flags [.], ack 561713, win 1169, options [nop,nop,TS val 477316430 ecr 487235005], length 0
06:18:28.958527 IP 192.168.10.4.80 > 192.168.10.3.49842: Flags [P.], seq 561713:567503, ack 1959, win 509, options [nop,nop,TS val 487235005 ecr 477316429], length 5790: HTTP
06:18:28.958545 IP 192.168.10.3.49842 > 192.168.10.4.80: Flags [.], ack 567503, win 1169, options [nop,nop,TS val 477316431 ecr 487235005], length 0
06:18:28.958619 IP 192.168.10.3.49842 > 192.168.10.4.80: Flags [P.], seq 1959:2031, ack 567503, win 1169, options [nop,nop,TS val 477316431 ecr 487235005], length 72: HTTP: GET /20MB HTTP/1.1
06:18:28.958851 IP 192.168.10.4.80 > 192.168.10.3.49842: Flags [.], ack 2031, win 509, options [nop,nop,TS val 487235005 ecr 477316431], length 0
06:18:28.959028 IP 192.168.10.4.80 > 192.168.10.3.49842: Flags [.], seq 567503:568951, ack 2031, win 509, options [nop,nop,TS val 487235005 ecr 477316431], length 1448: HTTP: HTTP/1.1 206 Partial Content
06:18:28.959078 IP 192.168.10.4.80 > 192.168.10.3.49842: Flags [.], seq 568951:574743, ack 2031, win 509, options [nop,nop,TS val 487235005 ecr 477316431], length 5792: HTTP
06:18:28.959095 IP 192.168.10.3.49842 > 192.168.10.4.80: Flags [.], ack 574743, win 1169, options [nop,nop,TS val 477316431 ecr 487235005], length 0
06:18:28.959130 IP 192.168.10.4.80 > 192.168.10.3.49842: Flags [.], seq 574743:581983, ack 2031, win 509, options [nop,nop,TS val 487235005 ecr 477316431], length 7240: HTTP
06:18:28.959144 IP 192.168.10.3.49842 > 192.168.10.4.80: Flags [.], ack 581983, win 1169, options [nop,nop,TS val 477316431 ecr 487235005], length 0
