08:43:55.475098 IP 192.168.10.3.39084 > 192.168.10.4.80: Flags [S], seq 1654072891, win 64240, options [mss 1460,sackOK,TS val 486042947 ecr 0,nop,wscale 7], length 0
08:43:55.475535 IP 192.168.10.4.80 > 192.168.10.3.39084: Flags [S.], seq 2954157100, ack 1654072892, win 65160, options [mss 1460,sackOK,TS val 495961506 ecr 486042947,nop,wscale 7], length 0
08:43:55.475551 IP 192.168.10.3.39084 > 192.168.10.4.80: Flags [.], ack 1, win 502, options [nop,nop,TS val 486042948 ecr 495961506], length 0
08:43:55.475621 IP 192.168.10.3.39084 > 192.168.10.4.80: Flags [P.], seq 1:65, ack 1, win 502, options [nop,nop,TS val 486042948 ecr 495961506], length 64: HTTP: GET /20MB HTTP/1.1
08:43:55.475652 IP 192.168.10.3.39086 > 192.168.10.4.80: Flags [S], seq 3253628994, win 64240, options [mss 1460,sackOK,TS val 486042948 ecr 0,nop,wscale 7], length 0
08:43:55.475826 IP 192.168.10.4.80 > 192.168.10.3.39084: Flags [.], ack 65, win 509, options [nop,nop,TS val 495961506 ecr 486042948], length 0
08:43:55.475967 IP 192.168.10.4.80 > 192.168.10.3.39086: Flags [S.], seq 3910315661, ack 3253628995, win 65160, options [mss 1460,sackOK,TS val 495961507 ecr 486042948,nop,wscale 7], length 0
08:43:55.475990 IP 192.168.10.3.39086 > 192.168.10.4.80: Flags [.], ack 1, win 502, options [nop,nop,TS val 486042948 ecr 495961507], length 0
08:43:55.476061 IP 192.168.10.3.39086 > 192.168.10.4.80: Flags [P.], seq 1:69, ack 1, win 502, options [nop,nop,TS val 486042948 ecr 495961507], length 68: HTTP: GET /20MB HTTP/1.1
08:43:55.476271 IP 192.168.10.4.80 > 192.168.10.3.39084: Flags [.], seq 1:2897, ack 65, win 509, options [nop,nop,TS val 495961507 ecr 486042948], length 2896: HTTP: HTTP/1.1 206 Partial Content
08:43:55.476279 IP 192.168.10.3.39084 > 192.168.10.4.80: Flags [.], ack 2897, win 496, options [nop,nop,TS val 486042948 ecr 495961507], length 0
08:43:55.476319 IP 192.168.10.4.80 > 192.168.10.3.39084: Flags [P.], seq 2897:7241, ack 65, win 509, options [nop,nop,TS val 495961507 ecr 486042948], length 4344: HTTP
08:43:55.476320 IP 192.168.10.4.80 > 192.168.10.3.39084: Flags [.], seq 7241:8689, ack 65, win 509, options [nop,nop,TS val 495961507 ecr 486042948], length 1448: HTTP
08:43:55.476340 IP 192.168.10.3.39084 > 192.168.10.4.80: Flags [.], ack 7241, win 474, options [nop,nop,TS val 486042948 ecr 495961507], length 0
08:43:55.476342 IP 192.168.10.3.39084 > 192.168.10.4.80: Flags [.], ack 8689, win 466, options [nop,nop,TS val 486042948 ecr 495961507], length 0
08:43:55.476366 IP 192.168.10.4.80 > 192.168.10.3.39084: Flags [P.], seq 8689:14481, ack 65, win 509, options [nop,nop,TS val 495961507 ecr 486042948], length 5792: HTTP
08:43:55.476368 IP 192.168.10.3.39084 > 192.168.10.4.80: Flags [.], ack 14481, win 481, options [nop,nop,TS val 486042948 ecr 495961507], length 0
08:43:55.476419 IP 192.168.10.4.80 > 192.168.10.3.39086: Flags [.], ack 69, win 509, options [nop,nop,TS val 495961507 ecr 486042948], length 0
08:43:55.476420 IP 192.168.10.4.80 > 192.168.10.3.39084: Flags [.], seq 14481:18825, ack 65, win 509, options [nop,nop,TS val 495961507 ecr 486042948], length 4344: HTTP
08:43:55.476433 IP 192.168.10.3.39084 > 192.168.10.4.80: Flags [.], ack 18825, win 489, options [nop,nop,TS val 486042948 ecr 495961507], length 0
08:43:55.476490 IP 192.168.10.4.80 > 192.168.10.3.39084: Flags [P.], seq 18825:20263, ack 65, win 509, options [nop,nop,TS val 495961507 ecr 486042948], length 1438: HTTP
08:43:55.476498 IP 192.168.10.3.39084 > 192.168.10.4.80: Flags [.], ack 20263, win 501, options [nop,nop,TS val 486042948 ecr 495961507], length 0
08:43:55.476746 IP 192.168.10.4.80 > 192.168.10.3.39086: Flags [.], seq 1:4345, ack 69, win 509, options [nop,nop,TS val 495961507 ecr 486042948], length 4344: HTTP: HTTP/1.1 206 Partial Content
08:43:55.476752 IP 192.168.10.3.39086 > 192.168.10.4.80: Flags [.], ack 4345, win 489, options [nop,nop,TS val 486042949 ecr 495961507], length 0
08:43:55.476792 IP 192.168.10.4.80 > 192.168.10.3.39086: Flags [P.], seq 4345:7241, ack 69, win 509, options [nop,nop,TS val 495961507 ecr 486042948], length 2896: HTTP
08:43:55.476793 IP 192.168.10.4.80 > 192.168.10.3.39086: Flags [.], seq 7241:10137, ack 69, win 509, options [nop,nop,TS val 495961507 ecr 486042948], length 2896: HTTP
08:43:55.476797 IP 192.168.10.3.39086 > 192.168.10.4.80: Flags [.], ack 7241, win 496, options [nop,nop,TS val 486042949 ecr 495961507], length 0
08:43:55.476800 IP 192.168.10.3.39086 > 192.168.10.4.80: Flags [.], ack 10137, win 481, options [nop,nop,TS val 486042949 ecr 495961507], length 0
08:43:55.476840 IP 192.168.10.4.80 > 192.168.10.3.39086: Flags [.], seq 10137:11585, ack 69, win 509, options [nop,nop,TS val 495961507 ecr 486042948], length 1448: HTTP
08:43:55.476842 IP 192.168.10.3.39086 > 192.168.10.4.80: Flags [.], ack 11585, win 501, options [nop,nop,TS val 486042949 ecr 495961507], length 0
08:43:55.476867 IP 192.168.10.3.39084 > 192.168.10.4.80: Flags [P.], seq 65:133, ack 20263, win 501, options [nop,nop,TS val 486042949 ecr 495961507], length 68: HTTP: GET /20MB HTTP/1.1
08:43:55.476892 IP 192.168.10.4.80 > 192.168.10.3.39086: Flags [P.], seq 11585:14481, ack 69, win 509, options [nop,nop,TS val 495961507 ecr 486042948], length 2896: HTTP
08:43:55.476892 IP 192.168.10.4.80 > 192.168.10.3.39086: Flags [.], seq 14481:15929, ack 69, win 509, options [nop,nop,TS val 495961507 ecr 486042949], length 1448: HTTP
08:43:55.476895 IP 192.168.10.3.39086 > 192.168.10.4.80: Flags [.], ack 14481, win 496, options [nop,nop,TS val 486042949 ecr 495961507], length 0
08:43:55.476897 IP 192.168.10.3.39086 > 192.168.10.4.80: Flags [.], ack 15929, win 489, options [nop,nop,TS val 486042949 ecr 495961507], length 0
08:43:55.476942 IP 192.168.10.4.80 > 192.168.10.3.39086: Flags [P.], seq 15929:20267, ack 69, win 509, options [nop,nop,TS val 495961507 ecr 486042949], length 4338: HTTP
08:43:55.476943 IP 192.168.10.4.80 > 192.168.10.3.39084: Flags [.], ack 133, win 509, options [nop,nop,TS val 495961508 ecr 486042949], length 0
08:43:55.476945 IP 192.168.10.3.39086 > 192.168.10.4.80: Flags [.], ack 20267, win 489, options [nop,nop,TS val 486042949 ecr 495961507], length 0
08:43:55.477030 IP 192.168.10.3.39086 > 192.168.10.4.80: Flags [P.], seq 69:139, ack 20267, win 501, options [nop,nop,TS val 486042949 ecr 495961507], length 70: HTTP: GET /20MB HTTP/1.1
08:43:55.477148 IP 192.168.10.4.80 > 192.168.10.3.39086: Flags [.], ack 139, win 509, options [nop,nop,TS val 495961508 ecr 486042949], length 0
08:43:55.477315 IP 192.168.10.4.80 > 192.168.10.3.39084: Flags [.], seq 20263:24607, ack 133, win 509, options [nop,nop,TS val 495961508 ecr 486042949], length 4344: HTTP: HTTP/1.1 206 Partial Content
08:43:55.477324 IP 192.168.10.3.39084 > 192.168.10.4.80: Flags [.], ack 24607, win 501, options [nop,nop,TS val 486042949 ecr 495961508], length 0
08:43:55.477396 IP 192.168.10.4.80 > 192.168.10.3.39084: Flags [.], seq 24607:31847, ack 133, win 509, options [nop,nop,TS val 495961508 ecr 486042949], length 7240: HTTP
08:43:55.477407 IP 192.168.10.3.39084 > 192.168.10.4.80: Flags [.], ack 31847, win 501, options [nop,nop,TS val 486042949 ecr 495961508], length 0
08:43:55.477454 IP 192.168.10.4.80 > 192.168.10.3.39084: Flags [.], seq 31847:36191, ack 133, win 509, options [nop,nop,TS val 495961508 ecr 486042949], length 4344: HTTP
08:43:55.477474 IP 192.168.10.3.39084 > 192.168.10.4.80: Flags [.], ack 36191, win 501, options [nop,nop,TS val 486042949 ecr 495961508], length 0
08:43:55.477518 IP 192.168.10.4.80 > 192.168.10.3.39084: Flags [P.], seq 36191:37639, ack 133, win 509, options [nop,nop,TS val 495961508 ecr 486042949], length 1448: HTTP
08:43:55.477519 IP 192.168.10.4.80 > 192.168.10.3.39084: Flags [P.], seq 37639:40529, ack 133, win 509, options [nop,nop,TS val 495961508 ecr 486042949], length 2890: HTTP
08:43:55.477521 IP 192.168.10.4.80 > 192.168.10.3.39086: Flags [.], seq 20267:27507, ack 139, win 509, options [nop,nop,TS val 495961508 ecr 486042949], length 7240: HTTP: HTTP/1.1 206 Partial Content
08:43:55.477530 IP 192.168.10.3.39084 > 192.168.10.4.80: Flags [.], ack 40529, win 501, options [nop,nop,TS val 486042949 ecr 495961508], length 0
08:43:55.477570 IP 192.168.10.4.80 > 192.168.10.3.39086: Flags [.], seq 27507:33299, ack 139, win 509, options [nop,nop,TS val 495961508 ecr 486042949], length 5792: HTTP
08:43:55.477582 IP 192.168.10.3.39084 > 192.168.10.4.80: Flags [P.], seq 133:203, ack 40529, win 501, options [nop,nop,TS val 486042950 ecr 495961508], length 70: HTTP: GET /20MB HTTP/1.1
08:43:55.477583 IP 192.168.10.4.80 > 192.168.10.3.39086: Flags [.], seq 33299:34747, ack 139, win 509, options [nop,nop,TS val 495961508 ecr 486042949], length 1448: HTTP
08:43:55.477598 IP 192.168.10.3.39086 > 192.168.10.4.80: Flags [.], ack 34747, win 501, options [nop,nop,TS val 486042950 ecr 495961508], length 0
08:43:55.477834 IP 192.168.10.4.80 > 192.168.10.3.39086: Flags [P.], seq 34747:37643, ack 139, win 509, options [nop,nop,TS val 495961508 ecr 486042949], length 2896: HTTP
08:43:55.477835 IP 192.168.10.4.80 > 192.168.10.3.39086: Flags [P.], seq 37643:40535, ack 139, win 509, options [nop,nop,TS val 495961508 ecr 486042949], length 2892: HTTP
08:43:55.477841 IP 192.168.10.3.39086 > 192.168.10.4.80: Flags [.], ack 37643, win 546, options [nop,nop,TS val 486042950 ecr 495961508], length 0
08:43:55.477845 IP 192.168.10.3.39086 > 192.168.10.4.80: Flags [.], ack 40535, win 592, options [nop,nop,TS val 486042950 ecr 495961508], length 0
08:43:55.477935 IP 192.168.10.3.39086 > 192.168.10.4.80: Flags [P.], seq 139:209, ack 40535, win 592, options [nop,nop,TS val 486042950 ecr 495961508], length 70: HTTP: GET /20MB HTTP/1.1
08:43:55.477967 IP 192.168.10.4.80 > 192.168.10.3.39084: Flags [.], ack 203, win 509, options [nop,nop,TS val 495961509 ecr 486042950], length 0
08:43:55.478247 IP 192.168.10.4.80 > 192.168.10.3.39084: Flags [.], seq 40529:43425, ack 203, win 509, options [nop,nop,TS val 495961509 ecr 486042950], length 2896: HTTP: HTTP/1.1 206 Partial Content
08:43:55.478258 IP 192.168.10.3.39084 > 192.168.10.4.80: Flags [.], ack 43425, win 501, options [nop,nop,TS val 486042950 ecr 495961509], length 0
08:43:55.478275 IP 192.168.10.4.80 > 192.168.10.3.39084: Flags [.], seq 43425:46321, ack 203, win 509, options [nop,nop,TS val 495961509 ecr 486042950], length 2896: HTTP
08:43:55.478284 IP 192.168.10.3.39084 > 192.168.10.4.80: Flags [.], ack 46321, win 501, options [nop,nop,TS val 486042950 ecr 495961509], length 0
08:43:55.478297 IP 192.168.10.4.80 > 192.168.10.3.39084: Flags [.], seq 46321:49217, ack 203, win 509, options [nop,nop,TS val 495961509 ecr 486042950], length 2896: HTTP
08:43:55.478304 IP 192.168.10.3.39084 > 192.168.10.4.80: Flags [.], ack 49217, win 501, options [nop,nop,TS val 486042950 ecr 495961509], length 0
08:43:55.478353 IP 192.168.10.4.80 > 192.168.10.3.39084: Flags [.], seq 49217:55009, ack 203, win 509, options [nop,nop,TS val 495961509 ecr 486042950], length 5792: HTTP
08:43:55.478371 IP 192.168.10.3.39084 > 192.168.10.4.80: Flags [.], ack 55009, win 501, options [nop,nop,TS val 486042950 ecr 495961509], length 0
08:43:55.478405 IP 192.168.10.4.80 > 192.168.10.3.39084: Flags [P.], seq 55009:60797, ack 203, win 509, options [nop,nop,TS val 495961509 ecr 486042950], length 5788: HTTP
08:43:55.478422 IP 192.168.10.3.39084 > 192.168.10.4.80: Flags [.], ack 60797, win 501, options [nop,nop,TS val 486042950 ecr 495961509], length 0
08:43:55.478446 IP 192.168.10.4.80 > 192.168.10.3.39086: Flags [.], ack 209, win 509, options [nop,nop,TS val 495961509 ecr 486042950], length 0
08:43:55.478564 IP 192.168.10.4.80 > 192.168.10.3.39086: Flags [.], seq 40535:44879, ack 209, win 509, options [nop,nop,TS val 495961509 ecr 486042950], length 4344: HTTP: HTTP/1.1 206 Partial Content
08:43:55.478567 IP 192.168.10.3.39086 > 192.168.10.4.80: Flags [.], ack 44879, win 659, options [nop,nop,TS val 486042951 ecr 495961509], length 0
08:43:55.478615 IP 192.168.10.4.80 > 192.168.10.3.39086: Flags [.], seq 44879:50671, ack 209, win 509, options [nop,nop,TS val 495961509 ecr 486042950], length 5792: HTTP
08:43:55.478617 IP 192.168.10.3.39086 > 192.168.10.4.80: Flags [.], ack 50671, win 750, options [nop,nop,TS val 486042951 ecr 495961509], length 0
08:43:55.478633 IP 192.168.10.3.39084 > 192.168.10.4.80: Flags [P.], seq 203:273, ack 60797, win 501, options [nop,nop,TS val 486042951 ecr 495961509], length 70: HTTP: GET /20MB HTTP/1.1
08:43:55.478671 IP 192.168.10.4.80 > 192.168.10.3.39086: Flags [.], seq 50671:56463, ack 209, win 509, options [nop,nop,TS val 495961509 ecr 486042950], length 5792: HTTP
08:43:55.478676 IP 192.168.10.3.39086 > 192.168.10.4.80: Flags [.], ack 56463, win 840, options [nop,nop,TS val 486042951 ecr 495961509], length 0
08:43:55.478713 IP 192.168.10.4.80 > 192.168.10.3.39086: Flags [.], seq 56463:59359, ack 209, win 509, options [nop,nop,TS val 495961509 ecr 486042950], length 2896: HTTP
08:43:55.478715 IP 192.168.10.3.39086 > 192.168.10.4.80: Flags [.], ack 59359, win 886, options [nop,nop,TS val 486042951 ecr 495961509], length 0
08:43:55.478762 IP 192.168.10.4.80 > 192.168.10.3.39086: Flags [P.], seq 59359:60803, ack 209, win 509, options [nop,nop,TS val 495961509 ecr 486042950], length 1444: HTTP
08:43:55.478888 IP 192.168.10.3.39086 > 192.168.10.4.80: Flags [P.], seq 209:279, ack 60803, win 908, options [nop,nop,TS val 486042951 ecr 495961509], length 70: HTTP: GET /20MB HTTP/1.1
08:43:55.479064 IP 192.168.10.4.80 > 192.168.10.3.39084: Flags [.], ack 273, win 509, options [nop,nop,TS val 495961510 ecr 486042951], length 0
08:43:55.479284 IP 192.168.10.4.80 > 192.168.10.3.39084: Flags [.], seq 60797:65141, ack 273, win 509, options [nop,nop,TS val 495961510 ecr 486042951], length 4344: HTTP: HTTP/1.1 206 Partial Content
08:43:55.479293 IP 192.168.10.3.39084 > 192.168.10.4.80: Flags [.], ack 65141, win 501, options [nop,nop,TS val 486042951 ecr 495961510], length 0
08:43:55.479334 IP 192.168.10.4.80 > 192.168.10.3.39084: Flags [.], seq 65141:70933, ack 273, win 509, options [nop,nop,TS val 495961510 ecr 486042951], length 5792: HTTP
08:43:55.479342 IP 192.168.10.3.39084 > 192.168.10.4.80: Flags [.], ack 70933, win 501, options [nop,nop,TS val 486042951 ecr 495961510], length 0
08:43:55.479389 IP 192.168.10.4.80 > 192.168.10.3.39084: Flags [.], seq 70933:78173, ack 273, win 509, options [nop,nop,TS val 495961510 ecr 486042951], length 7240: HTTP
08:43:55.479394 IP 192.168.10.3.39084 > 192.168.10.4.80: Flags [.], ack 78173, win 614, options [nop,nop,TS val 486042951 ecr 495961510], length 0
08:43:55.479434 IP 192.168.10.4.80 > 192.168.10.3.39084: Flags [.], seq 78173:79621, ack 273, win 509, options [nop,nop,TS val 495961510 ecr 486042951], length 1448: HTTP
08:43:55.479485 IP 192.168.10.4.80 > 192.168.10.3.39084: Flags [P.], seq 79621:81065, ack 273, win 509, options [nop,nop,TS val 495961510 ecr 486042951], length 1444: HTTP
08:43:55.479486 IP 192.168.10.4.80 > 192.168.10.3.39086: Flags [.], ack 279, win 509, options [nop,nop,TS val 495961510 ecr 486042951], length 0
08:43:55.479491 IP 192.168.10.3.39084 > 192.168.10.4.80: Flags [.], ack 81065, win 660, options [nop,nop,TS val 486042951 ecr 495961510], length 0
08:43:55.479549 IP 192.168.10.4.80 > 192.168.10.3.39086: Flags [.], seq 60803:62251, ack 279, win 509, options [nop,nop,TS val 495961510 ecr 486042951], length 1448: HTTP: HTTP/1.1 206 Partial Content
08:43:55.479607 IP 192.168.10.4.80 > 192.168.10.3.39086: Flags [.], seq 62251:68043, ack 279, win 509, options [nop,nop,TS val 495961510 ecr 486042951], length 5792: HTTP
08:43:55.479611 IP 192.168.10.3.39086 > 192.168.10.4.80: Flags [.], ack 68043, win 1021, options [nop,nop,TS val 486042952 ecr 495961510], length 0
08:43:55.479652 IP 192.168.10.3.39084 > 192.168.10.4.80: Flags [P.], seq 273:343, ack 81065, win 660, options [nop,nop,TS val 486042952 ecr 495961510], length 70: HTTP: GET /20MB HTTP/1.1
08:43:55.479653 IP 192.168.10.4.80 > 192.168.10.3.39086: Flags [.], seq 68043:73835, ack 279, win 509, options [nop,nop,TS val 495961510 ecr 486042951], length 5792: HTTP
08:43:55.479656 IP 192.168.10.3.39086 > 192.168.10.4.80: Flags [.], ack 73835, win 1112, options [nop,nop,TS val 486042952 ecr 495961510], length 0
08:43:55.479703 IP 192.168.10.4.80 > 192.168.10.3.39086: Flags [.], seq 73835:79627, ack 279, win 509, options [nop,nop,TS val 495961510 ecr 486042951], length 5792: HTTP
08:43:55.479708 IP 192.168.10.3.39086 > 192.168.10.4.80: Flags [.], ack 79627, win 1202, options [nop,nop,TS val 486042952 ecr 495961510], length 0
08:43:55.479758 IP 192.168.10.4.80 > 192.168.10.3.39086: Flags [P.], seq 79627:81071, ack 279, win 509, options [nop,nop,TS val 495961510 ecr 486042951], length 1444: HTTP
08:43:55.479860 IP 192.168.10.3.39086 > 192.168.10.4.80: Flags [P.], seq 279:349, ack 81071, win 1225, options [nop,nop,TS val 486042952 ecr 495961510], length 70: HTTP: GET /20MB HTTP/1.1
08:43:55.480174 IP 192.168.10.4.80 > 192.168.10.3.39084: Flags [.], ack 343, win 509, options [nop,nop,TS val 495961511 ecr 486042952], length 0
08:43:55.480175 IP 192.168.10.4.80 > 192.168.10.3.39086: Flags [.], ack 349, win 509, options [nop,nop,TS val 495961511 ecr 486042952], length 0
08:43:55.480374 IP 192.168.10.4.80 > 192.168.10.3.39084: Flags [.], seq 81065:82513, ack 343, win 509, options [nop,nop,TS val 495961511 ecr 486042952], length 1448: HTTP: HTTP/1.1 206 Partial Content
08:43:55.480428 IP 192.168.10.4.80 > 192.168.10.3.39084: Flags [.], seq 82513:88305, ack 343, win 509, options [nop,nop,TS val 495961511 ecr 486042952], length 5792: HTTP
08:43:55.480431 IP 192.168.10.3.39084 > 192.168.10.4.80: Flags [.], ack 88305, win 773, options [nop,nop,TS val 486042952 ecr 495961511], length 0
08:43:55.480480 IP 192.168.10.4.80 > 192.168.10.3.39084: Flags [.], seq 88305:95545, ack 343, win 509, options [nop,nop,TS val 495961511 ecr 486042952], length 7240: HTTP
08:43:55.480482 IP 192.168.10.3.39084 > 192.168.10.4.80: Flags [.], ack 95545, win 886, options [nop,nop,TS val 486042952 ecr 495961511], length 0
08:43:55.480527 IP 192.168.10.4.80 > 192.168.10.3.39084: Flags [P.], seq 95545:101333, ack 343, win 509, options [nop,nop,TS val 495961511 ecr 486042952], length 5788: HTTP
08:43:55.480529 IP 192.168.10.3.39084 > 192.168.10.4.80: Flags [.], ack 101333, win 976, options [nop,nop,TS val 486042952 ecr 495961511], length 0
08:43:55.480576 IP 192.168.10.4.80 > 192.168.10.3.39086: Flags [.], seq 81071:86863, ack 349, win 509, options [nop,nop,TS val 495961511 ecr 486042952], length 5792: HTTP: HTTP/1.1 206 Partial Content
08:43:55.480578 IP 192.168.10.3.39086 > 192.168.10.4.80: Flags [.], ack 86863, win 1316, options [nop,nop,TS val 486042953 ecr 495961511], length 0
08:43:55.480626 IP 192.168.10.4.80 > 192.168.10.3.39086: Flags [.], seq 86863:92655, ack 349, win 509, options [nop,nop,TS val 495961511 ecr 486042952], length 5792: HTTP
08:43:55.480628 IP 192.168.10.3.39086 > 192.168.10.4.80: Flags [.], ack 92655, win 1406, options [nop,nop,TS val 486042953 ecr 495961511], length 0
08:43:55.480658 IP 192.168.10.3.39084 > 192.168.10.4.80: Flags [P.], seq 343:413, ack 101333, win 976, options [nop,nop,TS val 486042953 ecr 495961511], length 70: HTTP: GET /20MB HTTP/1.1
08:43:55.480679 IP 192.168.10.4.80 > 192.168.10.3.39086: Flags [.], seq 92655:98447, ack 349, win 509, options [nop,nop,TS val 495961511 ecr 486042952], length 5792: HTTP
08:43:55.480681 IP 192.168.10.3.39086 > 192.168.10.4.80: Flags [.], ack 98447, win 1497, options [nop,nop,TS val 486042953 ecr 495961511], length 0
08:43:55.480724 IP 192.168.10.4.80 > 192.168.10.3.39086: Flags [P.], seq 98447:101339, ack 349, win 509, options [nop,nop,TS val 495961511 ecr 486042952], length 2892: HTTP
08:43:55.480727 IP 192.168.10.3.39086 > 192.168.10.4.80: Flags [.], ack 101339, win 1542, options [nop,nop,TS val 486042953 ecr 495961511], length 0
08:43:55.480773 IP 192.168.10.3.39086 > 192.168.10.4.80: Flags [P.], seq 349:419, ack 101339, win 1542, options [nop,nop,TS val 486042953 ecr 495961511], length 70: HTTP: GET /20MB HTTP/1.1
08:43:55.480857 IP 192.168.10.4.80 > 192.168.10.3.39084: Flags [.], ack 413, win 509, options [nop,nop,TS val 495961511 ecr 486042953], length 0
08:43:55.481102 IP 192.168.10.4.80 > 192.168.10.3.39084: Flags [.], seq 101333:105677, ack 413, win 509, options [nop,nop,TS val 495961512 ecr 486042953], length 4344: HTTP: HTTP/1.1 206 Partial Content
08:43:55.481104 IP 192.168.10.3.39084 > 192.168.10.4.80: Flags [.], ack 105677, win 1044, options [nop,nop,TS val 486042953 ecr 495961512], length 0
08:43:55.481153 IP 192.168.10.4.80 > 192.168.10.3.39084: Flags [.], seq 105677:111469, ack 413, win 509, options [nop,nop,TS val 495961512 ecr 486042953], length 5792: HTTP
08:43:55.481155 IP 192.168.10.3.39084 > 192.168.10.4.80: Flags [.], ack 111469, win 1135, options [nop,nop,TS val 486042953 ecr 495961512], length 0
08:43:55.481203 IP 192.168.10.4.80 > 192.168.10.3.39084: Flags [.], seq 111469:117261, ack 413, win 509, options [nop,nop,TS val 495961512 ecr 486042953], length 5792: HTTP
08:43:55.481205 IP 192.168.10.3.39084 > 192.168.10.4.80: Flags [.], ack 117261, win 1225, options [nop,nop,TS val 486042953 ecr 495961512], length 0
08:43:55.481254 IP 192.168.10.4.80 > 192.168.10.3.39084: Flags [P.], seq 117261:121601, ack 413, win 509, options [nop,nop,TS val 495961512 ecr 486042953], length 4340: HTTP
08:43:55.481255 IP 192.168.10.4.80 > 192.168.10.3.39086: Flags [.], ack 419, win 509, options [nop,nop,TS val 495961512 ecr 486042953], length 0
08:43:55.481257 IP 192.168.10.3.39084 > 192.168.10.4.80: Flags [.], ack 121601, win 1293, options [nop,nop,TS val 486042953 ecr 495961512], length 0
08:43:55.481284 IP 192.168.10.3.39084 > 192.168.10.4.80: Flags [P.], seq 413:483, ack 121601, win 1293, options [nop,nop,TS val 486042953 ecr 495961512], length 70: HTTP: GET /20MB HTTP/1.1
08:43:55.481365 IP 192.168.10.4.80 > 192.168.10.3.39086: Flags [.], seq 101339:102787, ack 419, win 509, options [nop,nop,TS val 495961512 ecr 486042953], length 1448: HTTP: HTTP/1.1 206 Partial Content
08:43:55.481418 IP 192.168.10.4.80 > 192.168.10.3.39086: Flags [.], seq 102787:108579, ack 419, win 509, options [nop,nop,TS val 495961512 ecr 486042953], length 5792: HTTP
08:43:55.481422 IP 192.168.10.3.39086 > 192.168.10.4.80: Flags [.], ack 108579, win 1655, options [nop,nop,TS val 486042953 ecr 495961512], length 0
08:43:55.481468 IP 192.168.10.4.80 > 192.168.10.3.39086: Flags [.], seq 108579:114371, ack 419, win 509, options [nop,nop,TS val 495961512 ecr 486042953], length 5792: HTTP
08:43:55.481472 IP 192.168.10.3.39086 > 192.168.10.4.80: Flags [.], ack 114371, win 1745, options [nop,nop,TS val 486042953 ecr 495961512], length 0
08:43:55.481518 IP 192.168.10.4.80 > 192.168.10.3.39086: Flags [.], seq 114371:120163, ack 419, win 509, options [nop,nop,TS val 495961512 ecr 486042953], length 5792: HTTP
08:43:55.481521 IP 192.168.10.3.39086 > 192.168.10.4.80: Flags [.], ack 120163, win 1836, options [nop,nop,TS val 486042953 ecr 495961512], length 0
08:43:55.481563 IP 192.168.10.4.80 > 192.168.10.3.39086: Flags [P.], seq 120163:121607, ack 419, win 509, options [nop,nop,TS val 495961512 ecr 486042953], length 1444: HTTP
08:43:55.481563 IP 192.168.10.4.80 > 192.168.10.3.39084: Flags [.], ack 483, win 509, options [nop,nop,TS val 495961512 ecr 486042953], length 0
08:43:55.481729 IP 192.168.10.4.80 > 192.168.10.3.39084: Flags [.], seq 121601:124497, ack 483, win 509, options [nop,nop,TS val 495961512 ecr 486042953], length 2896: HTTP: HTTP/1.1 206 Partial Content
08:43:55.481731 IP 192.168.10.3.39084 > 192.168.10.4.80: Flags [.], ack 124497, win 1338, options [nop,nop,TS val 486042954 ecr 495961512], length 0
08:43:55.481749 IP 192.168.10.3.39086 > 192.168.10.4.80: Flags [P.], seq 419:489, ack 121607, win 1859, options [nop,nop,TS val 486042954 ecr 495961512], length 70: HTTP: GET /20MB HTTP/1.1
08:43:55.481778 IP 192.168.10.4.80 > 192.168.10.3.39084: Flags [.], seq 124497:130289, ack 483, win 509, options [nop,nop,TS val 495961512 ecr 486042953], length 5792: HTTP
08:43:55.481781 IP 192.168.10.3.39084 > 192.168.10.4.80: Flags [.], ack 130289, win 1429, options [nop,nop,TS val 486042954 ecr 495961512], length 0
08:43:55.481828 IP 192.168.10.4.80 > 192.168.10.3.39084: Flags [.], seq 130289:136081, ack 483, win 509, options [nop,nop,TS val 495961512 ecr 486042953], length 5792: HTTP
08:43:55.481830 IP 192.168.10.3.39084 > 192.168.10.4.80: Flags [.], ack 136081, win 1519, options [nop,nop,TS val 486042954 ecr 495961512], length 0
08:43:55.481878 IP 192.168.10.4.80 > 192.168.10.3.39084: Flags [P.], seq 136081:141869, ack 483, win 509, options [nop,nop,TS val 495961512 ecr 486042953], length 5788: HTTP
08:43:55.481880 IP 192.168.10.3.39084 > 192.168.10.4.80: Flags [.], ack 141869, win 1610, options [nop,nop,TS val 486042954 ecr 495961512], length 0
08:43:55.482260 IP 192.168.10.4.80 > 192.168.10.3.39086: Flags [.], ack 489, win 509, options [nop,nop,TS val 495961513 ecr 486042954], length 0
08:43:55.482458 IP 192.168.10.4.80 > 192.168.10.3.39086: Flags [.], seq 121607:125951, ack 489, win 509, options [nop,nop,TS val 495961513 ecr 486042954], length 4344: HTTP: HTTP/1.1 206 Partial Content
08:43:55.482460 IP 192.168.10.3.39086 > 192.168.10.4.80: Flags [.], ack 125951, win 1926, options [nop,nop,TS val 486042954 ecr 495961513], length 0
08:43:55.482477 IP 192.168.10.3.39084 > 192.168.10.4.80: Flags [P.], seq 483:553, ack 141869, win 1610, options [nop,nop,TS val 486042954 ecr 495961512], length 70: HTTP: GET /20MB HTTP/1.1
08:43:55.482511 IP 192.168.10.4.80 > 192.168.10.3.39086: Flags [.], seq 125951:131743, ack 489, win 509, options [nop,nop,TS val 495961513 ecr 486042954], length 5792: HTTP
08:43:55.482513 IP 192.168.10.3.39086 > 192.168.10.4.80: Flags [.], ack 131743, win 2017, options [nop,nop,TS val 486042954 ecr 495961513], length 0
08:43:55.482559 IP 192.168.10.4.80 > 192.168.10.3.39086: Flags [.], seq 131743:137535, ack 489, win 509, options [nop,nop,TS val 495961513 ecr 486042954], length 5792: HTTP
08:43:55.482561 IP 192.168.10.3.39086 > 192.168.10.4.80: Flags [.], ack 137535, win 2107, options [nop,nop,TS val 486042955 ecr 495961513], length 0
08:43:55.482606 IP 192.168.10.4.80 > 192.168.10.3.39086: Flags [.], seq 137535:138983, ack 489, win 509, options [nop,nop,TS val 495961513 ecr 486042954], length 1448: HTTP
08:43:55.482657 IP 192.168.10.4.80 > 192.168.10.3.39086: Flags [P.], seq 138983:141875, ack 489, win 509, options [nop,nop,TS val 495961513 ecr 486042954], length 2892: HTTP
08:43:55.482659 IP 192.168.10.3.39086 > 192.168.10.4.80: Flags [.], ack 141875, win 2175, options [nop,nop,TS val 486042955 ecr 495961513], length 0
08:43:55.482822 IP 192.168.10.4.80 > 192.168.10.3.39084: Flags [.], ack 553, win 509, options [nop,nop,TS val 495961513 ecr 486042954], length 0
08:43:55.483040 IP 192.168.10.4.80 > 192.168.10.3.39084: Flags [.], seq 141869:146213, ack 553, win 509, options [nop,nop,TS val 495961514 ecr 486042954], length 4344: HTTP: HTTP/1.1 206 Partial Content
08:43:55.483042 IP 192.168.10.3.39084 > 192.168.10.4.80: Flags [.], ack 146213, win 1677, options [nop,nop,TS val 486042955 ecr 495961514], length 0
08:43:55.483060 IP 192.168.10.3.39086 > 192.168.10.4.80: Flags [P.], seq 489:559, ack 141875, win 2175, options [nop,nop,TS val 486042955 ecr 495961513], length 70: HTTP: GET /20MB HTTP/1.1
08:43:55.483091 IP 192.168.10.4.80 > 192.168.10.3.39084: Flags [.], seq 146213:152005, ack 553, win 509, options [nop,nop,TS val 495961514 ecr 486042954], length 5792: HTTP
08:43:55.483093 IP 192.168.10.3.39084 > 192.168.10.4.80: Flags [.], ack 152005, win 1768, options [nop,nop,TS val 486042955 ecr 495961514], length 0
08:43:55.483142 IP 192.168.10.4.80 > 192.168.10.3.39084: Flags [.], seq 152005:156349, ack 553, win 509, options [nop,nop,TS val 495961514 ecr 486042954], length 4344: HTTP
08:43:55.483144 IP 192.168.10.3.39084 > 192.168.10.4.80: Flags [.], ack 156349, win 1836, options [nop,nop,TS val 486042955 ecr 495961514], length 0
08:43:55.483190 IP 192.168.10.4.80 > 192.168.10.3.39084: Flags [.], seq 156349:160693, ack 553, win 509, options [nop,nop,TS val 495961514 ecr 486042954], length 4344: HTTP
08:43:55.483192 IP 192.168.10.3.39084 > 192.168.10.4.80: Flags [.], ack 160693, win 1904, options [nop,nop,TS val 486042955 ecr 495961514], length 0
08:43:55.483238 IP 192.168.10.4.80 > 192.168.10.3.39084: Flags [P.], seq 160693:162137, ack 553, win 509, options [nop,nop,TS val 495961514 ecr 486042954], length 1444: HTTP
08:43:55.483285 IP 192.168.10.3.39084 > 192.168.10.4.80: Flags [P.], seq 553:623, ack 162137, win 1926, options [nop,nop,TS val 486042955 ecr 495961514], length 70: HTTP: GET /20MB HTTP/1.1
08:43:55.483288 IP 192.168.10.4.80 > 192.168.10.3.39086: Flags [.], ack 559, win 509, options [nop,nop,TS val 495961514 ecr 486042955], length 0
08:43:55.483456 IP 192.168.10.4.80 > 192.168.10.3.39086: Flags [.], seq 141875:143323, ack 559, win 509, options [nop,nop,TS val 495961514 ecr 486042955], length 1448: HTTP: HTTP/1.1 206 Partial Content
08:43:55.483524 IP 192.168.10.4.80 > 192.168.10.3.39086: Flags [.], seq 143323:149115, ack 559, win 509, options [nop,nop,TS val 495961514 ecr 486042955], length 5792: HTTP
08:43:55.483528 IP 192.168.10.3.39086 > 192.168.10.4.80: Flags [.], ack 149115, win 2288, options [nop,nop,TS val 486042955 ecr 495961514], length 0
08:43:55.483573 IP 192.168.10.4.80 > 192.168.10.3.39086: Flags [.], seq 149115:154907, ack 559, win 509, options [nop,nop,TS val 495961514 ecr 486042955], length 5792: HTTP
08:43:55.483580 IP 192.168.10.3.39086 > 192.168.10.4.80: Flags [.], ack 154907, win 2379, options [nop,nop,TS val 486042956 ecr 495961514], length 0
08:43:55.483611 IP 192.168.10.4.80 > 192.168.10.3.39086: Flags [.], seq 154907:160699, ack 559, win 509, options [nop,nop,TS val 495961514 ecr 486042955], length 5792: HTTP
08:43:55.483615 IP 192.168.10.3.39086 > 192.168.10.4.80: Flags [.], ack 160699, win 2469, options [nop,nop,TS val 486042956 ecr 495961514], length 0
08:43:55.483659 IP 192.168.10.4.80 > 192.168.10.3.39086: Flags [P.], seq 160699:162143, ack 559, win 509, options [nop,nop,TS val 495961514 ecr 486042955], length 1444: HTTP
08:43:55.483660 IP 192.168.10.4.80 > 192.168.10.3.39084: Flags [.], ack 623, win 509, options [nop,nop,TS val 495961514 ecr 486042955], length 0
08:43:55.483739 IP 192.168.10.4.80 > 192.168.10.3.39084: Flags [.], seq 162137:165033, ack 623, win 509, options [nop,nop,TS val 495961514 ecr 486042955], length 2896: HTTP: HTTP/1.1 206 Partial Content
08:43:55.483741 IP 192.168.10.3.39084 > 192.168.10.4.80: Flags [.], ack 165033, win 1972, options [nop,nop,TS val 486042956 ecr 495961514], length 0
08:43:55.483790 IP 192.168.10.4.80 > 192.168.10.3.39084: Flags [.], seq 165033:170825, ack 623, win 509, options [nop,nop,TS val 495961514 ecr 486042955], length 5792: HTTP
08:43:55.483792 IP 192.168.10.3.39084 > 192.168.10.4.80: Flags [.], ack 170825, win 2062, options [nop,nop,TS val 486042956 ecr 495961514], length 0
08:43:55.483808 IP 192.168.10.3.39086 > 192.168.10.4.80: Flags [P.], seq 559:629, ack 162143, win 2492, options [nop,nop,TS val 486042956 ecr 495961514], length 70: HTTP: GET /20MB HTTP/1.1
08:43:55.483840 IP 192.168.10.4.80 > 192.168.10.3.39084: Flags [.], seq 170825:176617, ack 623, win 509, options [nop,nop,TS val 495961514 ecr 486042955], length 5792: HTTP
08:43:55.483842 IP 192.168.10.3.39084 > 192.168.10.4.80: Flags [.], ack 176617, win 2153, options [nop,nop,TS val 486042956 ecr 495961514], length 0
08:43:55.483891 IP 192.168.10.4.80 > 192.168.10.3.39084: Flags [P.], seq 176617:182405, ack 623, win 509, options [nop,nop,TS val 495961514 ecr 486042955], length 5788: HTTP
08:43:55.483894 IP 192.168.10.3.39084 > 192.168.10.4.80: Flags [.], ack 182405, win 2243, options [nop,nop,TS val 486042956 ecr 495961514], length 0
08:43:55.483920 IP 192.168.10.3.39084 > 192.168.10.4.80: Flags [P.], seq 623:693, ack 182405, win 2243, options [nop,nop,TS val 486042956 ecr 495961514], length 70: HTTP: GET /20MB HTTP/1.1
08:43:55.484157 IP 192.168.10.4.80 > 192.168.10.3.39086: Flags [.], ack 629, win 509, options [nop,nop,TS val 495961515 ecr 486042956], length 0
08:43:55.484158 IP 192.168.10.4.80 > 192.168.10.3.39084: Flags [.], ack 693, win 509, options [nop,nop,TS val 495961515 ecr 486042956], length 0
08:43:55.484325 IP 192.168.10.4.80 > 192.168.10.3.39086: Flags [.], seq 162143:165039, ack 629, win 509, options [nop,nop,TS val 495961515 ecr 486042956], length 2896: HTTP: HTTP/1.1 206 Partial Content
08:43:55.484327 IP 192.168.10.3.39086 > 192.168.10.4.80: Flags [.], ack 165039, win 2537, options [nop,nop,TS val 486042956 ecr 495961515], length 0
08:43:55.484371 IP 192.168.10.4.80 > 192.168.10.3.39086: Flags [.], seq 165039:170831, ack 629, win 509, options [nop,nop,TS val 495961515 ecr 486042956], length 5792: HTTP
08:43:55.484373 IP 192.168.10.3.39086 > 192.168.10.4.80: Flags [.], ack 170831, win 2628, options [nop,nop,TS val 486042956 ecr 495961515], length 0
08:43:55.484422 IP 192.168.10.4.80 > 192.168.10.3.39086: Flags [.], seq 170831:176623, ack 629, win 509, options [nop,nop,TS val 495961515 ecr 486042956], length 5792: HTTP
08:43:55.484424 IP 192.168.10.3.39086 > 192.168.10.4.80: Flags [.], ack 176623, win 2718, options [nop,nop,TS val 486042956 ecr 495961515], length 0
08:43:55.484471 IP 192.168.10.4.80 > 192.168.10.3.39086: Flags [P.], seq 176623:182411, ack 629, win 509, options [nop,nop,TS val 495961515 ecr 486042956], length 5788: HTTP
08:43:55.484473 IP 192.168.10.3.39086 > 192.168.10.4.80: Flags [.], ack 182411, win 2802, options [nop,nop,TS val 486042956 ecr 495961515], length 0
08:43:55.484519 IP 192.168.10.3.39086 > 192.168.10.4.80: Flags [P.], seq 629:699, ack 182411, win 2802, options [nop,nop,TS val 486042956 ecr 495961515], length 70: HTTP: GET /20MB HTTP/1.1
08:43:55.484524 IP 192.168.10.4.80 > 192.168.10.3.39084: Flags [.], seq 182405:188197, ack 693, win 509, options [nop,nop,TS val 495961515 ecr 486042956], length 5792: HTTP: HTTP/1.1 206 Partial Content
08:43:55.484526 IP 192.168.10.3.39084 > 192.168.10.4.80: Flags [.], ack 188197, win 2334, options [nop,nop,TS val 486042956 ecr 495961515], length 0
08:43:55.484574 IP 192.168.10.4.80 > 192.168.10.3.39084: Flags [.], seq 188197:193989, ack 693, win 509, options [nop,nop,TS val 495961515 ecr 486042956], length 5792: HTTP
08:43:55.484578 IP 192.168.10.3.39084 > 192.168.10.4.80: Flags [.], ack 193989, win 2424, options [nop,nop,TS val 486042957 ecr 495961515], length 0
08:43:55.484624 IP 192.168.10.4.80 > 192.168.10.3.39084: Flags [.], seq 193989:199781, ack 693, win 509, options [nop,nop,TS val 495961515 ecr 486042956], length 5792: HTTP
08:43:55.484628 IP 192.168.10.3.39084 > 192.168.10.4.80: Flags [.], ack 199781, win 2515, options [nop,nop,TS val 486042957 ecr 495961515], length 0
08:43:55.484672 IP 192.168.10.4.80 > 192.168.10.3.39084: Flags [P.], seq 199781:202673, ack 693, win 509, options [nop,nop,TS val 495961515 ecr 486042956], length 2892: HTTP
08:43:55.484676 IP 192.168.10.3.39084 > 192.168.10.4.80: Flags [.], ack 202673, win 2560, options [nop,nop,TS val 486042957 ecr 495961515], length 0
08:43:55.484837 IP 192.168.10.4.80 > 192.168.10.3.39086: Flags [.], ack 699, win 509, options [nop,nop,TS val 495961515 ecr 486042956], length 0
08:43:55.485037 IP 192.168.10.4.80 > 192.168.10.3.39086: Flags [.], seq 182411:183859, ack 699, win 509, options [nop,nop,TS val 495961516 ecr 486042956], length 1448: HTTP: HTTP/1.1 206 Partial Content
08:43:55.485090 IP 192.168.10.4.80 > 192.168.10.3.39086: Flags [.], seq 183859:189651, ack 699, win 509, options [nop,nop,TS val 495961516 ecr 486042956], length 5792: HTTP
08:43:55.485093 IP 192.168.10.3.39086 > 192.168.10.4.80: Flags [.], ack 189651, win 2802, options [nop,nop,TS val 486042957 ecr 495961516], length 0
08:43:55.485109 IP 192.168.10.3.39084 > 192.168.10.4.80: Flags [P.], seq 693:763, ack 202673, win 2560, options [nop,nop,TS val 486042957 ecr 495961515], length 70: HTTP: GET /20MB HTTP/1.1
08:43:55.485152 IP 192.168.10.4.80 > 192.168.10.3.39086: Flags [.], seq 189651:196891, ack 699, win 509, options [nop,nop,TS val 495961516 ecr 486042956], length 7240: HTTP
08:43:55.485171 IP 192.168.10.3.39086 > 192.168.10.4.80: Flags [.], ack 196891, win 2824, options [nop,nop,TS val 486042957 ecr 495961516], length 0
08:43:55.485187 IP 192.168.10.4.80 > 192.168.10.3.39086: Flags [.], seq 196891:201235, ack 699, win 509, options [nop,nop,TS val 495961516 ecr 486042956], length 4344: HTTP
08:43:55.485195 IP 192.168.10.3.39086 > 192.168.10.4.80: Flags [.], ack 201235, win 2824, options [nop,nop,TS val 486042957 ecr 495961516], length 0
08:43:55.485238 IP 192.168.10.4.80 > 192.168.10.3.39086: Flags [P.], seq 201235:202679, ack 699, win 509, options [nop,nop,TS val 495961516 ecr 486042956], length 1444: HTTP
08:43:55.485288 IP 192.168.10.3.39086 > 192.168.10.4.80: Flags [P.], seq 699:769, ack 202679, win 2824, options [nop,nop,TS val 486042957 ecr 495961516], length 70: HTTP: GET /20MB HTTP/1.1
08:43:55.485417 IP 192.168.10.4.80 > 192.168.10.3.39084: Flags [.], ack 763, win 509, options [nop,nop,TS val 495961516 ecr 486042957], length 0
08:43:55.485470 IP 192.168.10.4.80 > 192.168.10.3.39086: Flags [.], ack 769, win 509, options [nop,nop,TS val 495961516 ecr 486042957], length 0
08:43:55.485619 IP 192.168.10.4.80 > 192.168.10.3.39084: Flags [.], seq 202673:204121, ack 763, win 509, options [nop,nop,TS val 495961516 ecr 486042957], length 1448: HTTP: HTTP/1.1 206 Partial Content
08:43:55.485671 IP 192.168.10.4.80 > 192.168.10.3.39084: Flags [.], seq 204121:209913, ack 763, win 509, options [nop,nop,TS val 495961516 ecr 486042957], length 5792: HTTP
08:43:55.485673 IP 192.168.10.3.39084 > 192.168.10.4.80: Flags [.], ack 209913, win 2673, options [nop,nop,TS val 486042958 ecr 495961516], length 0
08:43:55.485725 IP 192.168.10.4.80 > 192.168.10.3.39084: Flags [.], seq 209913:217153, ack 763, win 509, options [nop,nop,TS val 495961516 ecr 486042957], length 7240: HTTP
08:43:55.485727 IP 192.168.10.3.39084 > 192.168.10.4.80: Flags [.], ack 217153, win 2786, options [nop,nop,TS val 486042958 ecr 495961516], length 0
08:43:55.485771 IP 192.168.10.4.80 > 192.168.10.3.39084: Flags [P.], seq 217153:222941, ack 763, win 509, options [nop,nop,TS val 495961516 ecr 486042957], length 5788: HTTP
08:43:55.485773 IP 192.168.10.3.39084 > 192.168.10.4.80: Flags [.], ack 222941, win 2876, options [nop,nop,TS val 486042958 ecr 495961516], length 0
08:43:55.485820 IP 192.168.10.4.80 > 192.168.10.3.39086: Flags [.], seq 202679:208471, ack 769, win 509, options [nop,nop,TS val 495961516 ecr 486042957], length 5792: HTTP: HTTP/1.1 206 Partial Content
08:43:55.485848 IP 192.168.10.3.39084 > 192.168.10.4.80: Flags [P.], seq 763:833, ack 222941, win 2876, options [nop,nop,TS val 486042958 ecr 495961516], length 70: HTTP: GET /20MB HTTP/1.1
08:43:55.485859 IP 192.168.10.3.39086 > 192.168.10.4.80: Flags [.], ack 208471, win 2824, options [nop,nop,TS val 486042958 ecr 495961516], length 0
08:43:55.485870 IP 192.168.10.4.80 > 192.168.10.3.39086: Flags [.], seq 208471:214263, ack 769, win 509, options [nop,nop,TS val 495961516 ecr 486042957], length 5792: HTTP
08:43:55.485879 IP 192.168.10.3.39086 > 192.168.10.4.80: Flags [.], ack 214263, win 2824, options [nop,nop,TS val 486042958 ecr 495961516], length 0
08:43:55.485923 IP 192.168.10.4.80 > 192.168.10.3.39086: Flags [.], seq 214263:218607, ack 769, win 509, options [nop,nop,TS val 495961516 ecr 486042957], length 4344: HTTP
08:43:55.485938 IP 192.168.10.3.39086 > 192.168.10.4.80: Flags [.], ack 218607, win 2824, options [nop,nop,TS val 486042958 ecr 495961516], length 0
08:43:55.485976 IP 192.168.10.4.80 > 192.168.10.3.39086: Flags [P.], seq 218607:222947, ack 769, win 509, options [nop,nop,TS val 495961516 ecr 486042957], length 4340: HTTP
08:43:55.485991 IP 192.168.10.3.39086 > 192.168.10.4.80: Flags [.], ack 222947, win 2824, options [nop,nop,TS val 486042958 ecr 495961516], length 0
