06:18:28.674063 IP 192.168.20.3.42122 > 192.168.20.4.80: Flags [S], seq 3635130583, win 64240, options [mss 1460,sackOK,TS val 3965018919 ecr 0,nop,wscale 7], length 0
06:18:28.674285 IP 192.168.20.4.80 > 192.168.20.3.42122: Flags [S.], seq 121645224, ack 3635130584, win 65160, options [mss 1460,sackOK,TS val 4236718341 ecr 3965018919,nop,wscale 7], length 0
06:18:28.674314 IP 192.168.20.3.42122 > 192.168.20.4.80: Flags [.], ack 1, win 502, options [nop,nop,TS val 3965018919 ecr 4236718341], length 0
06:18:28.674394 IP 192.168.20.3.42122 > 192.168.20.4.80: Flags [P.], seq 1:69, ack 1, win 502, options [nop,nop,TS val 3965018919 ecr 4236718341], length 68: HTTP: GET /20MB HTTP/1.1
06:18:28.674597 IP 192.168.20.4.80 > 192.168.20.3.42122: Flags [.], ack 69, win 509, options [nop,nop,TS val 4236718342 ecr 3965018919], length 0
06:18:28.924569 IP 192.168.20.4.80 > 192.168.20.3.42122: Flags [.], seq 1:1449, ack 69, win 509, options [nop,nop,TS val 4236718592 ecr 3965018919], length 1448: HTTP: HTTP/1.1 206 Partial Content
06:18:28.924583 IP 192.168.20.3.42122 > 192.168.20.4.80: Flags [.], ack 1449, win 501, options [nop,nop,TS val 3965019170 ecr 4236718592], length 0
06:18:28.924677 IP 192.168.20.4.80 > 192.168.20.3.42122: Flags [P.], seq 1449:7241, ack 69, win 509, options [nop,nop,TS val 4236718592 ecr 3965018919], length 5792: HTTP
06:18:28.924679 IP 192.168.20.4.80 > 192.168.20.3.42122: Flags [.], seq 7241:11585, ack 69, win 509, options [nop,nop,TS val 4236718592 ecr 3965018919], length 4344: HTTP
06:18:28.924699 IP 192.168.20.3.42122 > 192.168.20.4.80: Flags [.], ack 7241, win 476, options [nop,nop,TS val 3965019170 ecr 4236718592], length 0
06:18:28.924714 IP 192.168.20.3.42122 > 192.168.20.4.80: Flags [.], ack 11585, win 449, options [nop,nop,TS val 3965019170 ecr 4236718592], length 0
06:18:28.924753 IP 192.168.20.4.80 > 192.168.20.3.42122: Flags [P.], seq 11585:14481, ack 69, win 509, options [nop,nop,TS val 4236718592 ecr 3965018919], length 2896: HTTP
06:18:28.924759 IP 192.168.20.3.42122 > 192.168.20.4.80: Flags [.], ack 14481, win 431, options [nop,nop,TS val 3965019170 ecr 4236718592], length 0
06:18:28.924840 IP 192.168.20.4.80 > 192.168.20.3.42122: Flags [.], seq 14481:18825, ack 69, win 509, options [nop,nop,TS val 4236718592 ecr 3965019170], length 4344: HTTP
06:18:28.924850 IP 192.168.20.3.42122 > 192.168.20.4.80: Flags [.], ack 18825, win 485, options [nop,nop,TS val 3965019170 ecr 4236718592], length 0
06:18:28.925003 IP 192.168.20.4.80 > 192.168.20.3.42122: Flags [P.], seq 18825:20267, ack 69, win 509, options [nop,nop,TS val 4236718592 ecr 3965019170], length 1442: HTTP
06:18:28.925023 IP 192.168.20.3.42122 > 192.168.20.4.80: Flags [.], ack 20267, win 524, options [nop,nop,TS val 3965019170 ecr 4236718592], length 0
06:18:28.925202 IP 192.168.20.3.42122 > 192.168.20.4.80: Flags [P.], seq 69:137, ack 20267, win 524, options [nop,nop,TS val 3965019170 ecr 4236718592], length 68: HTTP: GET /20MB HTTP/1.1
06:18:28.925416 IP 192.168.20.4.80 > 192.168.20.3.42122: Flags [.], ack 137, win 509, options [nop,nop,TS val 4236718593 ecr 3965019170], length 0
06:18:28.925802 IP 192.168.20.4.80 > 192.168.20.3.42122: Flags [.], seq 20267:23163, ack 137, win 509, options [nop,nop,TS val 4236718593 ecr 3965019170], length 2896: HTTP: HTTP/1.1 206 Partial Content
06:18:28.925818 IP 192.168.20.3.42122 > 192.168.20.4.80: Flags [.], ack 23163, win 569, options [nop,nop,TS val 3965019171 ecr 4236718593], length 0
06:18:28.925864 IP 192.168.20.4.80 > 192.168.20.3.42122: Flags [.], seq 23163:31851, ack 137, win 509, options [nop,nop,TS val 4236718593 ecr 3965019170], length 8688: HTTP
06:18:28.925871 IP 192.168.20.3.42122 > 192.168.20.4.80: Flags [.], ack 31851, win 705, options [nop,nop,TS val 3965019171 ecr 4236718593], length 0
06:18:28.925908 IP 192.168.20.4.80 > 192.168.20.3.42122: Flags [P.], seq 31851:33299, ack 137, win 509, options [nop,nop,TS val 4236718593 ecr 3965019170], length 1448: HTTP
06:18:28.925909 IP 192.168.20.4.80 > 192.168.20.3.42122: Flags [.], seq 33299:34747, ack 137, win 509, options [nop,nop,TS val 4236718593 ecr 3965019170], length 1448: HTTP
06:18:28.925964 IP 192.168.20.3.42122 > 192.168.20.4.80: Flags [.], ack 34747, win 705, options [nop,nop,TS val 3965019171 ecr 4236718593], length 0
06:18:28.925990 IP 192.168.20.4.80 > 192.168.20.3.42122: Flags [P.], seq 34747:40533, ack 137, win 509, options [nop,nop,TS val 4236718593 ecr 3965019170], length 5786: HTTP
06:18:28.926005 IP 192.168.20.3.42122 > 192.168.20.4.80: Flags [.], ack 40533, win 745, options [nop,nop,TS val 3965019171 ecr 4236718593], length 0
06:18:28.926174 IP 192.168.20.3.42122 > 192.168.20.4.80: Flags [P.], seq 137:207, ack 40533, win 745, options [nop,nop,TS val 3965019171 ecr 4236718593], length 70: HTTP: GET /20MB HTTP/1.1
06:18:28.926365 IP 192.168.20.4.80 > 192.168.20.3.42122: Flags [.], ack 207, win 509, options [nop,nop,TS val 4236718594 ecr 3965019171], length 0
06:18:28.926838 IP 192.168.20.4.80 > 192.168.20.3.42122: Flags [.], seq 40533:44877, ack 207, win 509, options [nop,nop,TS val 4236718594 ecr 3965019171], length 4344: HTTP: HTTP/1.1 206 Partial Content
06:18:28.926851 IP 192.168.20.3.42122 > 192.168.20.4.80: Flags [.], ack 44877, win 754, options [nop,nop,TS val 3965019172 ecr 4236718594], length 0
06:18:28.926882 IP 192.168.20.4.80 > 192.168.20.3.42122: Flags [.], seq 44877:50669, ack 207, win 509, options [nop,nop,TS val 4236718594 ecr 3965019171], length 5792: HTTP
06:18:28.926902 IP 192.168.20.3.42122 > 192.168.20.4.80: Flags [.], ack 50669, win 754, options [nop,nop,TS val 3965019172 ecr 4236718594], length 0
06:18:28.926938 IP 192.168.20.4.80 > 192.168.20.3.42122: Flags [.], seq 50669:56461, ack 207, win 509, options [nop,nop,TS val 4236718594 ecr 3965019171], length 5792: HTTP
06:18:28.926958 IP 192.168.20.3.42122 > 192.168.20.4.80: Flags [.], ack 56461, win 754, options [nop,nop,TS val 3965019172 ecr 4236718594], length 0
06:18:28.926989 IP 192.168.20.4.80 > 192.168.20.3.42122: Flags [P.], seq 56461:60801, ack 207, win 509, options [nop,nop,TS val 4236718594 ecr 3965019171], length 4340: HTTP
06:18:28.926997 IP 192.168.20.3.42122 > 192.168.20.4.80: Flags [.], ack 60801, win 822, options [nop,nop,TS val 3965019172 ecr 4236718594], length 0
06:18:28.927314 IP 192.168.20.3.42122 > 192.168.20.4.80: Flags [P.], seq 207:277, ack 60801, win 822, options [nop,nop,TS val 3965019172 ecr 4236718594], length 70: HTTP: GET /20MB HTTP/1.1
06:18:28.927728 IP 192.168.20.4.80 > 192.168.20.3.42122: Flags [.], ack 277, win 509, options [nop,nop,TS val 4236718595 ecr 3965019172], length 0
06:18:28.933428 IP 192.168.20.4.80 > 192.168.20.3.42122: Flags [.], seq 60801:66593, ack 277, win 509, options [nop,nop,TS val 4236718601 ecr 3965019172], length 5792: HTTP: HTTP/1.1 206 Partial Content
06:18:28.933437 IP 192.168.20.3.42122 > 192.168.20.4.80: Flags [.], ack 66593, win 913, options [nop,nop,TS val 3965019178 ecr 4236718601], length 0
06:18:28.933464 IP 192.168.20.4.80 > 192.168.20.3.42122: Flags [.], seq 66593:72385, ack 277, win 509, options [nop,nop,TS val 4236718601 ecr 3965019172], length 5792: HTTP
06:18:28.933472 IP 192.168.20.3.42122 > 192.168.20.4.80: Flags [.], ack 72385, win 1003, options [nop,nop,TS val 3965019178 ecr 4236718601], length 0
06:18:28.933548 IP 192.168.20.4.80 > 192.168.20.3.42122: Flags [.], seq 72385:79625, ack 277, win 509, options [nop,nop,TS val 4236718601 ecr 3965019172], length 7240: HTTP
06:18:28.933564 IP 192.168.20.3.42122 > 192.168.20.4.80: Flags [.], ack 79625, win 1116, options [nop,nop,TS val 3965019179 ecr 4236718601], length 0
06:18:28.933647 IP 192.168.20.4.80 > 192.168.20.3.42122: Flags [P.], seq 79625:81069, ack 277, win 509, options [nop,nop,TS val 4236718601 ecr 3965019172], length 1444: HTTP
06:18:28.934487 IP 192.168.20.3.42122 > 192.168.20.4.80: Flags [P.], seq 277:347, ack 81069, win 1139, options [nop,nop,TS val 3965019179 ecr 4236718601], length 70: HTTP: GET /20MB HTTP/1.1
06:18:28.934844 IP 192.168.20.4.80 > 192.168.20.3.42122: Flags [.], ack 347, win 509, options [nop,nop,TS val 4236718602 ecr 3965019179], length 0
06:18:28.935075 IP 192.168.20.4.80 > 192.168.20.3.42122: Flags [.], seq 81069:88309, ack 347, win 509, options [nop,nop,TS val 4236718602 ecr 3965019179], length 7240: HTTP: HTTP/1.1 206 Partial Content
06:18:28.935090 IP 192.168.20.3.42122 > 192.168.20.4.80: Flags [.], ack 88309, win 1252, options [nop,nop,TS val 3965019180 ecr 4236718602], length 0
06:18:28.935184 IP 192.168.20.4.80 > 192.168.20.3.42122: Flags [.], seq 88309:99893, ack 347, win 509, options [nop,nop,TS val 4236718602 ecr 3965019179], length 11584: HTTP
06:18:28.935200 IP 192.168.20.3.42122 > 192.168.20.4.80: Flags [.], ack 99893, win 1433, options [nop,nop,TS val 3965019180 ecr 4236718602], length 0
06:18:28.935271 IP 192.168.20.4.80 > 192.168.20.3.42122: Flags [P.], seq 99893:101337, ack 347, win 509, options [nop,nop,TS val 4236718602 ecr 3965019179], length 1444: HTTP
06:18:28.935444 IP 192.168.20.3.42122 > 192.168.20.4.80: Flags [P.], seq 347:417, ack 101337, win 1456, options [nop,nop,TS val 3965019180 ecr 4236718602], length 70: HTTP: GET /20MB HTTP/1.1
06:18:28.935793 IP 192.168.20.4.80 > 192.168.20.3.42122: Flags [.], ack 417, win 509, options [nop,nop,TS val 4236718603 ecr 3965019180], length 0
06:18:28.935998 IP 192.168.20.4.80 > 192.168.20.3.42122: Flags [.], seq 101337:104233, ack 417, win 509, options [nop,nop,TS val 4236718603 ecr 3965019180], length 2896: HTTP: HTTP/1.1 206 Partial Content
06:18:28.936006 IP 192.168.20.3.42122 > 192.168.20.4.80: Flags [.], ack 104233, win 1501, options [nop,nop,TS val 3965019181 ecr 4236718603], length 0
06:18:28.936057 IP 192.168.20.4.80 > 192.168.20.3.42122: Flags [.], seq 104233:110025, ack 417, win 509, options [nop,nop,TS val 4236718603 ecr 3965019180], length 5792: HTTP
06:18:28.936065 IP 192.168.20.3.42122 > 192.168.20.4.80: Flags [.], ack 110025, win 1592, options [nop,nop,TS val 3965019181 ecr 4236718603], length 0
06:18:28.936116 IP 192.168.20.4.80 > 192.168.20.3.42122: Flags [.], seq 110025:118713, ack 417, win 509, options [nop,nop,TS val 4236718603 ecr 3965019180], length 8688: HTTP
06:18:28.936123 IP 192.168.20.3.42122 > 192.168.20.4.80: Flags [.], ack 118713, win 1727, options [nop,nop,TS val 3965019181 ecr 4236718603], length 0
06:18:28.936182 IP 192.168.20.4.80 > 192.168.20.3.42122: Flags [P.], seq 118713:121605, ack 417, win 509, options [nop,nop,TS val 4236718603 ecr 3965019180], length 2892: HTTP
06:18:28.936191 IP 192.168.20.3.42122 > 192.168.20.4.80: Flags [.], ack 121605, win 1759, options [nop,nop,TS val 3965019181 ecr 4236718603], length 0
06:18:28.936438 IP 192.168.20.3.42122 > 192.168.20.4.80: Flags [P.], seq 417:487, ack 121605, win 1759, options [nop,nop,TS val 3965019181 ecr 4236718603], length 70: HTTP: GET /20MB HTTP/1.1
06:18:28.936972 IP 192.168.20.4.80 > 192.168.20.3.42122: Flags [.], ack 487, win 509, options [nop,nop,TS val 4236718604 ecr 3965019181], length 0
06:18:28.937192 IP 192.168.20.4.80 > 192.168.20.3.42122: Flags [.], seq 121605:125949, ack 487, win 509, options [nop,nop,TS val 4236718604 ecr 3965019181], length 4344: HTTP: HTTP/1.1 206 Partial Content
06:18:28.937199 IP 192.168.20.3.42122 > 192.168.20.4.80: Flags [.], ack 125949, win 1804, options [nop,nop,TS val 3965019182 ecr 4236718604], length 0
06:18:28.937239 IP 192.168.20.4.80 > 192.168.20.3.42122: Flags [.], seq 125949:131741, ack 487, win 509, options [nop,nop,TS val 4236718604 ecr 3965019181], length 5792: HTTP
06:18:28.937278 IP 192.168.20.3.42122 > 192.168.20.4.80: Flags [.], ack 131741, win 1804, options [nop,nop,TS val 3965019182 ecr 4236718604], length 0
06:18:28.937295 IP 192.168.20.4.80 > 192.168.20.3.42122: Flags [.], seq 131741:138981, ack 487, win 509, options [nop,nop,TS val 4236718604 ecr 3965019181], length 7240: HTTP
06:18:28.937319 IP 192.168.20.3.42122 > 192.168.20.4.80: Flags [.], ack 138981, win 1804, options [nop,nop,TS val 3965019182 ecr 4236718604], length 0
06:18:28.937344 IP 192.168.20.4.80 > 192.168.20.3.42122: Flags [P.], seq 138981:141873, ack 487, win 509, options [nop,nop,TS val 4236718604 ecr 3965019181], length 2892: HTTP
06:18:28.937351 IP 192.168.20.3.42122 > 192.168.20.4.80: Flags [.], ack 141873, win 1813, options [nop,nop,TS val 3965019182 ecr 4236718604], length 0
06:18:28.937561 IP 192.168.20.3.42122 > 192.168.20.4.80: Flags [P.], seq 487:557, ack 141873, win 1813, options [nop,nop,TS val 3965019183 ecr 4236718604], length 70: HTTP: GET /20MB HTTP/1.1
06:18:28.937859 IP 192.168.20.4.80 > 192.168.20.3.42122: Flags [.], ack 557, win 509, options [nop,nop,TS val 4236718605 ecr 3965019183], length 0
06:18:28.938206 IP 192.168.20.4.80 > 192.168.20.3.42122: Flags [.], seq 141873:150561, ack 557, win 509, options [nop,nop,TS val 4236718605 ecr 3965019183], length 8688: HTTP: HTTP/1.1 206 Partial Content
06:18:28.938280 IP 192.168.20.4.80 > 192.168.20.3.42122: Flags [.], seq 150561:159249, ack 557, win 509, options [nop,nop,TS val 4236718605 ecr 3965019183], length 8688: HTTP
06:18:28.938287 IP 192.168.20.3.42122 > 192.168.20.4.80: Flags [.], ack 150561, win 1813, options [nop,nop,TS val 3965019183 ecr 4236718605], length 0
06:18:28.938311 IP 192.168.20.4.80 > 192.168.20.3.42122: Flags [P.], seq 159249:162141, ack 557, win 509, options [nop,nop,TS val 4236718605 ecr 3965019183], length 2892: HTTP
06:18:28.938316 IP 192.168.20.3.42122 > 192.168.20.4.80: Flags [.], ack 159249, win 1813, options [nop,nop,TS val 3965019183 ecr 4236718605], length 0
06:18:28.938331 IP 192.168.20.3.42122 > 192.168.20.4.80: Flags [.], ack 162141, win 1813, options [nop,nop,TS val 3965019183 ecr 4236718605], length 0
06:18:28.938668 IP 192.168.20.3.42122 > 192.168.20.4.80: Flags [P.], seq 557:627, ack 162141, win 1813, options [nop,nop,TS val 3965019184 ecr 4236718605], length 70: HTTP: GET /20MB HTTP/1.1
06:18:28.938965 IP 192.168.20.4.80 > 192.168.20.3.42122: Flags [.], ack 627, win 509, options [nop,nop,TS val 4236718606 ecr 3965019184], length 0
06:18:28.939234 IP 192.168.20.4.80 > 192.168.20.3.42122: Flags [.], seq 162141:163589, ack 627, win 509, options [nop,nop,TS val 4236718606 ecr 3965019184], length 1448: HTTP: HTTP/1.1 206 Partial Content
06:18:28.939287 IP 192.168.20.4.80 > 192.168.20.3.42122: Flags [.], seq 163589:169381, ack 627, win 509, options [nop,nop,TS val 4236718606 ecr 3965019184], length 5792: HTTP
06:18:28.939308 IP 192.168.20.3.42122 > 192.168.20.4.80: Flags [.], ack 169381, win 1822, options [nop,nop,TS val 3965019184 ecr 4236718606], length 0
06:18:28.939342 IP 192.168.20.4.80 > 192.168.20.3.42122: Flags [.], seq 169381:176621, ack 627, win 509, options [nop,nop,TS val 4236718606 ecr 3965019184], length 7240: HTTP
06:18:28.939373 IP 192.168.20.3.42122 > 192.168.20.4.80: Flags [.], ack 176621, win 1822, options [nop,nop,TS val 3965019184 ecr 4236718606], length 0
06:18:28.939387 IP 192.168.20.4.80 > 192.168.20.3.42122: Flags [.], seq 176621:180965, ack 627, win 509, options [nop,nop,TS val 4236718606 ecr 3965019184], length 4344: HTTP
06:18:28.939415 IP 192.168.20.3.42122 > 192.168.20.4.80: Flags [.], ack 180965, win 1822, options [nop,nop,TS val 3965019184 ecr 4236718606], length 0
06:18:28.939435 IP 192.168.20.4.80 > 192.168.20.3.42122: Flags [P.], seq 180965:182409, ack 627, win 509, options [nop,nop,TS val 4236718606 ecr 3965019184], length 1444: HTTP
06:18:28.939553 IP 192.168.20.3.42122 > 192.168.20.4.80: Flags [P.], seq 627:697, ack 182409, win 1822, options [nop,nop,TS val 3965019185 ecr 4236718606], length 70: HTTP: GET /20MB HTTP/1.1
06:18:28.939865 IP 192.168.20.4.80 > 192.168.20.3.42122: Flags [.], ack 697, win 509, options [nop,nop,TS val 4236718607 ecr 3965019185], length 0
06:18:28.940093 IP 192.168.20.4.80 > 192.168.20.3.42122: Flags [.], seq 182409:185305, ack 697, win 509, options [nop,nop,TS val 4236718607 ecr 3965019185], length 2896: HTTP: HTTP/1.1 206 Partial Content
06:18:28.940111 IP 192.168.20.3.42122 > 192.168.20.4.80: Flags [.], ack 185305, win 1822, options [nop,nop,TS val 3965019185 ecr 4236718607], length 0
06:18:28.940145 IP 192.168.20.4.80 > 192.168.20.3.42122: Flags [.], seq 185305:191097, ack 697, win 509, options [nop,nop,TS val 4236718607 ecr 3965019185], length 5792: HTTP
06:18:28.940183 IP 192.168.20.3.42122 > 192.168.20.4.80: Flags [.], ack 191097, win 1822, options [nop,nop,TS val 3965019185 ecr 4236718607], length 0
06:18:28.940197 IP 192.168.20.4.80 > 192.168.20.3.42122: Flags [.], seq 191097:196889, ack 697, win 509, options [nop,nop,TS val 4236718607 ecr 3965019185], length 5792: HTTP
06:18:28.940218 IP 192.168.20.3.42122 > 192.168.20.4.80: Flags [.], ack 196889, win 1822, options [nop,nop,TS val 3965019185 ecr 4236718607], length 0
06:18:28.940250 IP 192.168.20.4.80 > 192.168.20.3.42122: Flags [P.], seq 196889:202677, ack 697, win 509, options [nop,nop,TS val 4236718607 ecr 3965019185], length 5788: HTTP
06:18:28.940270 IP 192.168.20.3.42122 > 192.168.20.4.80: Flags [.], ack 202677, win 1822, options [nop,nop,TS val 3965019185 ecr 4236718607], length 0
06:18:28.940352 IP 192.168.20.3.42122 > 192.168.20.4.80: Flags [P.], seq 697:767, ack 202677, win 1822, options [nop,nop,TS val 3965019185 ecr 4236718607], length 70: HTTP: GET /20MB HTTP/1.1
06:18:28.940691 IP 192.168.20.4.80 > 192.168.20.3.42122: Flags [.], ack 767, win 509, options [nop,nop,TS val 4236718608 ecr 3965019185], length 0
06:18:28.940919 IP 192.168.20.4.80 > 192.168.20.3.42122: Flags [.], seq 202677:207021, ack 767, win 509, options [nop,nop,TS val 4236718608 ecr 3965019185], length 4344: HTTP: HTTP/1.1 206 Partial Content
06:18:28.940971 IP 192.168.20.4.80 > 192.168.20.3.42122: Flags [.], seq 207021:212813, ack 767, win 509, options [nop,nop,TS val 4236718608 ecr 3965019185], length 5792: HTTP
06:18:28.941020 IP 192.168.20.4.80 > 192.168.20.3.42122: Flags [.], seq 212813:218605, ack 767, win 509, options [nop,nop,TS val 4236718608 ecr 3965019185], length 5792: HTTP
06:18:28.941067 IP 192.168.20.4.80 > 192.168.20.3.42122: Flags [.], seq 218605:220053, ack 767, win 509, options [nop,nop,TS val 4236718608 ecr 3965019185], length 1448: HTTP
06:18:28.941123 IP 192.168.20.4.80 > 192.168.20.3.42122: Flags [P.], seq 220053:222945, ack 767, win 509, options [nop,nop,TS val 4236718608 ecr 3965019185], length 2892: HTTP
06:18:28.941125 IP 192.168.20.3.42122 > 192.168.20.4.80: Flags [.], ack 220053, win 1822, options [nop,nop,TS val 3965019186 ecr 4236718608], length 0
06:18:28.941158 IP 192.168.20.3.42122 > 192.168.20.4.80: Flags [.], ack 222945, win 1822, options [nop,nop,TS val 3965019186 ecr 4236718608], length 0
06:18:28.941267 IP 192.168.20.3.42122 > 192.168.20.4.80: Flags [P.], seq 767:837, ack 222945, win 1822, options [nop,nop,TS val 3965019186 ecr 4236718608], length 70: HTTP: GET /20MB HTTP/1.1
06:18:28.941525 IP 192.168.20.4.80 > 192.168.20.3.42122: Flags [.], ack 837, win 509, options [nop,nop,TS val 4236718609 ecr 3965019186], length 0
06:18:28.941768 IP 192.168.20.4.80 > 192.168.20.3.42122: Flags [.], seq 222945:227289, ack 837, win 509, options [nop,nop,TS val 4236718609 ecr 3965019186], length 4344: HTTP: HTTP/1.1 206 Partial Content
06:18:28.941820 IP 192.168.20.4.80 > 192.168.20.3.42122: Flags [.], seq 227289:234529, ack 837, win 509, options [nop,nop,TS val 4236718609 ecr 3965019186], length 7240: HTTP
06:18:28.941839 IP 192.168.20.3.42122 > 192.168.20.4.80: Flags [.], ack 227289, win 1789, options [nop,nop,TS val 3965019187 ecr 4236718609], length 0
06:18:28.941861 IP 192.168.20.3.42122 > 192.168.20.4.80: Flags [.], ack 234529, win 1822, options [nop,nop,TS val 3965019187 ecr 4236718609], length 0
06:18:28.941869 IP 192.168.20.4.80 > 192.168.20.3.42122: Flags [.], seq 234529:240321, ack 837, win 509, options [nop,nop,TS val 4236718609 ecr 3965019186], length 5792: HTTP
06:18:28.941887 IP 192.168.20.3.42122 > 192.168.20.4.80: Flags [.], ack 240321, win 1822, options [nop,nop,TS val 3965019187 ecr 4236718609], length 0
06:18:28.941927 IP 192.168.20.4.80 > 192.168.20.3.42122: Flags [P.], seq 240321:243213, ack 837, win 509, options [nop,nop,TS val 4236718609 ecr 3965019186], length 2892: HTTP
06:18:28.941958 IP 192.168.20.3.42122 > 192.168.20.4.80: Flags [.], ack 243213, win 1822, options [nop,nop,TS val 3965019187 ecr 4236718609], length 0
06:18:28.942111 IP 192.168.20.3.42122 > 192.168.20.4.80: Flags [P.], seq 837:907, ack 243213, win 1822, options [nop,nop,TS val 3965019187 ecr 4236718609], length 70: HTTP: GET /20MB HTTP/1.1
06:18:28.942445 IP 192.168.20.4.80 > 192.168.20.3.42122: Flags [.], ack 907, win 509, options [nop,nop,TS val 4236718610 ecr 3965019187], length 0
06:18:28.942753 IP 192.168.20.4.80 > 192.168.20.3.42122: Flags [.], seq 243213:244661, ack 907, win 509, options [nop,nop,TS val 4236718610 ecr 3965019187], length 1448: HTTP: HTTP/1.1 206 Partial Content
06:18:28.942811 IP 192.168.20.4.80 > 192.168.20.3.42122: Flags [.], seq 244661:250453, ack 907, win 509, options [nop,nop,TS val 4236718610 ecr 3965019187], length 5792: HTTP
06:18:28.942837 IP 192.168.20.3.42122 > 192.168.20.4.80: Flags [.], ack 250453, win 1822, options [nop,nop,TS val 3965019188 ecr 4236718610], length 0
06:18:28.942858 IP 192.168.20.4.80 > 192.168.20.3.42122: Flags [.], seq 250453:257693, ack 907, win 509, options [nop,nop,TS val 4236718610 ecr 3965019187], length 7240: HTTP
06:18:28.942880 IP 192.168.20.3.42122 > 192.168.20.4.80: Flags [.], ack 257693, win 1822, options [nop,nop,TS val 3965019188 ecr 4236718610], length 0
06:18:28.942906 IP 192.168.20.4.80 > 192.168.20.3.42122: Flags [.], seq 257693:262037, ack 907, win 509, options [nop,nop,TS val 4236718610 ecr 3965019187], length 4344: HTTP
06:18:28.942952 IP 192.168.20.4.80 > 192.168.20.3.42122: Flags [P.], seq 262037:263481, ack 907, win 509, options [nop,nop,TS val 4236718610 ecr 3965019187], length 1444: HTTP
06:18:28.942988 IP 192.168.20.3.42122 > 192.168.20.4.80: Flags [.], ack 263481, win 1822, options [nop,nop,TS val 3965019188 ecr 4236718610], length 0
06:18:28.943071 IP 192.168.20.3.42122 > 192.168.20.4.80: Flags [P.], seq 907:977, ack 263481, win 1822, options [nop,nop,TS val 3965019188 ecr 4236718610], length 70: HTTP: GET /20MB HTTP/1.1
06:18:28.943646 IP 192.168.20.4.80 > 192.168.20.3.42122: Flags [.], seq 263481:267825, ack 977, win 509, options [nop,nop,TS val 4236718611 ecr 3965019188], length 4344: HTTP: HTTP/1.1 206 Partial Content
06:18:28.943683 IP 192.168.20.3.42122 > 192.168.20.4.80: Flags [.], ack 267825, win 1822, options [nop,nop,TS val 3965019189 ecr 4236718611], length 0
06:18:28.943700 IP 192.168.20.4.80 > 192.168.20.3.42122: Flags [.], seq 267825:273617, ack 977, win 509, options [nop,nop,TS val 4236718611 ecr 3965019188], length 5792: HTTP
06:18:28.943727 IP 192.168.20.3.42122 > 192.168.20.4.80: Flags [.], ack 273617, win 1822, options [nop,nop,TS val 3965019189 ecr 4236718611], length 0
06:18:28.943746 IP 192.168.20.4.80 > 192.168.20.3.42122: Flags [.], seq 273617:279409, ack 977, win 509, options [nop,nop,TS val 4236718611 ecr 3965019188], length 5792: HTTP
06:18:28.943785 IP 192.168.20.3.42122 > 192.168.20.4.80: Flags [.], ack 279409, win 1822, options [nop,nop,TS val 3965019189 ecr 4236718611], length 0
06:18:28.943793 IP 192.168.20.4.80 > 192.168.20.3.42122: Flags [.], seq 279409:282305, ack 977, win 509, options [nop,nop,TS val 4236718611 ecr 3965019188], length 2896: HTTP
06:18:28.943814 IP 192.168.20.3.42122 > 192.168.20.4.80: Flags [.], ack 282305, win 1822, options [nop,nop,TS val 3965019189 ecr 4236718611], length 0
06:18:28.943843 IP 192.168.20.4.80 > 192.168.20.3.42122: Flags [P.], seq 282305:283749, ack 977, win 509, options [nop,nop,TS val 4236718611 ecr 3965019188], length 1444: HTTP
06:18:28.943941 IP 192.168.20.3.42122 > 192.168.20.4.80: Flags [P.], seq 977:1047, ack 283749, win 1822, options [nop,nop,TS val 3965019189 ecr 4236718611], length 70: HTTP: GET /20MB HTTP/1.1
06:18:28.944522 IP 192.168.20.4.80 > 192.168.20.3.42122: Flags [.], seq 283749:285197, ack 1047, win 509, options [nop,nop,TS val 4236718612 ecr 3965019189], length 1448: HTTP: HTTP/1.1 206 Partial Content
06:18:28.944574 IP 192.168.20.4.80 > 192.168.20.3.42122: Flags [.], seq 285197:290989, ack 1047, win 509, options [nop,nop,TS val 4236718612 ecr 3965019189], length 5792: HTTP
06:18:28.944593 IP 192.168.20.3.42122 > 192.168.20.4.80: Flags [.], ack 290989, win 1822, options [nop,nop,TS val 3965019190 ecr 4236718612], length 0
06:18:28.944626 IP 192.168.20.4.80 > 192.168.20.3.42122: Flags [.], seq 290989:296781, ack 1047, win 509, options [nop,nop,TS val 4236718612 ecr 3965019189], length 5792: HTTP
06:18:28.944643 IP 192.168.20.3.42122 > 192.168.20.4.80: Flags [.], ack 296781, win 1822, options [nop,nop,TS val 3965019190 ecr 4236718612], length 0
06:18:28.944673 IP 192.168.20.4.80 > 192.168.20.3.42122: Flags [.], seq 296781:302573, ack 1047, win 509, options [nop,nop,TS val 4236718612 ecr 3965019189], length 5792: HTTP
06:18:28.944686 IP 192.168.20.3.42122 > 192.168.20.4.80: Flags [.], ack 302573, win 1822, options [nop,nop,TS val 3965019190 ecr 4236718612], length 0
06:18:28.944721 IP 192.168.20.4.80 > 192.168.20.3.42122: Flags [P.], seq 302573:304017, ack 1047, win 509, options [nop,nop,TS val 4236718612 ecr 3965019189], length 1444: HTTP
06:18:28.944978 IP 192.168.20.3.42122 > 192.168.20.4.80: Flags [P.], seq 1047:1117, ack 304017, win 1822, options [nop,nop,TS val 3965019190 ecr 4236718612], length 70: HTTP: GET /20MB HTTP/1.1
06:18:28.945401 IP 192.168.20.4.80 > 192.168.20.3.42122: Flags [.], seq 304017:308361, ack 1117, win 509, options [nop,nop,TS val 4236718613 ecr 3965019190], length 4344: HTTP: HTTP/1.1 206 Partial Content
06:18:28.945424 IP 192.168.20.3.42122 > 192.168.20.4.80: Flags [.], ack 308361, win 1822, options [nop,nop,TS val 3965019190 ecr 4236718613], length 0
06:18:28.945452 IP 192.168.20.4.80 > 192.168.20.3.42122: Flags [.], seq 308361:314153, ack 1117, win 509, options [nop,nop,TS val 4236718613 ecr 3965019190], length 5792: HTTP
06:18:28.945472 IP 192.168.20.3.42122 > 192.168.20.4.80: Flags [.], ack 314153, win 1822, options [nop,nop,TS val 3965019190 ecr 4236718613], length 0
06:18:28.945502 IP 192.168.20.4.80 > 192.168.20.3.42122: Flags [.], seq 314153:319945, ack 1117, win 509, options [nop,nop,TS val 4236718613 ecr 3965019190], length 5792: HTTP
06:18:28.945520 IP 192.168.20.3.42122 > 192.168.20.4.80: Flags [.], ack 319945, win 1822, options [nop,nop,TS val 3965019190 ecr 4236718613], length 0
06:18:28.945553 IP 192.168.20.4.80 > 192.168.20.3.42122: Flags [.], seq 319945:321393, ack 1117, win 509, options [nop,nop,TS val 4236718613 ecr 3965019190], length 1448: HTTP
06:18:28.945602 IP 192.168.20.4.80 > 192.168.20.3.42122: Flags [P.], seq 321393:324285, ack 1117, win 509, options [nop,nop,TS val 4236718613 ecr 3965019190], length 2892: HTTP
06:18:28.945612 IP 192.168.20.3.42122 > 192.168.20.4.80: Flags [.], ack 324285, win 1822, options [nop,nop,TS val 3965019191 ecr 4236718613], length 0
06:18:28.945670 IP 192.168.20.3.42122 > 192.168.20.4.80: Flags [P.], seq 1117:1187, ack 324285, win 1822, options [nop,nop,TS val 3965019191 ecr 4236718613], length 70: HTTP: GET /20MB HTTP/1.1
06:18:28.946244 IP 192.168.20.4.80 > 192.168.20.3.42122: Flags [.], seq 324285:325733, ack 1187, win 509, options [nop,nop,TS val 4236718613 ecr 3965019191], length 1448: HTTP: HTTP/1.1 206 Partial Content
06:18:28.946297 IP 192.168.20.4.80 > 192.168.20.3.42122: Flags [.], seq 325733:331525, ack 1187, win 509, options [nop,nop,TS val 4236718613 ecr 3965019191], length 5792: HTTP
06:18:28.946323 IP 192.168.20.3.42122 > 192.168.20.4.80: Flags [.], ack 331525, win 1822, options [nop,nop,TS val 3965019191 ecr 4236718613], length 0
06:18:28.946347 IP 192.168.20.4.80 > 192.168.20.3.42122: Flags [.], seq 331525:337317, ack 1187, win 509, options [nop,nop,TS val 4236718613 ecr 3965019191], length 5792: HTTP
06:18:28.946368 IP 192.168.20.3.42122 > 192.168.20.4.80: Flags [.], ack 337317, win 1822, options [nop,nop,TS val 3965019191 ecr 4236718613], length 0
06:18:28.946398 IP 192.168.20.4.80 > 192.168.20.3.42122: Flags [.], seq 337317:343109, ack 1187, win 509, options [nop,nop,TS val 4236718613 ecr 3965019191], length 5792: HTTP
06:18:28.946414 IP 192.168.20.3.42122 > 192.168.20.4.80: Flags [.], ack 343109, win 1822, options [nop,nop,TS val 3965019191 ecr 4236718613], length 0
06:18:28.946444 IP 192.168.20.4.80 > 192.168.20.3.42122: Flags [P.], seq 343109:344553, ack 1187, win 509, options [nop,nop,TS val 4236718613 ecr 3965019191], length 1444: HTTP
06:18:28.946513 IP 192.168.20.3.42122 > 192.168.20.4.80: Flags [P.], seq 1187:1257, ack 344553, win 1822, options [nop,nop,TS val 3965019191 ecr 4236718613], length 70: HTTP: GET /20MB HTTP/1.1
06:18:28.947200 IP 192.168.20.4.80 > 192.168.20.3.42122: Flags [.], seq 344553:348897, ack 1257, win 509, options [nop,nop,TS val 4236718614 ecr 3965019191], length 4344: HTTP: HTTP/1.1 206 Partial Content
06:18:28.947220 IP 192.168.20.3.42122 > 192.168.20.4.80: Flags [.], ack 348897, win 1822, options [nop,nop,TS val 3965019192 ecr 4236718614], length 0
06:18:28.947248 IP 192.168.20.4.80 > 192.168.20.3.42122: Flags [.], seq 348897:354689, ack 1257, win 509, options [nop,nop,TS val 4236718614 ecr 3965019191], length 5792: HTTP
06:18:28.947262 IP 192.168.20.3.42122 > 192.168.20.4.80: Flags [.], ack 354689, win 1822, options [nop,nop,TS val 3965019192 ecr 4236718614], length 0
06:18:28.947301 IP 192.168.20.4.80 > 192.168.20.3.42122: Flags [.], seq 354689:360481, ack 1257, win 509, options [nop,nop,TS val 4236718614 ecr 3965019191], length 5792: HTTP
06:18:28.947313 IP 192.168.20.3.42122 > 192.168.20.4.80: Flags [.], ack 360481, win 1822, options [nop,nop,TS val 3965019192 ecr 4236718614], length 0
06:18:28.947345 IP 192.168.20.4.80 > 192.168.20.3.42122: Flags [.], seq 360481:361929, ack 1257, win 509, options [nop,nop,TS val 4236718614 ecr 3965019191], length 1448: HTTP
06:18:28.947396 IP 192.168.20.4.80 > 192.168.20.3.42122: Flags [P.], seq 361929:364821, ack 1257, win 509, options [nop,nop,TS val 4236718614 ecr 3965019191], length 2892: HTTP
06:18:28.947406 IP 192.168.20.3.42122 > 192.168.20.4.80: Flags [.], ack 364821, win 1822, options [nop,nop,TS val 3965019192 ecr 4236718614], length 0
06:18:28.947687 IP 192.168.20.3.42122 > 192.168.20.4.80: Flags [P.], seq 1257:1327, ack 364821, win 1822, options [nop,nop,TS val 3965019193 ecr 4236718614], length 70: HTTP: GET /20MB HTTP/1.1
06:18:28.948089 IP 192.168.20.4.80 > 192.168.20.3.42122: Flags [.], seq 364821:366269, ack 1327, win 509, options [nop,nop,TS val 4236718615 ecr 3965019193], length 1448: HTTP: HTTP/1.1 206 Partial Content
06:18:28.948147 IP 192.168.20.4.80 > 192.168.20.3.42122: Flags [.], seq 366269:372061, ack 1327, win 509, options [nop,nop,TS val 4236718615 ecr 3965019193], length 5792: HTTP
06:18:28.948163 IP 192.168.20.3.42122 > 192.168.20.4.80: Flags [.], ack 372061, win 1822, options [nop,nop,TS val 3965019193 ecr 4236718615], length 0
06:18:28.948193 IP 192.168.20.4.80 > 192.168.20.3.42122: Flags [.], seq 372061:377853, ack 1327, win 509, options [nop,nop,TS val 4236718615 ecr 3965019193], length 5792: HTTP
06:18:28.948211 IP 192.168.20.3.42122 > 192.168.20.4.80: Flags [.], ack 377853, win 1822, options [nop,nop,TS val 3965019193 ecr 4236718615], length 0
06:18:28.948241 IP 192.168.20.4.80 > 192.168.20.3.42122: Flags [.], seq 377853:383645, ack 1327, win 509, options [nop,nop,TS val 4236718615 ecr 3965019193], length 5792: HTTP
06:18:28.948262 IP 192.168.20.3.42122 > 192.168.20.4.80: Flags [.], ack 383645, win 1822, options [nop,nop,TS val 3965019193 ecr 4236718615], length 0
06:18:28.948288 IP 192.168.20.4.80 > 192.168.20.3.42122: Flags [P.], seq 383645:385089, ack 1327, win 509, options [nop,nop,TS val 4236718615 ecr 3965019193], length 1444: HTTP
06:18:28.948470 IP 192.168.20.3.42122 > 192.168.20.4.80: Flags [P.], seq 1327:1397, ack 385089, win 1822, options [nop,nop,TS val 3965019193 ecr 4236718615], length 70: HTTP: GET /20MB HTTP/1.1
06:18:28.949112 IP 192.168.20.4.80 > 192.168.20.3.42122: Flags [.], seq 385089:389433, ack 1397, win 509, options [nop,nop,TS val 4236718616 ecr 3965019193], length 4344: HTTP: HTTP/1.1 206 Partial Content
06:18:28.949129 IP 192.168.20.3.42122 > 192.168.20.4.80: Flags [.], ack 389433, win 1822, options [nop,nop,TS val 3965019194 ecr 4236718616], length 0
06:18:28.949169 IP 192.168.20.4.80 > 192.168.20.3.42122: Flags [.], seq 389433:395225, ack 1397, win 509, options [nop,nop,TS val 4236718616 ecr 3965019193], length 5792: HTTP
06:18:28.949183 IP 192.168.20.3.42122 > 192.168.20.4.80: Flags [.], ack 395225, win 1822, options [nop,nop,TS val 3965019194 ecr 4236718616], length 0
06:18:28.949214 IP 192.168.20.4.80 > 192.168.20.3.42122: Flags [.], seq 395225:401017, ack 1397, win 509, options [nop,nop,TS val 4236718616 ecr 3965019193], length 5792: HTTP
06:18:28.949232 IP 192.168.20.3.42122 > 192.168.20.4.80: Flags [.], ack 401017, win 1822, options [nop,nop,TS val 3965019194 ecr 4236718616], length 0
06:18:28.949261 IP 192.168.20.4.80 > 192.168.20.3.42122: Flags [.], seq 401017:402465, ack 1397, win 509, options [nop,nop,TS val 4236718616 ecr 3965019193], length 1448: HTTP
06:18:28.949310 IP 192.168.20.4.80 > 192.168.20.3.42122: Flags [P.], seq 402465:405357, ack 1397, win 509, options [nop,nop,TS val 4236718616 ecr 3965019193], length 2892: HTTP
06:18:28.949321 IP 192.168.20.3.42122 > 192.168.20.4.80: Flags [.], ack 405357, win 1822, options [nop,nop,TS val 3965019194 ecr 4236718616], length 0
06:18:28.949380 IP 192.168.20.3.42122 > 192.168.20.4.80: Flags [P.], seq 1397:1467, ack 405357, win 1822, options [nop,nop,TS val 3965019194 ecr 4236718616], length 70: HTTP: GET /20MB HTTP/1.1
06:18:28.949939 IP 192.168.20.4.80 > 192.168.20.3.42122: Flags [.], seq 405357:406805, ack 1467, win 509, options [nop,nop,TS val 4236718617 ecr 3965019194], length 1448: HTTP: HTTP/1.1 206 Partial Content
06:18:28.949995 IP 192.168.20.4.80 > 192.168.20.3.42122: Flags [.], seq 406805:412597, ack 1467, win 509, options [nop,nop,TS val 4236718617 ecr 3965019194], length 5792: HTTP
06:18:28.950007 IP 192.168.20.3.42122 > 192.168.20.4.80: Flags [.], ack 412597, win 1822, options [nop,nop,TS val 3965019195 ecr 4236718617], length 0
06:18:28.950050 IP 192.168.20.4.80 > 192.168.20.3.42122: Flags [.], seq 412597:418389, ack 1467, win 509, options [nop,nop,TS val 4236718617 ecr 3965019194], length 5792: HTTP
06:18:28.950081 IP 192.168.20.3.42122 > 192.168.20.4.80: Flags [.], ack 418389, win 1822, options [nop,nop,TS val 3965019195 ecr 4236718617], length 0
06:18:28.950099 IP 192.168.20.4.80 > 192.168.20.3.42122: Flags [.], seq 418389:424181, ack 1467, win 509, options [nop,nop,TS val 4236718617 ecr 3965019194], length 5792: HTTP
06:18:28.950115 IP 192.168.20.3.42122 > 192.168.20.4.80: Flags [.], ack 424181, win 1822, options [nop,nop,TS val 3965019195 ecr 4236718617], length 0
06:18:28.950142 IP 192.168.20.4.80 > 192.168.20.3.42122: Flags [P.], seq 424181:425625, ack 1467, win 509, options [nop,nop,TS val 4236718617 ecr 3965019194], length 1444: HTTP
06:18:28.950361 IP 192.168.20.3.42122 > 192.168.20.4.80: Flags [P.], seq 1467:1537, ack 425625, win 1822, options [nop,nop,TS val 3965019195 ecr 4236718617], length 70: HTTP: GET /20MB HTTP/1.1
06:18:28.950994 IP 192.168.20.4.80 > 192.168.20.3.42122: Flags [.], seq 425625:429969, ack 1537, win 509, options [nop,nop,TS val 4236718618 ecr 3965019195], length 4344: HTTP: HTTP/1.1 206 Partial Content
06:18:28.951015 IP 192.168.20.3.42122 > 192.168.20.4.80: Flags [.], ack 429969, win 1822, options [nop,nop,TS val 3965019196 ecr 4236718618], length 0
06:18:28.951045 IP 192.168.20.4.80 > 192.168.20.3.42122: Flags [.], seq 429969:435761, ack 1537, win 509, options [nop,nop,TS val 4236718618 ecr 3965019195], length 5792: HTTP
06:18:28.951093 IP 192.168.20.4.80 > 192.168.20.3.42122: Flags [.], seq 435761:441553, ack 1537, win 509, options [nop,nop,TS val 4236718618 ecr 3965019195], length 5792: HTTP
06:18:28.951095 IP 192.168.20.3.42122 > 192.168.20.4.80: Flags [.], ack 435761, win 1822, options [nop,nop,TS val 3965019196 ecr 4236718618], length 0
06:18:28.951110 IP 192.168.20.3.42122 > 192.168.20.4.80: Flags [.], ack 441553, win 1822, options [nop,nop,TS val 3965019196 ecr 4236718618], length 0
06:18:28.951141 IP 192.168.20.4.80 > 192.168.20.3.42122: Flags [.], seq 441553:443001, ack 1537, win 509, options [nop,nop,TS val 4236718618 ecr 3965019195], length 1448: HTTP
06:18:28.951195 IP 192.168.20.4.80 > 192.168.20.3.42122: Flags [P.], seq 443001:445893, ack 1537, win 509, options [nop,nop,TS val 4236718618 ecr 3965019195], length 2892: HTTP
06:18:28.951224 IP 192.168.20.3.42122 > 192.168.20.4.80: Flags [.], ack 445893, win 1822, options [nop,nop,TS val 3965019196 ecr 4236718618], length 0
06:18:28.951492 IP 192.168.20.3.42122 > 192.168.20.4.80: Flags [P.], seq 1537:1607, ack 445893, win 1822, options [nop,nop,TS val 3965019196 ecr 4236718618], length 70: HTTP: GET /20MB HTTP/1.1
06:18:28.952269 IP 192.168.20.4.80 > 192.168.20.3.42122: Flags [.], seq 445893:447341, ack 1607, win 509, options [nop,nop,TS val 4236718620 ecr 3965019196], length 1448: HTTP: HTTP/1.1 206 Partial Content
06:18:28.952321 IP 192.168.20.4.80 > 192.168.20.3.42122: Flags [.], seq 447341:453133, ack 1607, win 509, options [nop,nop,TS val 4236718620 ecr 3965019196], length 5792: HTTP
06:18:28.952339 IP 192.168.20.3.42122 > 192.168.20.4.80: Flags [.], ack 453133, win 1822, options [nop,nop,TS val 3965019197 ecr 4236718620], length 0
06:18:28.952370 IP 192.168.20.4.80 > 192.168.20.3.42122: Flags [.], seq 453133:458925, ack 1607, win 509, options [nop,nop,TS val 4236718620 ecr 3965019196], length 5792: HTTP
06:18:28.952381 IP 192.168.20.3.42122 > 192.168.20.4.80: Flags [.], ack 458925, win 1822, options [nop,nop,TS val 3965019197 ecr 4236718620], length 0
06:18:28.952420 IP 192.168.20.4.80 > 192.168.20.3.42122: Flags [.], seq 458925:464717, ack 1607, win 509, options [nop,nop,TS val 4236718620 ecr 3965019196], length 5792: HTTP
06:18:28.952433 IP 192.168.20.3.42122 > 192.168.20.4.80: Flags [.], ack 464717, win 1822, options [nop,nop,TS val 3965019197 ecr 4236718620], length 0
06:18:28.952468 IP 192.168.20.4.80 > 192.168.20.3.42122: Flags [P.], seq 464717:466161, ack 1607, win 509, options [nop,nop,TS val 4236718620 ecr 3965019196], length 1444: HTTP
06:18:28.952534 IP 192.168.20.3.42122 > 192.168.20.4.80: Flags [P.], seq 1607:1677, ack 466161, win 1822, options [nop,nop,TS val 3965019198 ecr 4236718620], length 70: HTTP: GET /20MB HTTP/1.1
06:18:28.953159 IP 192.168.20.4.80 > 192.168.20.3.42122: Flags [.], seq 466161:470505, ack 1677, win 509, options [nop,nop,TS val 4236718620 ecr 3965019198], length 4344: HTTP: HTTP/1.1 206 Partial Content
06:18:28.953175 IP 192.168.20.3.42122 > 192.168.20.4.80: Flags [.], ack 470505, win 1822, options [nop,nop,TS val 3965019198 ecr 4236718620], length 0
06:18:28.953203 IP 192.168.20.4.80 > 192.168.20.3.42122: Flags [.], seq 470505:476297, ack 1677, win 509, options [nop,nop,TS val 4236718620 ecr 3965019198], length 5792: HTTP
06:18:28.953234 IP 192.168.20.3.42122 > 192.168.20.4.80: Flags [.], ack 476297, win 1822, options [nop,nop,TS val 3965019198 ecr 4236718620], length 0
06:18:28.953253 IP 192.168.20.4.80 > 192.168.20.3.42122: Flags [.], seq 476297:482089, ack 1677, win 509, options [nop,nop,TS val 4236718620 ecr 3965019198], length 5792: HTTP
06:18:28.953268 IP 192.168.20.3.42122 > 192.168.20.4.80: Flags [.], ack 482089, win 1822, options [nop,nop,TS val 3965019198 ecr 4236718620], length 0
06:18:28.953301 IP 192.168.20.4.80 > 192.168.20.3.42122: Flags [.], seq 482089:483537, ack 1677, win 509, options [nop,nop,TS val 4236718620 ecr 3965019198], length 1448: HTTP
06:18:28.953355 IP 192.168.20.4.80 > 192.168.20.3.42122: Flags [P.], seq 483537:486429, ack 1677, win 509, options [nop,nop,TS val 4236718620 ecr 3965019198], length 2892: HTTP
06:18:28.953366 IP 192.168.20.3.42122 > 192.168.20.4.80: Flags [.], ack 486429, win 1822, options [nop,nop,TS val 3965019198 ecr 4236718620], length 0
